,number,value,datetime_start,datetime_complete,duration,params_batch_size,params_buffer_size,params_exploration_final_eps,params_exploration_fraction,params_gamma,params_learning_starts,params_lr,params_net_arch,params_target_update_interval,state
210,210,795.44677734375,2021-06-16 18:11:11.719668,2021-06-16 18:13:38.434132,0 days 00:02:26.714464000,1024,50000,0.1146670481213054,0.4764325550681073,0.999,0,0.0013034682631178616,small,1,PRUNED
211,211,818.6427612304688,2021-06-16 18:12:11.321900,2021-06-16 18:14:12.256720,0 days 00:02:00.934820000,1024,10000,0.1236109611725956,0.4767948155192868,0.999,5000,0.0002288268244831498,small,1,PRUNED
212,212,-78.38803100585938,2021-06-16 18:12:51.926687,2021-06-16 18:14:09.704249,0 days 00:01:17.777562000,1024,10000,0.12241625466454203,0.1783549988038736,0.999,10000,0.001424413653935418,small,1000,PRUNED
213,213,764.3310546875,2021-06-16 18:13:38.435015,2021-06-16 18:15:13.440431,0 days 00:01:35.005416000,1024,50000,0.10829858173547702,0.39605235030086444,0.99,5000,0.0007121117087568648,small,1000,PRUNED
214,214,693.1451416015625,2021-06-16 18:14:09.705423,2021-06-16 18:15:48.213879,0 days 00:01:38.508456000,1024,50000,0.1088493037759602,0.38335151031728393,0.99,5000,0.0006766948556059719,small,1000,PRUNED
215,215,823.3826293945312,2021-06-16 18:14:12.257474,2021-06-16 18:15:46.404726,0 days 00:01:34.147252000,1024,50000,0.10983183622067587,0.3865772463777559,0.99,5000,0.0006269095587324115,small,1000,PRUNED
216,216,802.1466064453125,2021-06-16 18:15:13.441321,2021-06-16 18:16:45.029324,0 days 00:01:31.588003000,1024,50000,0.09011358405521652,0.38343546205913454,0.99,5000,0.0005999352802858142,small,1000,PRUNED
217,217,796.2261962890625,2021-06-16 18:15:46.406018,2021-06-16 18:17:24.755542,0 days 00:01:38.349524000,1024,50000,0.0928421154944436,0.38156872129985137,0.99,5000,0.0010663690173560816,small,1000,PRUNED
218,218,746.6611328125,2021-06-16 18:15:48.214823,2021-06-16 18:17:19.386637,0 days 00:01:31.171814000,1024,50000,0.09170182159960347,0.4378029254831572,0.99,5000,0.0011022391268887433,small,1000,PRUNED
219,219,701.4489135742188,2021-06-16 18:16:45.030457,2021-06-16 18:18:18.360089,0 days 00:01:33.329632000,1024,50000,0.11967713517157993,0.4500139067906631,0.99,5000,0.00032369987961091275,small,1000,PRUNED
220,220,813.4906616210938,2021-06-16 18:17:19.387474,2021-06-16 18:18:55.895144,0 days 00:01:36.507670000,512,50000,0.118856609682764,0.44994162118966946,0.99,0,0.00021601733792602393,small,200,PRUNED
221,221,667.5449829101562,2021-06-16 18:17:24.756767,2021-06-16 18:19:05.843296,0 days 00:01:41.086529000,512,50000,0.12151683051530635,0.44759948360816104,0.99,0,0.00044527183809346205,small,200,PRUNED
222,222,790.4484252929688,2021-06-16 18:18:18.361057,2021-06-16 18:19:58.025781,0 days 00:01:39.664724000,512,50000,0.1145495428147284,0.23152447762514664,0.999,0,0.00020317486443126187,small,200,PRUNED
223,223,797.6602783203125,2021-06-16 18:18:55.896183,2021-06-16 18:20:31.336569,0 days 00:01:35.440386000,1024,50000,0.11261358659915768,0.367667829879293,0.99,5000,0.0001742540631794523,small,1000,PRUNED
224,224,826.9077758789062,2021-06-16 18:19:05.844130,2021-06-16 18:20:40.584938,0 days 00:01:34.740808000,1024,50000,0.10624903782251507,0.20304854831141175,0.99,5000,0.00023882892692526493,small,1000,PRUNED
225,225,810.5387573242188,2021-06-16 18:19:58.026636,2021-06-16 18:21:33.148084,0 days 00:01:35.121448000,1024,50000,0.10638731524762195,0.20487661765000545,0.99,5000,0.0002530070767227094,small,1000,PRUNED
226,226,783.2944946289062,2021-06-16 18:20:31.337698,2021-06-16 18:22:05.992850,0 days 00:01:34.655152000,1024,50000,0.10672742266203318,0.1980758576176455,0.99,5000,0.00026269483348711787,small,1000,PRUNED
227,227,617.2977294921875,2021-06-16 18:20:40.585713,2021-06-16 18:22:21.115151,0 days 00:01:40.529438000,1024,50000,0.10629089015941667,0.19606644934551065,0.99,5000,0.00027278732959215926,small,1000,PRUNED
228,228,-304.733642578125,2021-06-16 18:21:33.149021,2021-06-16 18:25:25.474792,0 days 00:03:52.325771000,1024,50000,0.10101579170132206,0.1942964919755633,0.99,5000,0.00031926740024471013,small,1000,PRUNED
229,229,-404.59521484375,2021-06-16 18:22:05.993825,2021-06-16 18:22:10.940765,0 days 00:00:04.946940000,1024,50000,0.10053288400163216,0.21791528484612932,0.99,20000,0.00033006107887033776,small,1000,PRUNED
230,230,380.43402099609375,2021-06-16 18:22:10.941836,2021-06-16 18:23:50.681273,0 days 00:01:39.739437000,1024,50000,0.09473525645041533,0.17086154039182108,0.999,5000,0.0007733449825172458,small,5000,PRUNED
231,231,780.3131713867188,2021-06-16 18:22:21.115932,2021-06-16 18:23:27.025021,0 days 00:01:05.909089000,256,50000,0.0966295053438112,0.2098603275578725,0.999,5000,0.0008010030182520649,small,1500,PRUNED
232,232,172.90863037109375,2021-06-16 18:23:27.025780,2021-06-16 18:24:59.433932,0 days 00:01:32.408152000,1024,50000,0.1107293587413847,0.17386914718634303,0.999,5000,0.0003998497141490424,small,5000,PRUNED
233,233,1423.323974609375,2021-06-16 18:23:50.682258,2021-06-16 18:27:52.660270,0 days 00:04:01.978012000,1024,50000,0.1096360180035173,0.40211937630535577,0.999,0,0.0003990748842122606,small,1500,PRUNED
234,234,825.2468872070312,2021-06-16 18:24:59.435435,2021-06-16 18:26:58.176929,0 days 00:01:58.741494000,1024,50000,0.1164936787079576,0.46359158821783303,0.999,0,0.0003571803107860038,small,1500,PRUNED
235,235,798.514892578125,2021-06-16 18:25:25.475784,2021-06-16 18:27:21.842358,0 days 00:01:56.366574000,1024,50000,0.11556560428727647,0.4661685879943519,0.999,0,0.0003934121188696619,small,1500,PRUNED
236,236,720.97509765625,2021-06-16 18:26:58.177823,2021-06-16 18:28:56.563954,0 days 00:01:58.386131000,1024,50000,0.1101721539052739,0.43034151633064605,0.999,0,0.00048472078469324214,small,1500,PRUNED
237,237,809.2637939453125,2021-06-16 18:27:21.843407,2021-06-16 18:29:21.573726,0 days 00:01:59.730319000,1024,50000,0.10330009948964637,0.4354068799195533,0.999,0,0.00047606524819662733,small,1500,PRUNED
238,238,830.4769897460938,2021-06-16 18:27:52.661162,2021-06-16 18:29:51.246391,0 days 00:01:58.585229000,1024,50000,0.12437346589562594,0.22995928304185018,0.999,0,0.0005101756549387125,small,1500,PRUNED
239,239,741.0127563476562,2021-06-16 18:28:56.565069,2021-06-16 18:31:06.979231,0 days 00:02:10.414162000,1024,100000,0.12389894388891762,0.23953200662839547,0.99,0,0.0005505957807524629,small,1500,PRUNED
240,240,1433.868896484375,2021-06-16 18:29:21.574903,2021-06-16 18:35:46.873385,0 days 00:06:25.298482000,1024,50000,0.12418287271351074,0.22693633081956396,0.99,0,0.00017350499546493246,small,1000,COMPLETE
241,241,970.7239379882812,2021-06-16 18:29:51.247692,2021-06-16 18:32:25.472973,0 days 00:02:34.225281000,128,50000,0.11903811936956066,0.21163616579125835,0.99,0,0.00017000853899089722,small,1000,PRUNED
242,242,1434.4281005859375,2021-06-16 18:31:06.980706,2021-06-16 18:37:11.997169,0 days 00:06:05.016463000,1024,50000,0.10048332044427724,0.21904707307678822,0.99,1000,0.00019007911035430873,small,1000,COMPLETE
243,243,778.5752563476562,2021-06-16 18:32:25.474492,2021-06-16 18:35:50.268185,0 days 00:03:24.793693000,1024,500000,0.0972769637113751,0.4826512462722534,0.9,1000,0.00014830016476782148,medium,1000,PRUNED
244,244,1416.7545166015625,2021-06-16 18:35:46.874991,2021-06-16 18:39:54.465877,0 days 00:04:07.590886000,1024,50000,0.12807381083988084,0.22572890065983423,0.99,0,0.00012934417188112792,small,1000,PRUNED
245,245,1421.4776611328125,2021-06-16 18:35:50.268726,2021-06-16 18:39:57.418560,0 days 00:04:07.149834000,1024,50000,0.12706964424128425,0.22531706011847413,0.99,0,0.00021420921092068785,small,1000,PRUNED
246,246,1426.9937744140625,2021-06-16 18:37:11.998677,2021-06-16 18:43:26.962909,0 days 00:06:14.964232000,1024,50000,0.13009129541612105,0.2211704212399167,0.99,1000,0.00018411284690747997,small,1000,COMPLETE
247,247,1401.8819580078125,2021-06-16 18:39:54.466925,2021-06-16 18:43:58.681851,0 days 00:04:04.214926000,1024,50000,0.101298202212536,0.21943440146862914,0.99,1000,0.00021122084153914244,small,1000,PRUNED
248,248,1418.28173828125,2021-06-16 18:39:57.419620,2021-06-16 18:46:20.407638,0 days 00:06:22.988018000,1024,50000,0.10191668150917994,0.2174918229977903,0.99,1000,0.00017051546247887731,small,1000,COMPLETE
249,249,1416.44580078125,2021-06-16 18:43:26.964554,2021-06-16 18:47:33.476073,0 days 00:04:06.511519000,1024,50000,0.09960925086777261,0.24717106300827457,0.99,1000,0.00015346860277123145,small,1000,PRUNED
250,250,1434.4727783203125,2021-06-16 18:43:58.683074,2021-06-16 18:49:58.712586,0 days 00:06:00.029512000,1024,50000,0.09411829403249117,0.24900908636538788,0.99,5000,0.00016585615314654062,small,1000,COMPLETE
251,251,719.7400512695312,2021-06-16 18:46:20.409054,2021-06-16 18:47:55.654012,0 days 00:01:35.244958000,1024,50000,0.12097756371736094,0.24636865633497562,0.99,5000,0.00028056359971812445,small,1000,PRUNED
252,252,670.08544921875,2021-06-16 18:47:33.477196,2021-06-16 18:49:11.058661,0 days 00:01:37.581465000,1024,50000,0.12175932757922943,0.23705076994406002,0.99,5000,0.00026066046845989177,small,1000,PRUNED
253,253,812.752685546875,2021-06-16 18:47:55.655064,2021-06-16 18:49:30.863029,0 days 00:01:35.207965000,1024,50000,0.09422590518514361,0.23405365685969856,0.98,5000,0.0011874678636418015,small,1000,PRUNED
254,254,1404.048828125,2021-06-16 18:49:11.059610,2021-06-16 18:52:49.914945,0 days 00:03:38.855335000,1024,50000,0.09408792240470454,0.20567516268372582,0.99,5000,0.0009136396398977017,small,1000,PRUNED
255,255,1429.8065185546875,2021-06-16 18:49:30.863921,2021-06-16 18:55:10.033245,0 days 00:05:39.169324000,1024,50000,0.1153717178433397,0.18784049159195823,0.99,5000,0.0009189279195056087,small,1000,COMPLETE
256,256,-404.266357421875,2021-06-16 18:49:58.714506,2021-06-16 18:50:03.285792,0 days 00:00:04.571286000,1024,50000,0.08735179563172242,0.24904805508781053,0.95,20000,0.00012696241819228968,small,1000,PRUNED
257,257,1427.541015625,2021-06-16 18:50:03.286603,2021-06-16 19:00:52.995293,0 days 00:10:49.708690000,1024,10000,0.09037433567099756,0.41713013133438476,0.995,5000,0.001628114091943549,medium,1000,COMPLETE
258,258,-6.983597278594971,2021-06-16 18:52:49.915922,2021-06-16 18:54:45.801180,0 days 00:01:55.885258000,1024,10000,0.08692422382339648,0.18538789053040175,0.99,0,0.00018516735633275136,small,1000,PRUNED
259,259,820.3236694335938,2021-06-16 18:54:45.802365,2021-06-16 18:57:25.507520,0 days 00:02:39.705155000,1024,50000,0.0898861668001911,0.26510015695239547,0.995,5000,8.707796311044641e-05,medium,1000,PRUNED
260,260,825.694091796875,2021-06-16 18:55:10.034725,2021-06-16 18:58:51.656305,0 days 00:03:41.621580000,1024,50000,0.05420609500552215,0.41708811846939753,0.995,0,0.001625101695741667,medium,1000,PRUNED
261,261,807.1758422851562,2021-06-16 18:57:25.508540,2021-06-16 18:59:10.474361,0 days 00:01:44.965821000,1024,50000,0.09699804373699386,0.4195638543347076,0.99,0,0.000153921568430935,small,1000,PRUNED
262,262,794.9380493164062,2021-06-16 18:58:51.657199,2021-06-16 18:59:54.117735,0 days 00:01:02.460536000,1024,50000,0.09661982163947697,0.28038370053895156,0.99,10000,0.0001480559918820331,small,1000,PRUNED
263,263,753.52490234375,2021-06-16 18:59:10.475152,2021-06-16 19:00:58.136916,0 days 00:01:47.661764000,1024,50000,0.04050141508603643,0.39183807261266984,0.9999,1000,0.000656694771734907,small,1000,PRUNED
264,264,796.1800537109375,2021-06-16 18:59:54.118938,2021-06-16 19:01:46.240155,0 days 00:01:52.121217000,1024,50000,0.10498478616542051,0.22953844615894134,0.9999,1000,0.00021899647616006898,small,1500,PRUNED
265,265,640.3085327148438,2021-06-16 19:00:52.997152,2021-06-16 19:02:51.988679,0 days 00:01:58.991527000,1024,50000,0.04419273190161277,0.39505701569456475,0.9999,1000,0.0006698470442841237,small,1500,PRUNED
266,266,798.6717529296875,2021-06-16 19:00:58.137768,2021-06-16 19:02:34.593458,0 days 00:01:36.455690000,1024,50000,0.10405624331341323,0.30933328572096447,0.99,5000,0.0002201381110410379,small,1500,PRUNED
267,267,1386.9039306640625,2021-06-16 19:01:46.241265,2021-06-16 19:05:40.766093,0 days 00:03:54.524828000,1024,50000,0.11210179371764818,0.21371820761247973,0.99,5000,0.0011276753248525835,small,1500,PRUNED
268,268,831.8673706054688,2021-06-16 19:02:34.594487,2021-06-16 19:04:47.782497,0 days 00:02:13.188010000,1024,500000,0.11764961723045328,0.21200625271717982,0.99,0,0.001105535277663579,small,1000,PRUNED
269,269,785.00830078125,2021-06-16 19:02:51.989504,2021-06-16 19:04:15.341572,0 days 00:01:23.352068000,256,500000,0.11226778247569351,0.2565132118873734,0.99,0,0.0012424399228479104,small,1000,PRUNED
270,270,-404.4454040527344,2021-06-16 19:04:15.342990,2021-06-16 19:04:20.107203,0 days 00:00:04.764213000,1024,50000,0.11770897688245387,0.21210740799822733,0.99,20000,0.0010658385310369433,small,1000,PRUNED
271,271,1421.3839111328125,2021-06-16 19:04:20.108186,2021-06-16 19:08:04.575178,0 days 00:03:44.466992000,1024,50000,0.12488835066552388,0.24172581108302277,0.99,5000,0.0003097863196797002,small,1000,PRUNED
272,272,-14.518341064453125,2021-06-16 19:04:47.783749,2021-06-16 19:06:23.532023,0 days 00:01:35.748274000,1024,50000,0.12481101729765406,0.23971993671496297,0.99,5000,0.00010921050161443053,small,1000,PRUNED
273,273,-265.8568115234375,2021-06-16 19:05:40.767160,2021-06-16 19:09:34.276455,0 days 00:03:53.509295000,1024,50000,0.1234087669698654,0.1575525450000094,0.999,5000,0.00032637332112320396,small,1000,PRUNED
274,274,1421.981689453125,2021-06-16 19:06:23.532829,2021-06-16 19:12:32.438782,0 days 00:06:08.905953000,1024,50000,0.09897701943989658,0.2298649776502123,0.999,5000,0.0008132532545459571,small,200,COMPLETE
275,275,810.9669799804688,2021-06-16 19:08:04.576105,2021-06-16 19:09:22.056451,0 days 00:01:17.480346000,128,100000,0.09924824607924775,0.1575846664694173,0.999,0,0.0008010072867255801,small,200,PRUNED
276,276,811.5499877929688,2021-06-16 19:09:22.057281,2021-06-16 19:10:56.194183,0 days 00:01:34.136902000,1024,50000,0.09411855813126163,0.22867503435882802,0.999,5000,0.0001877275731269602,small,1500,PRUNED
277,277,801.217041015625,2021-06-16 19:09:34.277462,2021-06-16 19:11:34.222268,0 days 00:01:59.944806000,1024,50000,0.09273451958988302,0.3735101669021449,0.99,0,0.00019992832951694995,small,1500,PRUNED
278,278,769.2374267578125,2021-06-16 19:10:56.195086,2021-06-16 19:12:59.129158,0 days 00:02:02.934072000,1024,50000,0.10337072198114634,0.44329473789657386,0.99,0,0.0005587450054126806,small,1000,PRUNED
279,279,1427.65576171875,2021-06-16 19:11:34.223760,2021-06-16 19:15:05.223402,0 days 00:03:30.999642000,512,50000,0.10216514295382743,0.17727494393556936,0.99,0,0.0008203741897568705,small,1000,PRUNED
280,280,787.1041870117188,2021-06-16 19:12:32.440326,2021-06-16 19:14:17.825971,0 days 00:01:45.385645000,512,50000,0.08443800341125869,0.44224367802001746,0.99,0,0.0005572775109411752,small,1000,PRUNED
281,281,755.5148315429688,2021-06-16 19:12:59.130417,2021-06-16 19:14:44.882590,0 days 00:01:45.752173000,512,50000,0.12963537693469654,0.1935107261968449,0.99,0,0.00024081435986713956,small,1000,PRUNED
282,282,821.12890625,2021-06-16 19:14:17.827164,2021-06-16 19:15:53.214211,0 days 00:01:35.387047000,1024,50000,0.106441965931793,0.192178881407584,0.99,5000,0.0002468147614919146,small,1000,PRUNED
283,283,595.7455444335938,2021-06-16 19:14:44.883633,2021-06-16 19:16:15.179113,0 days 00:01:30.295480000,1024,50000,0.10858122836003399,0.40464533491243837,0.99,5000,0.0003124798091277568,small,1500,PRUNED
284,284,630.124755859375,2021-06-16 19:15:05.224426,2021-06-16 19:17:55.582874,0 days 00:02:50.358448000,1024,50000,0.107385730859333,0.22144195497621671,0.99,5000,0.0004147141120119904,medium,1500,PRUNED
285,285,757.5875854492188,2021-06-16 19:15:53.215228,2021-06-16 19:18:58.055069,0 days 00:03:04.839841000,1024,50000,0.11994729678132035,0.40208331477858383,0.999,5000,0.0013879246359009936,medium,1500,PRUNED
286,286,-189.75277709960938,2021-06-16 19:16:15.180143,2021-06-16 19:19:40.779344,0 days 00:03:25.599201000,1024,10000,0.11358102877317475,0.21961201840135564,0.999,5000,0.050202922856722475,medium,1,PRUNED
287,287,-6.983597278594971,2021-06-16 19:17:55.583941,2021-06-16 19:18:18.935811,0 days 00:00:23.351870000,1024,50000,0.1146043071350937,0.4551731530207565,0.999,20000,0.00012468212511292082,small,1,PRUNED
288,288,1423.643798828125,2021-06-16 19:18:18.936665,2021-06-16 19:21:58.517180,0 days 00:03:39.580515000,1024,10000,0.11997447154354667,0.2041044839196752,0.95,5000,0.00019167911047807273,small,1000,PRUNED
289,289,-217.37979125976562,2021-06-16 19:18:58.056128,2021-06-16 19:21:00.538040,0 days 00:02:02.481912000,1024,10000,0.09857709819432128,0.20399343251975058,0.98,0,0.00017035778421528225,small,1000,PRUNED
290,290,1437.5224609375,2021-06-16 19:19:40.780388,2021-06-16 19:26:10.539854,0 days 00:06:29.759466000,1024,50000,0.09724526217051195,0.14484959950875104,0.95,0,0.0001776800856577509,small,1000,COMPLETE
291,291,1419.0113525390625,2021-06-16 19:21:00.539735,2021-06-16 19:27:00.470026,0 days 00:05:59.930291000,1024,50000,0.1191217076422498,0.1667023943183344,0.99,5000,0.0006814651316183759,small,1000,COMPLETE
292,292,658.5560913085938,2021-06-16 19:21:58.518106,2021-06-16 19:24:03.085616,0 days 00:02:04.567510000,1024,50000,0.09589533073619562,0.36534028167498195,0.99,0,0.0007043108596275291,small,1000,PRUNED
293,293,833.3827514648438,2021-06-16 19:24:03.086524,2021-06-16 19:25:36.997708,0 days 00:01:33.911184000,1024,50000,0.1375021817637642,0.07699514304411456,0.99,5000,0.0003496937827578653,small,1500,PRUNED
294,294,1406.3341064453125,2021-06-16 19:25:36.999141,2021-06-16 19:29:44.868694,0 days 00:04:07.869553000,1024,50000,0.09098825389740862,0.23516978419952111,0.99,0,0.00044085305477078876,small,1000,PRUNED
295,295,820.7130126953125,2021-06-16 19:26:10.541866,2021-06-16 19:28:11.972648,0 days 00:02:01.430782000,1024,50000,0.08936972209309267,0.2544353210930857,0.999,0,0.00023934419768129755,small,1000,PRUNED
296,296,-159.1845245361328,2021-06-16 19:27:00.471725,2021-06-16 19:29:05.824715,0 days 00:02:05.352990000,1024,50000,0.09019758362419877,0.14734055604367147,0.95,0,0.00013085674051429278,small,1000,PRUNED
297,297,776.5468139648438,2021-06-16 19:28:11.973547,2021-06-16 19:30:14.606280,0 days 00:02:02.632733000,1024,50000,0.09445598924605458,0.239348534512501,0.95,0,0.00016332301683578477,small,1500,PRUNED
298,298,825.0414428710938,2021-06-16 19:29:05.825709,2021-06-16 19:31:09.057469,0 days 00:02:03.231760000,1024,500000,0.0677692483979343,0.23703641877052437,0.95,0,0.00015807190450540945,small,1500,PRUNED
299,299,797.3179321289062,2021-06-16 19:29:44.869711,2021-06-16 19:31:48.378251,0 days 00:02:03.508540000,1024,500000,0.10088112891123191,0.430304123061747,0.9,0,0.00015307100621377799,small,1500,PRUNED
300,300,21.65230941772461,2021-06-16 19:30:14.607730,2021-06-16 19:32:25.209020,0 days 00:02:10.601290000,1024,500000,0.10108748272723948,0.13055395076035264,0.95,0,0.00014493047566880524,small,5000,PRUNED
301,301,-287.4363098144531,2021-06-16 19:31:09.058657,2021-06-16 19:31:55.933755,0 days 00:00:46.875098000,256,50000,0.10076292974191675,0.18332729971053044,0.95,10000,0.0002071357211472179,small,1000,PRUNED
302,302,472.7048645019531,2021-06-16 19:31:48.379302,2021-06-16 19:33:01.052264,0 days 00:01:12.672962000,1024,50000,0.09839518204984195,0.18210136705756394,0.95,10000,0.00028950481762759486,small,5000,PRUNED
303,303,1420.32958984375,2021-06-16 19:31:55.934669,2021-06-16 19:36:11.275037,0 days 00:04:15.340368000,1024,50000,0.09668609508934775,0.1411197230948789,0.999,0,0.0002781292433995163,small,1000,PRUNED
304,304,-6.983597278594971,2021-06-16 19:32:25.210331,2021-06-16 19:32:31.039678,0 days 00:00:05.829347000,1024,50000,0.08218929686556833,0.13180927819949395,0.999,20000,0.0002782266128129046,small,10000,PRUNED
305,305,722.7001953125,2021-06-16 19:32:31.040735,2021-06-16 19:34:31.709483,0 days 00:02:00.668748000,1024,50000,0.09622752683472564,0.21211885224915164,0.999,0,0.00019285798177870987,small,1000,PRUNED
306,306,1420.6058349609375,2021-06-16 19:33:01.053175,2021-06-16 19:37:11.853109,0 days 00:04:10.799934000,1024,50000,0.13032835815598798,0.145183385786789,0.999,0,0.0009409042571348867,small,1000,PRUNED
307,307,1351.204345703125,2021-06-16 19:34:31.710440,2021-06-16 19:41:04.400904,0 days 00:06:32.690464000,1024,50000,0.1283481963226245,0.14614232918568204,0.999,0,0.0010091463255534553,small,1000,COMPLETE
308,308,1451.90283203125,2021-06-16 19:36:11.276090,2021-06-16 19:42:40.298867,0 days 00:06:29.022777000,1024,100000,0.10519049589901439,0.1970539977768641,0.99,0,0.0014213238126580025,small,200,COMPLETE
309,309,738.10986328125,2021-06-16 19:37:11.854173,2021-06-16 19:38:31.216552,0 days 00:01:19.362379000,128,100000,0.10418193426213249,0.19832760329262297,0.99,0,0.0013367188617162298,small,1500,PRUNED
310,310,644.9197998046875,2021-06-16 19:38:31.217521,2021-06-16 19:40:06.076514,0 days 00:01:34.858993000,1024,50000,0.11039327159905425,0.22035129934045072,0.99,5000,0.00010422342657655234,small,200,PRUNED
311,311,1436.8250732421875,2021-06-16 19:40:06.077631,2021-06-16 19:46:08.605405,0 days 00:06:02.527774000,1024,50000,0.07518581793324977,0.22426274886082687,0.99,0,0.0002286776821485633,small,1000,COMPLETE
312,312,1431.401123046875,2021-06-16 19:41:04.402531,2021-06-16 19:48:20.326294,0 days 00:07:15.923763000,1024,50000,0.10421428792357515,0.22717575383327182,0.99,1000,0.00023432141754563612,medium,1000,PRUNED
313,313,-75.0694580078125,2021-06-16 19:42:40.300538,2021-06-16 19:44:39.861270,0 days 00:01:59.560732000,1024,100000,0.1046563613534438,0.1691961667722402,0.99,0,0.001830781153530566,small,1000,PRUNED
314,314,706.1180419921875,2021-06-16 19:44:39.862392,2021-06-16 19:46:29.974169,0 days 00:01:50.111777000,1024,100000,0.08836473341996014,0.45777835997611255,0.99,0,0.00023904613263890258,small,200,PRUNED
