,number,value,datetime_start,datetime_complete,duration,params_batch_size,params_buffer_size,params_exploration_final_eps,params_exploration_fraction,params_gamma,params_learning_starts,params_lr,params_net_arch,params_target_update_interval,state
945,945,812.332275390625,2021-06-17 04:32:50.902576,2021-06-17 04:35:02.170860,0 days 00:02:11.268284000,1024,500000,0.07818599523981076,0.13433261137792218,0.999,0,0.0020410156484867723,small,1500,PRUNED
946,946,883.389892578125,2021-06-17 04:34:31.499898,2021-06-17 04:36:39.372036,0 days 00:02:07.872138000,1024,500000,0.07872893401130614,0.17938334396230388,0.999,0,0.0002468757418332808,small,1500,PRUNED
947,947,-159.59352111816406,2021-06-17 04:34:39.665335,2021-06-17 04:36:49.254768,0 days 00:02:09.589433000,1024,500000,0.082724131774897,0.16780904357509005,0.999,0,0.0017273808028807158,small,1500,PRUNED
948,948,-244.32177734375,2021-06-17 04:35:02.172418,2021-06-17 04:39:25.164942,0 days 00:04:22.992524000,1024,500000,0.13073898952056348,0.1868285600265844,0.999,0,0.0005011677214698487,small,1500,PRUNED
949,949,-300.1675720214844,2021-06-17 04:36:39.373493,2021-06-17 04:38:48.032617,0 days 00:02:08.659124000,1024,500000,0.123024705757807,0.17735030826439713,0.999,0,0.00031809272277337096,small,1500,PRUNED
950,950,855.006591796875,2021-06-17 04:36:49.255896,2021-06-17 04:39:00.339993,0 days 00:02:11.084097000,1024,100000,0.12969642574395995,0.17794087314715618,0.999,0,0.0005071652366997363,small,1500,PRUNED
951,951,1417.078857421875,2021-06-17 04:38:48.034754,2021-06-17 04:43:13.722626,0 days 00:04:25.687872000,1024,100000,0.08374763390191799,0.18135025779122863,0.999,0,0.0011601130715929123,small,1500,PRUNED
952,952,868.44189453125,2021-06-17 04:39:00.341264,2021-06-17 04:41:04.715045,0 days 00:02:04.373781000,1024,500000,0.1203945942483302,0.18230627501312383,0.999,0,0.0003272695706048818,small,1500,PRUNED
953,953,802.0338134765625,2021-06-17 04:39:25.167049,2021-06-17 04:41:35.403701,0 days 00:02:10.236652000,1024,100000,0.07188395027297757,0.14959408633521168,0.999,0,0.0003234916134001746,small,1500,PRUNED
954,954,880.2908325195312,2021-06-17 04:41:04.716423,2021-06-17 04:42:47.815599,0 days 00:01:43.099176000,512,100000,0.07190800884740152,0.1516454855364227,0.995,0,0.001205942011884486,small,1500,PRUNED
955,955,839.4891967773438,2021-06-17 04:41:35.406136,2021-06-17 04:43:42.725308,0 days 00:02:07.319172000,1024,50000,0.17972575148910638,0.15936707525804203,0.995,0,0.00021946515334837237,small,1500,PRUNED
956,956,836.9683227539062,2021-06-17 04:42:47.817099,2021-06-17 04:44:55.945343,0 days 00:02:08.128244000,1024,50000,0.1357575145506986,0.16387494508294756,0.999,0,0.0006957374182240723,small,1500,PRUNED
957,957,812.7494506835938,2021-06-17 04:43:13.723794,2021-06-17 04:45:17.270364,0 days 00:02:03.546570000,1024,50000,0.11701507948399806,0.16658353324576652,0.999,0,0.0007006271903365458,small,1500,PRUNED
958,958,-405.6640319824219,2021-06-17 04:43:42.726534,2021-06-17 04:45:57.354054,0 days 00:02:14.627520000,1024,50000,0.11689773582013706,0.17375445643797147,0.999,0,0.007671842530475805,small,1500,PRUNED
959,959,-0.24250589311122894,2021-06-17 04:44:55.946327,2021-06-17 04:47:09.615182,0 days 00:02:13.668855000,1024,50000,0.11693330465191071,0.17103371407574788,0.95,0,5.64654411652105e-05,small,1500,PRUNED
960,960,-2.020153760910034,2021-06-17 04:45:17.271762,2021-06-17 04:46:41.090801,0 days 00:01:23.819039000,128,500000,0.12407097518264337,0.19001604960896068,0.95,0,0.000921803005870449,small,10000,PRUNED
961,961,649.5303955078125,2021-06-17 04:45:57.355053,2021-06-17 04:48:09.435524,0 days 00:02:12.080471000,1024,500000,0.12432154046951707,0.19262685968893095,0.95,0,0.0002140077501758644,small,5000,PRUNED
962,962,3.425326347351074,2021-06-17 04:46:41.092093,2021-06-17 04:48:52.004140,0 days 00:02:10.912047000,1024,50000,0.08473568358746714,0.19386738167219317,0.999,0,0.0002442534635298944,small,5000,PRUNED
963,963,1418.744384765625,2021-06-17 04:47:09.617004,2021-06-17 04:51:14.668901,0 days 00:04:05.051897000,1024,50000,0.08252569169466355,0.19270439740664116,0.999,0,0.0002363804096487661,small,1500,PRUNED
964,964,-6.983597278594971,2021-06-17 04:48:09.437143,2021-06-17 04:48:15.447294,0 days 00:00:06.010151000,1024,50000,0.08231436751432165,0.1809406303144372,0.9999,20000,0.0004327498024678182,small,1500,PRUNED
965,965,-239.95108032226562,2021-06-17 04:48:15.448555,2021-06-17 04:52:00.483784,0 days 00:03:45.035229000,1024,50000,0.06808607580177968,0.19586083297000398,0.999,0,1.666675170008492e-05,medium,1500,PRUNED
966,966,835.361572265625,2021-06-17 04:48:52.005219,2021-06-17 04:52:59.545896,0 days 00:04:07.540677000,1024,50000,0.12022133328964643,0.20204386906044744,0.999,0,0.000305366152963131,medium,1,PRUNED
967,967,1432.65283203125,2021-06-17 04:51:14.669948,2021-06-17 04:57:39.975068,0 days 00:06:25.305120000,512,50000,0.12050834139856492,0.20341706157170472,0.999,0,0.00028195821570033564,medium,1,PRUNED
968,968,837.8907470703125,2021-06-17 04:52:00.485070,2021-06-17 04:53:48.192929,0 days 00:01:47.707859000,512,50000,0.16738793339592464,0.20667394647372664,0.999,0,0.0003091551192917702,small,200,PRUNED
969,969,851.4349365234375,2021-06-17 04:52:59.547040,2021-06-17 04:55:00.058247,0 days 00:02:00.511207000,512,50000,0.1273273897310239,0.18028263261664487,0.98,0,0.00037488114900195854,small,1500,PRUNED
970,970,-0.10581106692552567,2021-06-17 04:53:48.194724,2021-06-17 04:54:44.785421,0 days 00:00:56.590697000,256,500000,0.11410190369665615,0.17795491853679657,0.98,10000,0.00037402744988959777,small,1500,PRUNED
971,971,1412.97216796875,2021-06-17 04:54:44.786603,2021-06-17 04:59:17.203605,0 days 00:04:32.417002000,1024,50000,0.14136265815569118,0.16126164975397017,0.995,0,0.0005402356159407149,small,1500,PRUNED
972,972,834.0478515625,2021-06-17 04:55:00.059774,2021-06-17 04:57:17.414593,0 days 00:02:17.354819000,1024,10000,0.06586243011445861,0.16151292532615688,0.995,0,0.0005772689295457102,small,1500,PRUNED
973,973,-404.6684265136719,2021-06-17 04:57:17.415562,2021-06-17 04:57:22.011153,0 days 00:00:04.595591000,1024,50000,0.08876530521068077,0.1868244179719978,0.999,20000,0.00019701229416189828,small,1500,PRUNED
974,974,780.1038208007812,2021-06-17 04:57:22.012940,2021-06-17 04:59:28.774080,0 days 00:02:06.761140000,1024,50000,0.1397040469160098,0.20815896236294282,0.999,0,0.0002763783037942256,small,1500,PRUNED
975,975,885.599853515625,2021-06-17 04:57:39.976457,2021-06-17 04:59:47.882129,0 days 00:02:07.905672000,1024,50000,0.07678001233139103,0.12277211261327936,0.999,0,0.0008144891690782131,small,1500,PRUNED
976,976,759.9144287109375,2021-06-17 04:59:17.204703,2021-06-17 05:01:26.463674,0 days 00:02:09.258971000,1024,500000,0.11217380955257766,0.14789817700966093,0.999,0,0.00043693522353560995,small,1500,PRUNED
977,977,39.921329498291016,2021-06-17 04:59:28.776081,2021-06-17 05:01:36.315256,0 days 00:02:07.539175000,1024,500000,0.07644032563600064,0.1527062699163432,0.999,0,0.0008760810834391355,small,10000,PRUNED
978,978,1361.46044921875,2021-06-17 04:59:47.883459,2021-06-17 05:04:29.834713,0 days 00:04:41.951254000,1024,500000,0.11329139131761586,0.15311636436950501,0.999,0,0.0015351687281230373,small,200,PRUNED
979,979,792.6748046875,2021-06-17 05:01:26.464956,2021-06-17 05:03:44.780460,0 days 00:02:18.315504000,1024,100000,0.11514694284282355,0.34928533864769645,0.999,0,0.001634166787453345,small,200,PRUNED
980,980,1410.0020751953125,2021-06-17 05:01:36.317516,2021-06-17 05:04:47.591551,0 days 00:03:11.274035000,256,100000,0.11446068775992374,0.2179555141770607,0.9999,0,0.0013344534674379614,small,200,PRUNED
981,981,-405.0248718261719,2021-06-17 05:03:44.781723,2021-06-17 05:03:50.360842,0 days 00:00:05.579119000,256,50000,0.1863783159465849,0.21001570059174138,0.99,20000,0.00023867318748727615,small,1500,PRUNED
982,982,654.32421875,2021-06-17 05:03:50.362646,2021-06-17 05:06:01.743530,0 days 00:02:11.380884000,1024,50000,0.08810424425184044,0.18505211812516098,0.9999,0,0.00019640254786179375,small,1500,PRUNED
983,983,856.679443359375,2021-06-17 05:04:29.836750,2021-06-17 05:06:41.045264,0 days 00:02:11.208514000,1024,50000,0.08810223424777165,0.22247530223346756,0.9999,0,0.00018359852610583824,small,1500,PRUNED
984,984,1428.3223876953125,2021-06-17 05:04:47.593394,2021-06-17 05:09:10.056396,0 days 00:04:22.463002000,1024,50000,0.08755037621586147,0.1841277651990789,0.99,0,0.00020296344438803133,small,1500,PRUNED
985,985,1372.5465087890625,2021-06-17 05:06:01.745101,2021-06-17 05:10:29.553943,0 days 00:04:27.808842000,1024,50000,0.12369524320667827,0.1726282066306541,0.9,0,0.0009900437838968883,small,1500,PRUNED
986,986,1426.57763671875,2021-06-17 05:06:41.047131,2021-06-17 05:11:15.589568,0 days 00:04:34.542437000,1024,50000,0.12174199390217902,0.20322714927768504,0.99,0,0.0010036131519228196,small,1000,PRUNED
987,987,689.0084228515625,2021-06-17 05:09:10.057651,2021-06-17 05:10:17.268198,0 days 00:01:07.210547000,1024,50000,0.12350228745597533,0.1693297363451119,0.95,10000,0.0004191111455423071,small,1000,PRUNED
988,988,1436.8662109375,2021-06-17 05:10:17.269650,2021-06-17 05:17:17.726417,0 days 00:07:00.456767000,1024,50000,0.10925638902436172,0.06589531636133655,0.99,0,0.000342624504675841,small,1000,COMPLETE
989,989,801.5069580078125,2021-06-17 05:10:29.555803,2021-06-17 05:12:20.604420,0 days 00:01:51.048617000,1024,50000,0.10983912906701981,0.20118826144682397,0.99,5000,0.0003348233417608033,small,1000,PRUNED
990,990,821.3499755859375,2021-06-17 05:11:15.590632,2021-06-17 05:12:18.929335,0 days 00:01:03.338703000,128,50000,0.11016338934931665,0.32305129760099544,0.999,5000,0.000365665906980641,small,1000,PRUNED
991,991,-6.983597278594971,2021-06-17 05:12:18.931343,2021-06-17 05:12:26.518297,0 days 00:00:07.586954000,1024,50000,0.07103525061746799,0.13892585457710493,0.99,20000,0.00028043643656214403,small,1000,PRUNED
992,992,-16.865875244140625,2021-06-17 05:12:20.605976,2021-06-17 05:14:31.350535,0 days 00:02:10.744559000,1024,50000,0.12876005448110434,0.13661076090338128,0.99,0,0.00026825562463412265,small,1500,PRUNED
993,993,852.5003662109375,2021-06-17 05:12:26.519676,2021-06-17 05:14:35.743197,0 days 00:02:09.223521000,1024,500000,0.1275730508827662,0.21974519274403595,0.999,0,0.0005985404202945595,small,1500,PRUNED
994,994,842.741455078125,2021-06-17 05:14:31.352074,2021-06-17 05:16:42.169859,0 days 00:02:10.817785000,1024,500000,0.08083237965506503,0.2274798148490408,0.999,0,0.00046918421139052893,small,1500,PRUNED
995,995,1429.383544921875,2021-06-17 05:14:35.744300,2021-06-17 05:18:31.418041,0 days 00:03:55.673741000,1024,50000,0.07968903359240986,0.21710984481802684,0.995,5000,0.0002276910442423433,small,1000,PRUNED
996,996,705.6777954101562,2021-06-17 05:16:42.171070,2021-06-17 05:18:20.761849,0 days 00:01:38.590779000,1024,50000,0.11886907673571155,0.21410202318963964,0.995,5000,0.00022346310696417262,small,1000,PRUNED
997,997,1433.166259765625,2021-06-17 05:17:17.728950,2021-06-17 05:21:20.436495,0 days 00:04:02.707545000,1024,50000,0.1062720635314542,0.21085933620903513,0.995,0,0.0003790602971658509,small,1000,PRUNED
998,998,1399.7559814453125,2021-06-17 05:18:20.763338,2021-06-17 05:21:48.858790,0 days 00:03:28.095452000,1024,50000,0.10484446986231827,0.09287883089360319,0.99,0,0.00037209555235321397,small,1000,PRUNED
999,999,-4.880716323852539,2021-06-17 05:18:31.419827,2021-06-17 05:20:42.305817,0 days 00:02:10.885990000,1024,50000,0.1057851943096915,0.02752079991412023,0.99,0,0.00039257232650506744,small,5000,PRUNED
