,number,value,datetime_start,datetime_complete,duration,params_batch_size,params_buffer_size,params_exploration_final_eps,params_exploration_fraction,params_gamma,params_learning_starts,params_lr,params_net_arch,params_target_update_interval,state
420,420,-315.9305725097656,2021-06-16 21:12:41.416226,2021-06-16 21:14:07.497862,0 days 00:01:26.081636000,256,500000,0.16339276309876022,0.2085631797811256,0.99,1000,0.00023865431925666202,small,1000,PRUNED
421,421,-287.01141357421875,2021-06-16 21:13:12.926368,2021-06-16 21:15:11.855522,0 days 00:01:58.929154000,1024,500000,0.19851944728377527,0.09433791801600369,0.99,1000,0.00024799452566123505,small,1500,PRUNED
422,422,229.99639892578125,2021-06-16 21:13:50.777009,2021-06-16 21:15:37.064759,0 days 00:01:46.287750000,1024,500000,0.16084578043974113,0.21016564624343814,0.99,1000,0.0002519784023682914,small,1000,PRUNED
423,423,-0.3904303312301636,2021-06-16 21:14:07.499015,2021-06-16 21:17:29.886643,0 days 00:03:22.387628000,1024,50000,0.18798992941956108,0.19985923750509163,0.99,1000,0.00027509250805786103,medium,200,PRUNED
424,424,1414.0682373046875,2021-06-16 21:15:11.856535,2021-06-16 21:26:30.118414,0 days 00:11:18.261879000,1024,50000,0.10961527858328772,0.21320499157706063,0.99,1000,0.00020451611102224055,medium,200,COMPLETE
425,425,1430.362060546875,2021-06-16 21:15:37.065672,2021-06-16 21:22:50.503084,0 days 00:07:13.437412000,1024,50000,0.18336068046864437,0.25229377464859004,0.99,1000,0.0001917202014953211,medium,200,PRUNED
426,426,801.7755737304688,2021-06-16 21:17:29.887846,2021-06-16 21:19:11.982033,0 days 00:01:42.094187000,1024,50000,0.10196069246498192,0.2521063741254886,0.99,1000,0.00011549514877434909,small,1000,PRUNED
427,427,1430.0555419921875,2021-06-16 21:19:11.983787,2021-06-16 21:24:42.791387,0 days 00:05:30.807600000,1024,50000,0.10852140563462329,0.22092616675066432,0.99,1000,0.00018923348938853105,small,1000,COMPLETE
428,428,823.2313842773438,2021-06-16 21:22:50.504445,2021-06-16 21:24:41.806109,0 days 00:01:51.301664000,1024,50000,0.17628171521492142,0.2232895546226419,0.99,1000,0.00039632703099384175,small,1000,PRUNED
429,429,709.4253540039062,2021-06-16 21:24:41.807756,2021-06-16 21:26:35.246195,0 days 00:01:53.438439000,1024,50000,0.14848297381974437,0.2325696325622886,0.99,1000,0.00020237102614347098,small,1500,PRUNED
430,430,725.6756591796875,2021-06-16 21:24:42.792642,2021-06-16 21:26:37.124180,0 days 00:01:54.331538000,1024,50000,0.06509743099625645,0.23584019132647144,0.99,1000,9.614198084902406e-05,small,1500,PRUNED
431,431,773.9996948242188,2021-06-16 21:26:30.120034,2021-06-16 21:29:00.834522,0 days 00:02:30.714488000,1024,50000,0.06437316693140353,0.2339765077246375,0.99,1000,0.0012968189776005601,small,1500,PRUNED
432,432,0.11717809736728668,2021-06-16 21:26:35.246939,2021-06-16 21:28:12.278887,0 days 00:01:37.031948000,128,50000,0.11300947376620271,0.199427477929494,0.95,1000,8.958663435915122e-05,small,5000,PRUNED
433,433,787.6307373046875,2021-06-16 21:26:37.125285,2021-06-16 21:27:31.622765,0 days 00:00:54.497480000,128,50000,0.11293986597688715,0.2410834550654487,0.95,10000,0.0002933164491151771,small,1000,PRUNED
434,434,-404.59521484375,2021-06-16 21:27:31.623838,2021-06-16 21:27:36.611611,0 days 00:00:04.987773000,1024,100000,0.1027887169832379,0.20060526657702477,0.98,20000,0.0004541161468529953,small,1000,PRUNED
435,435,719.74609375,2021-06-16 21:27:36.612506,2021-06-16 21:29:19.330685,0 days 00:01:42.718179000,256,50000,0.08024689638441372,0.038615918782519854,0.99,1000,0.0013847617974761552,small,1000,PRUNED
436,436,-311.8258056640625,2021-06-16 21:28:12.281027,2021-06-16 21:31:40.860358,0 days 00:03:28.579331000,256,50000,0.08298181377947819,0.30595942751773825,0.99,0,0.00029054532896754853,small,1000,PRUNED
437,437,1414.1529541015625,2021-06-16 21:29:00.835738,2021-06-16 21:32:28.438058,0 days 00:03:27.602320000,256,50000,0.08213191542743152,0.047258186615255826,0.99,0,0.0005629736762654433,small,1000,PRUNED
438,438,1406.8101806640625,2021-06-16 21:29:19.332155,2021-06-16 21:36:22.370765,0 days 00:07:03.038610000,1024,50000,0.1692158080069091,0.1844542141338916,0.99,0,0.0002967307121804576,small,1000,COMPLETE
439,439,1399.4378662109375,2021-06-16 21:31:40.861438,2021-06-16 21:36:01.405967,0 days 00:04:20.544529000,1024,50000,0.0985583299203646,0.2167186264204223,0.99,0,0.0003760576682795861,small,1000,PRUNED
440,440,780.2206420898438,2021-06-16 21:32:28.439380,2021-06-16 21:34:34.312977,0 days 00:02:05.873597000,1024,50000,0.10021033749837167,0.18824177819351326,0.99,0,0.0003638652323844166,small,1500,PRUNED
441,441,836.1542358398438,2021-06-16 21:34:34.314318,2021-06-16 21:36:13.567244,0 days 00:01:39.252926000,1024,50000,0.10589093075012507,0.2645819774178933,0.99,5000,0.00012936486702399636,small,1000,PRUNED
442,442,1396.7781982421875,2021-06-16 21:36:01.407945,2021-06-16 21:42:35.022768,0 days 00:06:33.614823000,1024,50000,0.10472480675033707,0.21106615474596555,0.9999,5000,0.00013459850527152488,small,1000,COMPLETE
443,443,796.6057739257812,2021-06-16 21:36:13.568441,2021-06-16 21:37:59.213296,0 days 00:01:45.644855000,1024,100000,0.10377474223274093,0.22222381512788844,0.9999,5000,0.0001599557079361,small,1500,PRUNED
444,444,773.7242431640625,2021-06-16 21:36:22.372620,2021-06-16 21:37:41.204653,0 days 00:01:18.832033000,512,100000,0.10480703277488732,0.22304348689456263,0.9999,5000,0.00017281550292466626,small,1500,PRUNED
445,445,-404.4868469238281,2021-06-16 21:37:41.205756,2021-06-16 21:37:46.088408,0 days 00:00:04.882652000,1024,50000,0.05937864985713531,0.2075904998385653,0.99,20000,0.00024447414389512737,small,1000,PRUNED
446,446,833.4789428710938,2021-06-16 21:37:46.089272,2021-06-16 21:39:26.673491,0 days 00:01:40.584219000,1024,50000,0.15273983134725308,0.12006183858083705,0.99,5000,0.0002175410038730334,small,1500,PRUNED
447,447,817.21435546875,2021-06-16 21:37:59.214721,2021-06-16 21:40:05.874489,0 days 00:02:06.659768000,1024,50000,0.11376160899175053,0.21091576998199485,0.99,0,0.00046319667509384744,small,1000,PRUNED
448,448,837.92822265625,2021-06-16 21:39:26.675444,2021-06-16 21:41:40.806268,0 days 00:02:14.130824000,1024,50000,0.11443012928992313,0.4106999480507375,0.99,0,0.00043842708928989825,small,1000,PRUNED
449,449,1399.2340087890625,2021-06-16 21:40:05.876206,2021-06-16 21:48:31.680707,0 days 00:08:25.804501000,1024,50000,0.09805202892114592,0.24390121424439168,0.99,0,0.0011394504605800368,small,1,COMPLETE
450,450,812.4611206054688,2021-06-16 21:41:40.807359,2021-06-16 21:44:03.013072,0 days 00:02:22.205713000,1024,50000,0.10983408425335932,0.24552371105634638,0.99,1000,0.0002233315725759529,small,1000,PRUNED
451,451,810.9093017578125,2021-06-16 21:42:35.024673,2021-06-16 21:45:21.456434,0 days 00:02:46.431761000,1024,50000,0.09825480016815255,0.24338768232776128,0.99,1000,0.00023052497296805732,small,1,PRUNED
452,452,679.6908569335938,2021-06-16 21:44:03.014096,2021-06-16 21:46:58.207093,0 days 00:02:55.192997000,1024,50000,0.14077994541133793,0.0780692824100486,0.99,0,0.0003066750228197789,small,1,PRUNED
453,453,850.1266479492188,2021-06-16 21:45:21.457605,2021-06-16 21:47:50.963554,0 days 00:02:29.505949000,1024,50000,0.0944560441023949,0.23001201476670904,0.99,0,0.0011892573578595601,small,1500,PRUNED
454,454,1406.614501953125,2021-06-16 21:46:58.208056,2021-06-16 21:51:43.489705,0 days 00:04:45.281649000,1024,50000,0.08839448177879544,0.22914941129146268,0.99,0,0.0010877857123211994,small,1500,PRUNED
455,455,-0.5441951155662537,2021-06-16 21:47:50.964475,2021-06-16 21:49:07.295856,0 days 00:01:16.331381000,1024,50000,0.07149676666347493,0.1901230881116115,0.995,10000,0.0015934005900052183,small,1000,PRUNED
456,456,-0.17829079926013947,2021-06-16 21:48:31.682142,2021-06-16 21:49:45.180439,0 days 00:01:13.498297000,1024,50000,0.09007430944680912,0.19685214089766231,0.995,10000,0.0022161510499610466,small,1000,PRUNED
457,457,648.2319946289062,2021-06-16 21:49:07.297523,2021-06-16 21:50:26.439871,0 days 00:01:19.142348000,512,50000,0.0875883961895774,0.43201041854538513,0.99,5000,0.00017735900157927,small,1500,PRUNED
458,458,808.0844116210938,2021-06-16 21:49:45.181627,2021-06-16 21:51:09.410250,0 days 00:01:24.228623000,512,50000,0.1172537170566986,0.2303880856474405,0.99,5000,0.0005628404268117072,small,1500,PRUNED
459,459,-1.7006806135177612,2021-06-16 21:50:26.441136,2021-06-16 21:52:06.730802,0 days 00:01:40.289666000,1024,50000,0.11659731344175032,0.2779623908535057,0.95,5000,1.3068887537655555e-05,small,1000,PRUNED
460,460,-6.983597278594971,2021-06-16 21:51:09.411932,2021-06-16 21:51:15.904290,0 days 00:00:06.492358000,1024,100000,0.10986442968824053,0.21787313093125377,0.95,20000,0.011086467597071239,small,1000,PRUNED
461,461,855.9487915039062,2021-06-16 21:51:15.905632,2021-06-16 21:53:19.430349,0 days 00:02:03.524717000,1024,500000,0.099722823477994,0.2592258292023646,0.99,0,0.0003441096013025085,small,1000,PRUNED
462,462,1421.6905517578125,2021-06-16 21:51:43.491641,2021-06-16 21:55:31.304634,0 days 00:03:47.812993000,1024,500000,0.10159890119441023,0.2821243578930339,0.98,5000,0.0003560424447500661,small,1000,PRUNED
463,463,1436.9591064453125,2021-06-16 21:52:06.732274,2021-06-16 21:58:19.529194,0 days 00:06:12.796920000,1024,500000,0.10141755211681583,0.25443070396487993,0.99,0,0.0003499119152394743,small,1000,COMPLETE
464,464,191.65524291992188,2021-06-16 21:53:19.431586,2021-06-16 21:55:18.416625,0 days 00:01:58.985039000,1024,50000,0.10738272918508834,0.1595357057504626,0.99,1000,0.00027313217342343044,small,5000,PRUNED
465,465,648.5131225585938,2021-06-16 21:55:18.417891,2021-06-16 21:56:47.176274,0 days 00:01:28.758383000,1024,50000,0.10214465099620348,0.1788915008523405,0.99,5000,0.00016044659031545528,small,1000,PRUNED
466,466,1422.6595458984375,2021-06-16 21:55:31.305809,2021-06-16 22:02:47.331923,0 days 00:07:16.026114000,1024,50000,0.11255925501230093,0.19993372980185506,0.99,0,0.00016785063047048543,medium,1000,PRUNED
467,467,784.560546875,2021-06-16 21:56:47.178127,2021-06-16 22:00:19.799742,0 days 00:03:32.621615000,1024,50000,0.0948155835454728,0.2004242077958376,0.99,0,0.0008731931291722345,medium,1500,PRUNED
468,468,1425.945068359375,2021-06-16 21:58:19.530533,2021-06-16 22:05:47.045325,0 days 00:07:27.514792000,1024,500000,0.09717147027116713,0.257539928998309,0.99,0,0.0008242376811047163,medium,1500,PRUNED
469,469,179.4648895263672,2021-06-16 22:00:19.801110,2021-06-16 22:02:00.942654,0 days 00:01:41.141544000,1024,500000,0.09681481315892149,0.262715971666138,0.9,0,0.00025961019520514715,small,10000,PRUNED
470,470,630.0430908203125,2021-06-16 22:02:00.943912,2021-06-16 22:03:50.598794,0 days 00:01:49.654882000,1024,500000,0.10745888008945109,0.2525829322659666,0.99,0,0.00020837212004620265,small,1000,PRUNED
471,471,324.88458251953125,2021-06-16 22:02:47.333043,2021-06-16 22:04:42.754738,0 days 00:01:55.421695000,1024,500000,0.10608734688312754,0.2432470214509975,0.99,0,0.00021467470998943816,small,200,PRUNED
472,472,1427.6065673828125,2021-06-16 22:03:50.599918,2021-06-16 22:07:53.391223,0 days 00:04:02.791305000,1024,500000,0.10026089736611157,0.2707847654209171,0.99,0,0.0002779099771415499,small,200,PRUNED
473,473,781.0244140625,2021-06-16 22:04:42.755661,2021-06-16 22:06:39.985505,0 days 00:01:57.229844000,1024,500000,0.10010485700166254,0.269026095412306,0.99,0,0.0002839165804583118,small,1500,PRUNED
474,474,-19.040740966796875,2021-06-16 22:05:47.046468,2021-06-16 22:07:49.585854,0 days 00:02:02.539386000,1024,500000,0.09281843447294945,0.21823848149650893,0.99,0,0.00011354606000834617,small,1000,PRUNED
475,475,886.863037109375,2021-06-16 22:06:39.987221,2021-06-16 22:10:55.999278,0 days 00:04:16.012057000,1024,500000,0.0932036687568611,0.2396661405388687,0.99,0,4.516212283795689e-05,small,1000,PRUNED
476,476,1425.424072265625,2021-06-16 22:07:49.587432,2021-06-16 22:12:30.324161,0 days 00:04:40.736729000,1024,500000,0.1026119859470602,0.29661543963542625,0.99,0,0.00041999647140690663,small,1000,PRUNED
477,477,751.4183349609375,2021-06-16 22:07:53.392067,2021-06-16 22:09:55.630502,0 days 00:02:02.238435000,1024,100000,0.10366465537887164,0.237177665117057,0.99,0,0.0017414813480879341,small,1000,PRUNED
478,478,1432.7431640625,2021-06-16 22:09:55.631750,2021-06-16 22:13:20.268716,0 days 00:03:24.636966000,256,500000,0.11047930024148012,0.2237540054440062,0.999,1000,0.0004138046094591801,small,1000,PRUNED
479,479,830.7313842773438,2021-06-16 22:10:56.001004,2021-06-16 22:12:38.064831,0 days 00:01:42.063827000,256,50000,0.10863040720773023,0.22747942529877596,0.999,1000,0.00042412771478247274,small,1500,PRUNED
480,480,804.8798828125,2021-06-16 22:12:30.325502,2021-06-16 22:14:08.542068,0 days 00:01:38.216566000,256,50000,0.11067740172144767,0.22994671777068082,0.999,1000,0.00019164920788682105,small,1500,PRUNED
481,481,-410.1180114746094,2021-06-16 22:12:38.066113,2021-06-16 22:12:45.326479,0 days 00:00:07.260366000,1024,10000,0.10988511731526913,0.20948880153882055,0.999,20000,0.0003181371501601198,small,1000,PRUNED
482,482,1403.2523193359375,2021-06-16 22:12:45.327297,2021-06-16 22:17:05.380644,0 days 00:04:20.053347000,1024,100000,0.07790980026071223,0.18675926014608266,0.99,1000,0.0006449850538133055,small,1500,PRUNED
483,483,803.1088256835938,2021-06-16 22:13:20.270005,2021-06-16 22:15:30.556870,0 days 00:02:10.286865000,1024,100000,0.08473229911388779,0.2517098211091758,0.99,0,0.0001448614271306447,small,1500,PRUNED
484,484,1387.4140625,2021-06-16 22:14:08.543180,2021-06-16 22:18:28.987846,0 days 00:04:20.444666000,1024,100000,0.07802755377859869,0.13684870425635615,0.99,0,0.0006443611391495895,small,1000,PRUNED
485,485,1428.150634765625,2021-06-16 22:15:30.558048,2021-06-16 22:19:46.981728,0 days 00:04:16.423680000,1024,50000,0.10526581253344255,0.18571499792960935,0.99,0,0.0006290498702058322,small,1000,PRUNED
486,486,769.3358764648438,2021-06-16 22:17:05.381770,2021-06-16 22:19:09.842300,0 days 00:02:04.460530000,1024,50000,0.10347736714263131,0.4978800032962195,0.99,0,0.00023592863076880258,small,1000,PRUNED
487,487,-326.19854736328125,2021-06-16 22:18:28.989261,2021-06-16 22:22:51.870749,0 days 00:04:22.881488000,1024,50000,0.09657584967081526,0.21056149494391607,0.95,0,0.00023962895253848134,small,1000,PRUNED
488,488,1351.6593017578125,2021-06-16 22:19:09.843426,2021-06-16 22:23:33.067107,0 days 00:04:23.223681000,1024,50000,0.09617844770549157,0.21228558001026313,0.95,0,0.0013034620044695589,small,1000,PRUNED
489,489,840.6674194335938,2021-06-16 22:19:46.982782,2021-06-16 22:21:30.621309,0 days 00:01:43.638527000,512,50000,0.09714139399959246,0.21155460923074712,0.95,0,0.0012865721826943008,small,1000,PRUNED
490,490,765.7884521484375,2021-06-16 22:21:30.622497,2021-06-16 22:23:33.576205,0 days 00:02:02.953708000,1024,50000,0.08972158292008728,0.203222216477851,0.98,0,0.000512162637012188,small,1000,PRUNED
491,491,1349.602294921875,2021-06-16 22:22:51.871675,2021-06-16 22:27:24.091543,0 days 00:04:32.219868000,1024,50000,0.09164122039455487,0.2445721408848494,0.99,0,0.0005247549988632291,small,1500,PRUNED
492,492,731.4405517578125,2021-06-16 22:23:33.068983,2021-06-16 22:24:56.000923,0 days 00:01:22.931940000,128,50000,0.09047500482324092,0.17092942081904403,0.98,0,0.0005045011222616206,small,1500,PRUNED
493,493,-307.40911865234375,2021-06-16 22:23:33.576862,2021-06-16 22:28:00.287095,0 days 00:04:26.710233000,1024,50000,0.10130540887589903,0.24801017606212347,0.99,1000,0.0003086533359837449,small,1500,PRUNED
494,494,-404.6684265136719,2021-06-16 22:24:56.002797,2021-06-16 22:25:00.917541,0 days 00:00:04.914744000,1024,50000,0.1021945238700822,0.24781903648352416,0.99,20000,0.0003250415414801088,small,5000,PRUNED
495,495,825.8059692382812,2021-06-16 22:25:00.918696,2021-06-16 22:27:01.804990,0 days 00:02:00.886294000,1024,50000,0.1443352719973627,0.15198117184230361,0.99,1000,0.0001850423051267124,small,1500,PRUNED
496,496,720.7793579101562,2021-06-16 22:27:01.806417,2021-06-16 22:28:38.890193,0 days 00:01:37.083776000,1024,50000,0.115296549780239,0.2339787930120738,0.99,5000,0.0009329839942613282,small,1000,PRUNED
497,497,1416.5814208984375,2021-06-16 22:27:24.092871,2021-06-16 22:31:23.057375,0 days 00:03:58.964504000,1024,50000,0.11600894516967665,0.23334924218060998,0.999,5000,0.0002861627820881649,small,1000,PRUNED
498,498,774.468994140625,2021-06-16 22:28:00.288211,2021-06-16 22:29:36.455825,0 days 00:01:36.167614000,1024,50000,0.11627387457062072,0.23618384681885118,0.999,5000,0.0009636575865107581,small,1000,PRUNED
499,499,616.6041870117188,2021-06-16 22:28:38.891815,2021-06-16 22:30:16.226959,0 days 00:01:37.335144000,1024,50000,0.10689100776004509,0.350494062579484,0.999,5000,0.00013582978237342819,small,10000,PRUNED
500,500,-0.25909224152565,2021-06-16 22:29:36.456817,2021-06-16 22:31:51.930879,0 days 00:02:15.474062000,1024,50000,0.10734102529706391,0.2205309951303322,0.9,0,0.0001239096563723658,small,10000,PRUNED
501,501,860.6556396484375,2021-06-16 22:30:16.228193,2021-06-16 22:31:58.723427,0 days 00:01:42.495234000,512,50000,0.11254593912369029,0.21830941701729867,0.9,0,0.00018086557009211465,small,1000,PRUNED
502,502,221.92440795898438,2021-06-16 22:31:23.058715,2021-06-16 22:33:10.780178,0 days 00:01:47.721463000,512,50000,0.12110372832429718,0.21970992937325826,0.99,0,0.00036874564168487165,small,200,PRUNED
503,503,1431.0504150390625,2021-06-16 22:31:51.932311,2021-06-16 22:36:29.888510,0 days 00:04:37.956199000,512,10000,0.12115961719987228,0.19868869857977578,0.99,0,0.0003773210069907647,small,200,COMPLETE
504,504,266.95196533203125,2021-06-16 22:31:58.724927,2021-06-16 22:34:09.091390,0 days 00:02:10.366463000,1024,50000,0.09814127761152636,0.19507687187662826,0.99,0,0.00036445142988807757,small,200,PRUNED
505,505,840.7529296875,2021-06-16 22:33:10.781259,2021-06-16 22:36:47.303562,0 days 00:03:36.522303000,1024,50000,0.10008573443731231,0.19436086776639047,0.99,1000,0.0002331543792925427,medium,1000,PRUNED
506,506,-6.983597278594971,2021-06-16 22:34:09.093385,2021-06-16 22:37:44.480121,0 days 00:03:35.386736000,1024,10000,0.10506024293211001,0.177744790666837,0.99,1000,0.00023575515028646216,medium,1000,PRUNED
507,507,1423.0989990234375,2021-06-16 22:36:29.889921,2021-06-16 22:48:02.681155,0 days 00:11:32.791234000,1024,500000,0.10579438304419905,0.17771840270434477,0.99,1000,0.00023535899847931354,medium,1000,COMPLETE
508,508,-404.6684265136719,2021-06-16 22:36:47.304850,2021-06-16 22:36:52.307753,0 days 00:00:05.002903000,1024,50000,0.10617250644859867,0.25842841129434097,0.99,20000,0.0002081738670505816,small,1000,PRUNED
509,509,801.5208129882812,2021-06-16 22:36:52.308651,2021-06-16 22:38:16.446926,0 days 00:01:24.138275000,1024,500000,0.09368358433997886,0.1767347919740913,0.99,5000,0.00025235786826883295,small,1500,PRUNED
510,510,511.901123046875,2021-06-16 22:37:44.481167,2021-06-16 22:39:11.774541,0 days 00:01:27.293374000,1024,500000,0.09367535163025749,0.22585070695362106,0.999,5000,0.0015081419558635744,small,1500,PRUNED
511,511,830.7582397460938,2021-06-16 22:38:16.448937,2021-06-16 22:40:11.968646,0 days 00:01:55.519709000,1024,100000,0.08678441982564417,0.20465922535858574,0.999,0,0.0016594720726544154,small,1500,PRUNED
512,512,-208.05230712890625,2021-06-16 22:39:11.775796,2021-06-16 22:41:04.733907,0 days 00:01:52.958111000,1024,100000,0.11026745128362914,0.20758842304283082,0.99,0,0.00015833867300972654,small,1000,PRUNED
513,513,-283.5404052734375,2021-06-16 22:40:11.969939,2021-06-16 22:42:05.905332,0 days 00:01:53.935393000,1024,50000,0.11390991935216559,0.23789699301792808,0.99,0,0.00015450855412030604,small,1000,PRUNED
514,514,-81.15655517578125,2021-06-16 22:41:04.734954,2021-06-16 22:42:33.107823,0 days 00:01:28.372869000,1024,50000,0.1014681536119278,0.23882443305029624,0.99,5000,0.0007453641300363838,small,1000,PRUNED
515,515,787.3588256835938,2021-06-16 22:42:05.906204,2021-06-16 22:43:40.487736,0 days 00:01:34.581532000,1024,50000,0.10227113325357859,0.16549297065100904,0.99,5000,0.00029806980952158636,small,1000,PRUNED
516,516,730.948486328125,2021-06-16 22:42:33.108975,2021-06-16 22:43:33.578487,0 days 00:01:00.469512000,1024,50000,0.1195311939097009,0.2238570246957768,0.99,10000,0.00019102976297420205,small,1000,PRUNED
517,517,1428.86865234375,2021-06-16 22:43:33.579393,2021-06-16 22:47:26.644239,0 days 00:03:53.064846000,1024,50000,0.05130534960528086,0.16236634749359863,0.995,1000,0.0003117333932939325,small,1500,PRUNED
518,518,830.9629516601562,2021-06-16 22:43:40.488703,2021-06-16 22:45:32.806259,0 days 00:01:52.317556000,1024,50000,0.07338042745552911,0.26020336887479156,0.999,1000,0.002041441979181548,small,1500,PRUNED
519,519,1420.1011962890625,2021-06-16 22:45:32.808116,2021-06-16 22:49:55.540618,0 days 00:04:22.732502000,1024,50000,0.12674108820141142,0.19034209943414418,0.99,0,0.0011523646461200252,small,1000,PRUNED
520,520,863.2402954101562,2021-06-16 22:47:26.645165,2021-06-16 22:49:37.766668,0 days 00:02:11.121503000,1024,50000,0.17658871565369258,0.45145196119579667,0.99,0,0.001109229318482281,small,1000,PRUNED
521,521,853.9771118164062,2021-06-16 22:48:02.682735,2021-06-16 22:49:32.297479,0 days 00:01:29.614744000,256,50000,0.0977784865666683,0.18655887795310916,0.99,0,0.0010462511856326776,small,1000,PRUNED
522,522,805.9168090820312,2021-06-16 22:49:32.298688,2021-06-16 22:51:43.051753,0 days 00:02:10.753065000,1024,50000,0.17747001179469266,0.4515109832265897,0.9999,0,0.00045554531556339856,small,1000,PRUNED
523,523,-408.11566162109375,2021-06-16 22:49:37.768055,2021-06-16 22:49:44.161788,0 days 00:00:06.393733000,128,50000,0.1276753051902995,0.2161095962872676,0.999,20000,0.00046267884396853265,small,1500,PRUNED
524,524,829.7817993164062,2021-06-16 22:49:44.162829,2021-06-16 22:51:20.347817,0 days 00:01:36.184988000,1024,50000,0.112027593636786,0.22823598549173726,0.99,5000,0.00018876098840300666,small,1000,PRUNED
