,number,value,datetime_start,datetime_complete,duration,params_batch_size,params_buffer_size,params_exploration_final_eps,params_exploration_fraction,params_gamma,params_learning_starts,params_lr,params_net_arch,params_target_update_interval,state
315,315,-317.37884521484375,2021-06-16 19:46:08.606989,2021-06-16 19:52:19.079154,0 days 00:06:10.472165000,1024,100000,0.08762283637636639,0.19202746169251206,0.99,0,0.00021200731727086304,small,200,COMPLETE
316,316,460.3453674316406,2021-06-16 19:46:29.975390,2021-06-16 19:48:22.231632,0 days 00:01:52.256242000,1024,50000,0.07573013494474447,0.1946004270288762,0.99,0,0.00022039571341717266,small,200,PRUNED
317,317,304.2891845703125,2021-06-16 19:48:20.327237,2021-06-16 19:50:19.746481,0 days 00:01:59.419244000,1024,50000,0.08077048430538274,0.20408525960897,0.99,0,0.00018678891653440885,small,200,PRUNED
318,318,1406.0740966796875,2021-06-16 19:48:22.233128,2021-06-16 19:52:40.919816,0 days 00:04:18.686688000,1024,100000,0.06190898370842061,0.10397003588742014,0.999,0,0.002660281861327674,small,200,PRUNED
319,319,811.991943359375,2021-06-16 19:50:19.747723,2021-06-16 19:52:25.605391,0 days 00:02:05.857668000,1024,100000,0.09254319779018347,0.20713127317428345,0.999,0,0.0020092806359078247,small,200,PRUNED
320,320,1304.1689453125,2021-06-16 19:52:19.080900,2021-06-16 19:56:35.494562,0 days 00:04:16.413662000,1024,100000,0.07697098429912973,0.21208834377427518,0.999,0,0.000339619114500779,small,200,PRUNED
321,321,1423.8604736328125,2021-06-16 19:52:25.606391,2021-06-16 19:56:38.357835,0 days 00:04:12.751444000,1024,100000,0.07440893091791365,0.21702979629182978,0.98,0,0.00035337838674385347,small,1000,PRUNED
322,322,838.9606323242188,2021-06-16 19:52:40.920733,2021-06-16 19:54:10.882474,0 days 00:01:29.961741000,512,50000,0.07593398105988804,0.4702402377902168,0.99,0,7.247750459475006e-05,small,1000,PRUNED
323,323,1406.3497314453125,2021-06-16 19:54:10.883689,2021-06-16 19:58:19.865246,0 days 00:04:08.981557000,1024,50000,0.1147453528380531,0.2162013581932605,0.99,0,0.00029943143215004813,small,1000,PRUNED
324,324,817.6433715820312,2021-06-16 19:56:35.495469,2021-06-16 19:58:33.097295,0 days 00:01:57.601826000,1024,50000,0.08386281734822223,0.24888965701265003,0.99,0,0.00017996878405002442,small,1000,PRUNED
325,325,764.14404296875,2021-06-16 19:56:38.358873,2021-06-16 19:58:47.119703,0 days 00:02:08.760830000,1024,50000,0.12212948599445338,0.2501531200660493,0.99,0,0.0015840936268091707,small,1000,PRUNED
326,326,1427.8349609375,2021-06-16 19:58:19.866170,2021-06-16 20:05:07.116155,0 days 00:06:47.249985000,1024,50000,0.08429265903782213,0.17702978956176046,0.99,0,0.001513189461214502,small,1000,COMPLETE
327,327,-404.6684265136719,2021-06-16 19:58:33.098599,2021-06-16 19:58:38.645938,0 days 00:00:05.547339000,1024,50000,0.10982471449941354,0.22642774940366542,0.99,20000,0.001297959018895422,small,1000,PRUNED
328,328,812.025146484375,2021-06-16 19:58:38.647039,2021-06-16 20:00:43.633330,0 days 00:02:04.986291000,1024,50000,0.12327439988677812,0.17893004344257576,0.999,0,0.0015339219653066971,small,1000,PRUNED
329,329,764.2515869140625,2021-06-16 19:58:47.120660,2021-06-16 20:00:47.604698,0 days 00:02:00.484038000,1024,50000,0.12327271697959623,0.2298758172438598,0.999,0,0.00017007216393521662,small,1000,PRUNED
330,330,813.557373046875,2021-06-16 20:00:43.634178,2021-06-16 20:02:43.467762,0 days 00:01:59.833584000,1024,50000,0.11633177019394293,0.437638492989069,0.99,0,0.00012456523378312896,small,1000,PRUNED
331,331,108.2913818359375,2021-06-16 20:00:47.605705,2021-06-16 20:02:48.417639,0 days 00:02:00.811934000,1024,50000,0.09389640200776508,0.2659188928980202,0.99,0,0.0001252757670480582,small,1000,PRUNED
332,332,-144.65335083007812,2021-06-16 20:02:43.468720,2021-06-16 20:04:47.348898,0 days 00:02:03.880178000,1024,50000,0.09353659323617051,0.1960326630485495,0.99,1000,0.0002935548606926536,small,1500,PRUNED
333,333,1438.3076171875,2021-06-16 20:02:48.418759,2021-06-16 20:07:30.682722,0 days 00:04:42.263963000,256,50000,0.10674394008191519,0.20344395368376947,0.99,1000,0.0002327613348355213,small,1500,COMPLETE
334,334,820.7472534179688,2021-06-16 20:04:47.350130,2021-06-16 20:06:25.270900,0 days 00:01:37.920770000,256,50000,0.19470880896410778,0.48841779109383165,0.9,0,0.0002355696681672895,small,1000,PRUNED
335,335,-6.983597278594971,2021-06-16 20:05:07.118046,2021-06-16 20:05:13.144512,0 days 00:00:06.026466000,256,50000,0.06824707079519712,0.4491230889435331,0.9,20000,0.0002491001781478019,small,1500,PRUNED
336,336,461.08551025390625,2021-06-16 20:05:13.145568,2021-06-16 20:07:07.022745,0 days 00:01:53.877177000,512,50000,0.1068042408149156,0.28979069495256204,0.999,0,0.00039911553077878346,small,10000,PRUNED
337,337,393.795654296875,2021-06-16 20:06:25.271983,2021-06-16 20:08:13.427238,0 days 00:01:48.155255000,512,50000,0.10680979271920864,0.20388619656005186,0.999,0,0.000405676093823063,small,10000,PRUNED
338,338,834.0311889648438,2021-06-16 20:07:07.023809,2021-06-16 20:09:23.284294,0 days 00:02:16.260485000,1024,50000,0.13336677059460667,0.22446901566431812,0.999,0,0.0001914627430220842,small,1000,PRUNED
339,339,-52.277496337890625,2021-06-16 20:07:30.684174,2021-06-16 20:08:58.570136,0 days 00:01:27.885962000,256,50000,0.11214331481748707,0.2036641048549681,0.95,1000,0.00019770103332802613,small,1500,PRUNED
340,340,1380.5916748046875,2021-06-16 20:08:13.428284,2021-06-16 20:11:41.973649,0 days 00:03:28.545365000,256,50000,0.11260676707073608,0.20665943259505098,0.95,1000,0.00019702519019050801,small,1500,PRUNED
341,341,797.0737915039062,2021-06-16 20:08:58.571265,2021-06-16 20:10:42.487254,0 days 00:01:43.915989000,256,50000,0.1183361087719546,0.18826479840496854,0.99,1000,0.00016622585570945576,small,1500,PRUNED
342,342,429.64935302734375,2021-06-16 20:09:23.285416,2021-06-16 20:11:02.161276,0 days 00:01:38.875860000,128,50000,0.11917944419677272,0.1847475082659572,0.99,1000,0.0002732187089460591,small,1500,PRUNED
343,343,802.7059326171875,2021-06-16 20:10:42.488532,2021-06-16 20:12:27.208645,0 days 00:01:44.720113000,256,50000,0.115119354484586,0.166366066655274,0.99,1000,0.0002709402760572113,small,1500,PRUNED
344,344,853.7791748046875,2021-06-16 20:11:02.162541,2021-06-16 20:12:46.960189,0 days 00:01:44.797648000,256,50000,0.11095920513712336,0.16524770686840679,0.99,1000,0.00021886555120618332,small,1500,PRUNED
345,345,756.46630859375,2021-06-16 20:11:41.974504,2021-06-16 20:13:20.567070,0 days 00:01:38.592566000,256,50000,0.12683052892856064,0.23298652507441187,0.99,1000,0.00013681126046185697,small,1500,PRUNED
346,346,741.5256958007812,2021-06-16 20:12:27.209672,2021-06-16 20:13:53.938664,0 days 00:01:26.728992000,256,50000,0.09840435649490024,0.23544411450988612,0.99,1000,0.00014656040004597126,small,1500,PRUNED
347,347,787.5087280273438,2021-06-16 20:12:46.961258,2021-06-16 20:14:56.702840,0 days 00:02:09.741582000,1024,50000,0.10012954856305234,0.2382824694266742,0.999,0,0.0001464287207785923,small,1000,PRUNED
348,348,1418.9798583984375,2021-06-16 20:13:20.567983,2021-06-16 20:19:43.553435,0 days 00:06:22.985452000,1024,500000,0.10078055886640538,0.21229063032519854,0.999,0,0.0003311775131916593,small,1000,COMPLETE
349,349,782.3126831054688,2021-06-16 20:13:53.939987,2021-06-16 20:15:56.869282,0 days 00:02:02.929295000,1024,500000,0.10229626359268738,0.21691478451923646,0.999,0,0.0003071008064306744,small,1000,PRUNED
350,350,1396.0889892578125,2021-06-16 20:14:56.704249,2021-06-16 20:19:06.715421,0 days 00:04:10.011172000,1024,500000,0.10425084017681659,0.2211554903568016,0.999,0,0.0003227313656652371,small,1000,PRUNED
351,351,788.9730224609375,2021-06-16 20:15:56.870380,2021-06-16 20:17:57.088517,0 days 00:02:00.218137000,1024,50000,0.10590984276056946,0.46059924127584734,0.995,0,0.00033882984324391444,small,1000,PRUNED
352,352,844.0757446289062,2021-06-16 20:17:57.089528,2021-06-16 20:20:02.303201,0 days 00:02:05.213673000,1024,50000,0.12663722832941565,0.19305185427973215,0.99,0,0.00023272930991886825,small,1000,PRUNED
353,353,803.112548828125,2021-06-16 20:19:06.717178,2021-06-16 20:21:19.835757,0 days 00:02:13.118579000,1024,50000,0.10922973392083397,0.19587019602166264,0.99,0,0.00024373301728397288,small,1000,PRUNED
354,354,-405.0184326171875,2021-06-16 20:19:43.554830,2021-06-16 20:19:48.721672,0 days 00:00:05.166842000,1024,50000,0.12586034438071436,0.014650272984053164,0.99,20000,0.00023411057999522263,small,1500,PRUNED
355,355,1411.9403076171875,2021-06-16 20:19:48.722401,2021-06-16 20:24:34.765088,0 days 00:04:46.042687000,1024,50000,0.1089790432152046,0.19268196852525477,0.99,0,0.00017665180650122754,small,1000,PRUNED
356,356,1387.0672607421875,2021-06-16 20:20:02.304556,2021-06-16 20:25:07.825420,0 days 00:05:05.520864000,1024,50000,0.10878056246982873,0.1988441183333545,0.98,0,0.00016566497557474194,small,1,PRUNED
357,357,-249.7030792236328,2021-06-16 20:21:19.836985,2021-06-16 20:23:26.969601,0 days 00:02:07.132616000,1024,50000,0.11663182060327877,0.20616982982758775,0.9999,5000,0.00016283614468360337,small,1,PRUNED
358,358,780.5567016601562,2021-06-16 20:23:26.970679,2021-06-16 20:25:39.076590,0 days 00:02:12.105911000,1024,50000,0.09557801694318288,0.22247942876400936,0.99,0,0.0001823622763798801,small,1500,PRUNED
359,359,726.4340209960938,2021-06-16 20:24:34.766272,2021-06-16 20:26:45.554183,0 days 00:02:10.787911000,1024,50000,0.0963197065362428,0.2253383815119492,0.98,0,0.001273223690917122,small,1500,PRUNED
360,360,10.349593162536621,2021-06-16 20:25:07.826503,2021-06-16 20:26:11.649772,0 days 00:01:03.823269000,1024,50000,0.09595487604592506,0.2271763884853579,0.99,10000,0.001202296968024078,small,1500,PRUNED
361,361,441.6449279785156,2021-06-16 20:25:39.077702,2021-06-16 20:26:47.884877,0 days 00:01:08.807175000,1024,100000,0.12051123189884483,0.24515233202043518,0.99,10000,0.0011730543618308708,small,1000,PRUNED
362,362,719.2565307617188,2021-06-16 20:26:11.650742,2021-06-16 20:27:46.787178,0 days 00:01:35.136436000,1024,100000,0.12136945767814578,0.17614469977596034,0.999,5000,0.00010819030409895376,small,1000,PRUNED
363,363,1435.804443359375,2021-06-16 20:26:45.555108,2021-06-16 20:32:51.663115,0 days 00:06:06.108007000,1024,100000,0.12164843226342197,0.244531958403545,0.999,5000,0.0004320163777990082,small,1000,COMPLETE
364,364,833.2227172851562,2021-06-16 20:26:47.885685,2021-06-16 20:28:29.407888,0 days 00:01:41.522203000,1024,50000,0.09125510523198613,0.12656546116866013,0.999,5000,0.000453918248090609,small,1000,PRUNED
365,365,669.0263671875,2021-06-16 20:27:46.788674,2021-06-16 20:29:20.619269,0 days 00:01:33.830595000,1024,50000,0.11300316711268657,0.4348173797512278,0.99,5000,0.0003760349601552195,small,1000,PRUNED
366,366,-6.983597278594971,2021-06-16 20:28:29.408819,2021-06-16 20:28:35.224328,0 days 00:00:05.815509000,1024,50000,0.0881221823924597,0.2596305859349711,0.99,20000,0.0002747247094768494,small,1000,PRUNED
367,367,815.6722412109375,2021-06-16 20:28:35.225003,2021-06-16 20:30:11.220084,0 days 00:01:35.995081000,1024,50000,0.11552923678037379,0.4263710064953495,0.99,5000,0.000369245272143227,small,1000,PRUNED
368,368,811.3635864257812,2021-06-16 20:29:20.620469,2021-06-16 20:31:04.130196,0 days 00:01:43.509727000,512,50000,0.10320079629258773,0.20959681201549893,0.99,0,0.0024246826122743615,small,1500,PRUNED
369,369,33.93857955932617,2021-06-16 20:30:11.221044,2021-06-16 20:31:49.359488,0 days 00:01:38.138444000,512,50000,0.13087143121241107,0.21393324028087898,0.999,0,0.00021539056705623943,small,5000,PRUNED
370,370,712.7561645507812,2021-06-16 20:31:04.131324,2021-06-16 20:33:05.353455,0 days 00:02:01.222131000,1024,50000,0.13190297990386934,0.45156544240408203,0.999,0,0.00020790598874349938,small,5000,PRUNED
371,371,814.5606079101562,2021-06-16 20:31:49.360636,2021-06-16 20:33:43.226734,0 days 00:01:53.866098000,1024,50000,0.10023597905843722,0.45517301715572184,0.95,1000,0.000272453569114556,small,1000,PRUNED
372,372,616.8638916015625,2021-06-16 20:32:51.665370,2021-06-16 20:34:24.620536,0 days 00:01:32.955166000,1024,100000,0.11561592804819254,0.27440600711100605,0.95,5000,0.0005178956528246484,small,1500,PRUNED
373,373,680.8695068359375,2021-06-16 20:33:05.354438,2021-06-16 20:34:41.121096,0 days 00:01:35.766658000,1024,100000,0.09959837834196274,0.24396458516453237,0.95,5000,0.00041262256866754943,small,1500,PRUNED
374,374,812.9085693359375,2021-06-16 20:33:43.228021,2021-06-16 20:35:25.111578,0 days 00:01:41.883557000,1024,100000,0.11730449495705489,0.24525065168009066,0.99,5000,0.000453796239061061,small,1500,PRUNED
375,375,661.88037109375,2021-06-16 20:34:24.622121,2021-06-16 20:36:09.604151,0 days 00:01:44.982030000,1024,100000,0.12122191241899354,0.2434054627685671,0.99,5000,0.00040934225505440954,small,1000,PRUNED
376,376,836.6311645507812,2021-06-16 20:34:41.122011,2021-06-16 20:35:44.057062,0 days 00:01:02.935051000,128,100000,0.12065049697354181,0.2555333581299296,0.99,5000,0.0003460109422708075,small,1000,PRUNED
377,377,-306.5135803222656,2021-06-16 20:35:25.112658,2021-06-16 20:36:31.191494,0 days 00:01:06.078836000,128,100000,0.10467299313877054,0.23092060577407267,0.99,5000,0.0003377312053190665,small,1000,PRUNED
378,378,803.7903442382812,2021-06-16 20:35:44.058739,2021-06-16 20:37:25.989787,0 days 00:01:41.931048000,1024,100000,0.10575199715308993,0.24079108285035178,0.99,5000,0.0004827948595025682,small,1000,PRUNED
379,379,919.3338623046875,2021-06-16 20:36:09.605146,2021-06-16 20:39:58.272783,0 days 00:03:48.667637000,1024,100000,0.10598700347735766,0.3307885649975195,0.999,5000,0.0010411013914359483,small,1000,PRUNED
380,380,733.7745361328125,2021-06-16 20:36:31.192469,2021-06-16 20:38:03.813825,0 days 00:01:32.621356000,1024,50000,0.080448120369912,0.10784538668622394,0.999,5000,0.00026833022330248924,small,1000,PRUNED
381,381,48.645751953125,2021-06-16 20:37:25.990797,2021-06-16 20:39:03.412061,0 days 00:01:37.421264000,1024,50000,0.09133694958152218,0.15695739931993982,0.999,5000,0.0009215199238583366,small,1000,PRUNED
382,382,779.6143188476562,2021-06-16 20:38:03.815020,2021-06-16 20:39:35.750327,0 days 00:01:31.935307000,1024,50000,0.1118030808201314,0.4448284576284436,0.999,5000,0.0009090559088973564,small,1500,PRUNED
383,383,753.1712036132812,2021-06-16 20:39:03.413381,2021-06-16 20:40:36.739801,0 days 00:01:33.326420000,1024,50000,0.1088562582658373,0.21721139356610128,0.99,5000,0.0003046874925786099,small,1500,PRUNED
384,384,-404.59149169921875,2021-06-16 20:39:35.751611,2021-06-16 20:39:40.785044,0 days 00:00:05.033433000,1024,50000,0.09332763763288632,0.23355334542435072,0.99,20000,0.0005756278061840401,small,1000,PRUNED
385,385,1429.135986328125,2021-06-16 20:39:40.786179,2021-06-16 20:43:55.175787,0 days 00:04:14.389608000,1024,50000,0.11041812964562178,0.21750142753728105,0.995,1000,0.0018922372650539826,small,1500,PRUNED
386,386,380.9691162109375,2021-06-16 20:39:58.274008,2021-06-16 20:41:53.518425,0 days 00:01:55.244417000,1024,50000,0.08706168435429174,0.2548837752507236,0.995,1000,0.001864809696996174,small,1500,PRUNED
387,387,796.913818359375,2021-06-16 20:40:36.740620,2021-06-16 20:42:29.752568,0 days 00:01:53.011948000,1024,50000,0.09896367074135534,0.4707536132889571,0.99,1000,0.00024833960070492334,small,1000,PRUNED
388,388,815.7223510742188,2021-06-16 20:41:53.519366,2021-06-16 20:43:25.452390,0 days 00:01:31.933024000,1024,50000,0.09733213959938782,0.4711145459496036,0.99,5000,0.00022769925273458604,small,1000,PRUNED
389,389,1381.744873046875,2021-06-16 20:42:29.753579,2021-06-16 20:47:19.885515,0 days 00:04:50.131936000,1024,50000,0.12467960327495363,0.182730535254423,0.99,0,0.00144357949171275,small,1000,PRUNED
390,390,1141.7130126953125,2021-06-16 20:43:25.453556,2021-06-16 20:46:48.707050,0 days 00:03:23.253494000,256,50000,0.12442938568613929,0.22977590676856588,0.9999,0,0.0015178384001753166,small,1000,PRUNED
391,391,1426.267333984375,2021-06-16 20:43:55.176605,2021-06-16 20:47:12.930941,0 days 00:03:17.754336000,256,500000,0.12531043852954335,0.23049492530572754,0.99,0,0.0003096169490440481,small,1000,PRUNED
392,392,600.5554809570312,2021-06-16 20:46:48.708119,2021-06-16 20:48:58.247633,0 days 00:02:09.539514000,1024,500000,0.11703989706649146,0.18247340492823888,0.99,0,0.00031244398984751643,small,1000,PRUNED
393,393,1421.374755859375,2021-06-16 20:47:12.931793,2021-06-16 20:50:52.767285,0 days 00:03:39.835492000,1024,50000,0.11663938024514395,0.17305990222707235,0.99,5000,0.0002006712779083619,small,1500,PRUNED
394,394,848.25146484375,2021-06-16 20:47:19.886456,2021-06-16 20:48:55.926812,0 days 00:01:36.040356000,1024,50000,0.11756583820316745,0.1714267699336641,0.999,5000,0.0003963770171892945,small,1500,PRUNED
395,395,792.8468627929688,2021-06-16 20:48:55.928591,2021-06-16 20:51:47.953830,0 days 00:02:52.025239000,1024,50000,0.10256521273130449,0.4428693410606464,0.99,5000,0.0001381281423569063,medium,1000,PRUNED
396,396,796.7407836914062,2021-06-16 20:48:58.248743,2021-06-16 20:52:37.471489,0 days 00:03:39.222746000,1024,50000,0.11308442143105961,0.20845882053660605,0.99,5000,0.0001963444285641997,small,1500,PRUNED
397,397,-404.59521484375,2021-06-16 20:50:52.768430,2021-06-16 20:50:57.198782,0 days 00:00:04.430352000,1024,50000,0.10303004419859782,0.43809235798064156,0.999,20000,0.0007713985297764851,medium,1000,PRUNED
398,398,1396.6495361328125,2021-06-16 20:50:57.199803,2021-06-16 20:54:04.652703,0 days 00:03:07.452900000,512,50000,0.11299238957070351,0.224199777668875,0.99,5000,0.001036553567965908,small,1000,PRUNED
399,399,780.1475219726562,2021-06-16 20:51:47.954949,2021-06-16 20:53:38.273827,0 days 00:01:50.318878000,512,50000,0.06965521836103608,0.20694646555123136,0.99,0,0.00048624032461949305,small,1500,PRUNED
400,400,830.6527099609375,2021-06-16 20:52:37.472417,2021-06-16 20:54:27.472196,0 days 00:01:49.999779000,512,50000,0.08597906948984918,0.27053590546746825,0.9,0,0.0005049050526307761,small,1000,PRUNED
401,401,1402.7633056640625,2021-06-16 20:53:38.276325,2021-06-16 20:57:52.714625,0 days 00:04:14.438300000,1024,50000,0.09141639152683874,0.4619140246559624,0.9,0,0.001056519006940915,small,1000,PRUNED
402,402,798.1770629882812,2021-06-16 20:54:04.653811,2021-06-16 20:56:08.823438,0 days 00:02:04.169627000,1024,50000,0.09152281560496542,0.25052131518187626,0.999,0,0.00026561725183951105,small,1000,PRUNED
403,403,177.28640747070312,2021-06-16 20:54:27.473388,2021-06-16 20:58:41.853622,0 days 00:04:14.380234000,1024,100000,0.0950933506695069,0.21831507323174157,0.999,0,0.00025756602860312386,small,10000,PRUNED
404,404,632.265869140625,2021-06-16 20:56:08.824341,2021-06-16 20:58:19.983682,0 days 00:02:11.159341000,1024,100000,0.09487516826352708,0.21800184156083866,0.999,0,0.0006267700596379958,small,10000,PRUNED
405,405,763.0360717773438,2021-06-16 20:57:52.715758,2021-06-16 20:59:33.135041,0 days 00:01:40.419283000,1024,100000,0.09856671841826341,0.20007700316404722,0.999,5000,0.00016582863247351076,small,1500,PRUNED
406,406,818.8931274414062,2021-06-16 20:58:19.985244,2021-06-16 20:59:57.316939,0 days 00:01:37.331695000,1024,50000,0.1083787169249992,0.4259497072401538,0.99,5000,0.00015358000737776328,small,1500,PRUNED
407,407,687.8502197265625,2021-06-16 20:58:41.854479,2021-06-16 21:00:16.740427,0 days 00:01:34.885948000,1024,50000,0.10838593592655697,0.42558949917920647,0.99,5000,0.0001441628485258333,small,1500,PRUNED
408,408,1434.1461181640625,2021-06-16 20:59:33.136154,2021-06-16 21:05:32.724034,0 days 00:05:59.587880000,1024,50000,0.10772966116656825,0.23638805665168403,0.99,5000,0.0003762580847424291,small,1000,COMPLETE
409,409,786.5931396484375,2021-06-16 20:59:57.318295,2021-06-16 21:04:06.601911,0 days 00:04:09.283616000,1024,50000,0.10212377996806804,0.23567265928558198,0.99,0,2.720779208520726e-05,small,1000,PRUNED
410,410,757.6316528320312,2021-06-16 21:00:16.741316,2021-06-16 21:02:20.483038,0 days 00:02:03.741722000,1024,50000,0.1210806798840687,0.23814480862615514,0.99,0,0.00036899638953300727,small,1000,PRUNED
411,411,1433.78076171875,2021-06-16 21:02:20.485015,2021-06-16 21:08:46.686218,0 days 00:06:26.201203000,1024,50000,0.10237645095382862,0.26315202806265886,0.99,1000,0.00021925631904291064,small,1000,COMPLETE
412,412,1435.222900390625,2021-06-16 21:04:06.603643,2021-06-16 21:10:34.447200,0 days 00:06:27.843557000,1024,50000,0.1826815827079732,0.18957712804537488,0.99,1000,0.0002152766484701012,small,1000,COMPLETE
413,413,-96.10176086425781,2021-06-16 21:05:32.725336,2021-06-16 21:07:33.992190,0 days 00:02:01.266854000,1024,50000,0.1126766269772777,0.26040180059971346,0.99,1000,0.021041415889849775,small,1000,PRUNED
414,414,-404.59521484375,2021-06-16 21:07:33.993634,2021-06-16 21:07:40.686707,0 days 00:00:06.693073000,1024,50000,0.11889302865336106,0.24717461411532077,0.999,20000,0.0004169401145976944,small,1000,PRUNED
415,415,759.8584594726562,2021-06-16 21:07:40.688615,2021-06-16 21:09:21.322746,0 days 00:01:40.634131000,1024,50000,0.10680185534368528,0.22725232613680807,0.99,5000,0.00045222293285305707,small,1000,PRUNED
416,416,1429.8885498046875,2021-06-16 21:08:46.688370,2021-06-16 21:13:12.925146,0 days 00:04:26.236776000,1024,50000,0.18513090451746325,0.22589005056922115,0.99,1000,0.00035788806494316705,small,1000,PRUNED
417,417,802.62255859375,2021-06-16 21:09:21.324118,2021-06-16 21:11:44.170014,0 days 00:02:22.845896000,1024,50000,0.10988397218060672,0.2383204180341272,0.99,1000,0.00030491432772204594,small,1,PRUNED
418,418,804.353759765625,2021-06-16 21:10:34.449089,2021-06-16 21:12:41.415216,0 days 00:02:06.966127000,1024,50000,0.10553700189857076,0.1929193340800552,0.99,1000,0.0003328376517833344,small,1500,PRUNED
419,419,804.7662963867188,2021-06-16 21:11:44.171323,2021-06-16 21:13:50.775951,0 days 00:02:06.604628000,1024,50000,0.10535078162006266,0.19090203581056175,0.99,1000,0.00034843442500206095,small,1500,PRUNED
