,number,value,datetime_start,datetime_complete,duration,params_Ve,params_batch_size,params_buffer_size,params_exploration_final_eps,params_exploration_fraction,params_gamma,params_learning_starts,params_lr,params_net_arch,params_target_update_interval,state
697,697,0.0,2021-07-01 19:13:39.854221,2021-07-01 19:14:50.892530,0 days 00:01:11.038309000,8.857339924601156,256,50000,0.07989539781919318,0.19526997946836677,0.9,1000,5.260619791653559e-05,medium,50,PRUNED
698,698,-0.5906866788864136,2021-07-01 19:13:53.030061,2021-07-01 19:14:21.162042,0 days 00:00:28.131981000,8.171495679687123,256,50000,0.07241916891289585,0.47729049083643876,0.9999,1000,0.003541852281141267,medium,100,PRUNED
699,699,0.0,2021-07-01 19:14:21.163836,2021-07-01 19:14:51.849621,0 days 00:00:30.685785000,7.557823109549016,256,10000,0.08647016130600316,0.20406966907586888,0.9999,1000,0.0001180337882012423,medium,50,PRUNED
700,700,205.16595458984375,2021-07-01 19:14:39.374752,2021-07-01 19:15:51.879770,0 days 00:01:12.505018000,7.449362934184569,256,10000,0.12610495933839538,0.2082016858358425,0.9999,1000,0.0001093856055457625,medium,50,PRUNED
701,701,824.64013671875,2021-07-01 19:14:50.893991,2021-07-01 19:16:06.447994,0 days 00:01:15.554003000,7.5032387877645546,256,10000,0.1281196392808109,0.20725699030227723,0.9999,1000,0.00011044701128118778,medium,1,PRUNED
702,702,0.0,2021-07-01 19:14:51.850528,2021-07-01 19:16:16.296600,0 days 00:01:24.446072000,9.477130483151488,256,500000,0.12986396436880224,0.1623876337905187,0.95,0,0.0001013607519563196,medium,1,PRUNED
703,703,-0.18733397126197815,2021-07-01 19:15:51.881025,2021-07-01 19:16:41.551708,0 days 00:00:49.670683000,9.603523545587837,256,500000,0.003058625476771229,0.3333169453443758,0.95,0,0.00022513015514858206,medium,1,PRUNED
704,704,-8.647640228271484,2021-07-01 19:16:06.449524,2021-07-01 19:16:51.687786,0 days 00:00:45.238262000,9.04017949245492,64,500000,0.1831174775741662,0.2269154077202907,0.95,0,0.00016662797994588418,medium,1,PRUNED
705,705,0.0,2021-07-01 19:16:16.297872,2021-07-01 19:16:57.902713,0 days 00:00:41.604841000,10.252296603947007,64,500000,0.15122606409929645,0.17122370903922823,0.999,1000,0.00014048014364430165,medium,1,PRUNED
706,706,0.0,2021-07-01 19:16:41.552863,2021-07-01 19:16:43.685252,0 days 00:00:02.132389000,10.267533843986783,64,500000,0.1851031090367991,0.2258375718611909,0.999,5000,0.00014624709615004687,medium,100,PRUNED
707,707,-404.1982727050781,2021-07-01 19:16:43.686807,2021-07-01 19:16:55.087585,0 days 00:00:11.400778000,8.279662403571068,128,10000,0.07465897418792772,0.1846791902655172,0.9999,10000,0.0008788496164649754,small,1,PRUNED
708,708,0.0,2021-07-01 19:16:51.689092,2021-07-01 19:17:21.102840,0 days 00:00:29.413748000,7.789100445098663,128,10000,0.07526177484880409,0.17141277460667736,0.99,1000,0.0008647081658806476,small,1,PRUNED
709,709,694.2577514648438,2021-07-01 19:16:55.090683,2021-07-01 19:18:10.309135,0 days 00:01:15.218452000,7.84498088661142,256,500000,0.06093398242664976,0.12119528886615996,0.99,1000,0.0007523481041086231,medium,1000,PRUNED
710,710,0.0,2021-07-01 19:16:57.903442,2021-07-01 19:16:59.777008,0 days 00:00:01.873566000,7.066427700740814,256,10000,0.062165730728685004,0.37575839778940456,0.99,20000,0.0006626807070202528,medium,1000,PRUNED
711,711,0.0,2021-07-01 19:16:59.777675,2021-07-01 19:18:04.167765,0 days 00:01:04.390090000,7.7193175532113765,128,500000,0.19450636293351917,0.2834132597581744,0.9999,1000,8.526369108947982e-05,medium,1,PRUNED
712,712,0.0,2021-07-01 19:17:21.104437,2021-07-01 19:17:56.612771,0 days 00:00:35.508334000,8.113114305857794,256,500000,0.0700047067173107,0.26739742241913755,0.9999,1000,8.819954322958778e-05,medium,1,PRUNED
713,713,0.0,2021-07-01 19:17:56.613823,2021-07-01 19:18:27.878917,0 days 00:00:31.265094000,8.34504834271535,512,500000,0.19465145911156406,0.23152737430788656,0.9999,1000,0.002544415237803568,medium,100,PRUNED
714,714,0.0,2021-07-01 19:18:04.168684,2021-07-01 19:18:32.801673,0 days 00:00:28.632989000,11.97255885992893,512,10000,0.16730905771130664,0.18869919182355518,0.9,1000,4.468923032262938e-05,medium,100,PRUNED
715,715,0.0,2021-07-01 19:18:10.309990,2021-07-01 19:18:50.563632,0 days 00:00:40.253642000,8.34990397428159,1024,10000,0.174715007975772,0.1853078002185718,0.9,1000,0.0009924845847103072,medium,100,PRUNED
716,716,821.7166748046875,2021-07-01 19:18:27.880209,2021-07-01 19:20:40.677056,0 days 00:02:12.796847000,8.557727265988596,1024,10000,0.17587445857072498,0.18713996009325548,0.9,1000,0.0013749058904155942,medium,1,PRUNED
717,717,0.0,2021-07-01 19:18:32.802258,2021-07-01 19:19:10.912730,0 days 00:00:38.110472000,8.509585488649664,1024,50000,0.14424012513756146,0.21382849309355267,0.9999,1000,6.790189740340315e-05,medium,10,PRUNED
718,718,-2.5452497005462646,2021-07-01 19:18:50.564638,2021-07-01 19:19:14.141373,0 days 00:00:23.576735000,8.583526881366726,256,50000,0.0825320250936214,0.14990186156662183,0.9999,1000,0.023921156454034913,medium,10,PRUNED
719,719,659.2501220703125,2021-07-01 19:19:10.914322,2021-07-01 19:20:34.865446,0 days 00:01:23.951124000,9.001515395193316,256,10000,0.13817718661402373,0.24845401037191422,0.9999,1000,0.001332318745314982,medium,1,PRUNED
720,720,-403.6917419433594,2021-07-01 19:19:14.142089,2021-07-01 19:19:28.050236,0 days 00:00:13.908147000,9.988067999109111,256,10000,0.09049680749538777,0.2516215239534388,0.9999,5000,0.00012423324495921962,small,1,PRUNED
721,721,0.0,2021-07-01 19:19:28.051148,2021-07-01 19:19:59.971848,0 days 00:00:31.920700000,7.6269011995675475,256,500000,0.0708374225795429,0.23926446292910292,0.9,1000,6.079880261372094e-05,medium,1,PRUNED
722,722,0.0,2021-07-01 19:19:59.972937,2021-07-01 19:20:29.494791,0 days 00:00:29.521854000,8.01706571811527,128,500000,0.13764491684311658,0.19821728796359794,0.9999,0,0.001310133884385308,medium,1,PRUNED
723,723,-0.3491486608982086,2021-07-01 19:20:29.496049,2021-07-01 19:20:59.150043,0 days 00:00:29.653994000,9.347520811126534,256,10000,0.10371298163331977,0.1770019339902373,0.9999,1000,9.066591950494214e-05,medium,1,PRUNED
724,724,-0.6941182613372803,2021-07-01 19:20:34.866225,2021-07-01 19:21:12.328509,0 days 00:00:37.462284000,8.140017373975127,256,500000,0.10357239206297311,0.2198478292204094,0.999,1000,0.008184812406245825,medium,1,PRUNED
725,725,0.0,2021-07-01 19:20:40.678295,2021-07-01 19:21:08.452064,0 days 00:00:27.773769000,9.374332272624475,256,500000,0.1028589156587798,0.40160125002469216,0.999,1000,0.00010368152192138344,medium,1,PRUNED
726,726,0.0,2021-07-01 19:20:59.151152,2021-07-01 19:21:32.050779,0 days 00:00:32.899627000,8.195655002185894,128,500000,0.18724204989382548,0.37118394209192435,0.999,1000,0.00022319186801391988,medium,1,PRUNED
727,727,-0.11675600707530975,2021-07-01 19:21:08.452791,2021-07-01 19:21:50.345372,0 days 00:00:41.892581000,7.91115465348585,128,500000,0.06576319332282646,0.2210833562196305,0.98,0,0.008103015435757286,medium,1,PRUNED
728,728,115.39847564697266,2021-07-01 19:21:12.329367,2021-07-01 19:21:35.509204,0 days 00:00:23.179837000,7.27995866397846,128,500000,0.09491133778846791,0.35888768051861597,0.9999,0,0.0001782972796224979,small,1000,PRUNED
729,729,53.95783233642578,2021-07-01 19:21:32.051819,2021-07-01 19:21:56.729034,0 days 00:00:24.677215000,7.9034258417905745,64,50000,0.06560992175675791,0.15835175928205242,0.98,0,0.000621290984112467,small,1000,PRUNED
730,730,0.0,2021-07-01 19:21:35.510629,2021-07-01 19:22:12.792061,0 days 00:00:37.281432000,7.788122629613612,64,50000,0.05441852047740583,0.20594536538499422,0.98,1000,0.005739073626496847,medium,1,PRUNED
731,731,-0.01140447799116373,2021-07-01 19:21:50.346534,2021-07-01 19:22:32.839093,0 days 00:00:42.492559000,8.714484938653815,64,50000,0.07730375681355019,0.16361732221815917,0.9,1000,0.005561485071160823,medium,1,PRUNED
732,732,0.0,2021-07-01 19:21:56.729873,2021-07-01 19:22:41.112577,0 days 00:00:44.382704000,7.736853429722808,256,10000,0.16262254601091053,0.20848077270912765,0.9,1000,0.000139093373122324,medium,1,PRUNED
733,733,7.859569549560547,2021-07-01 19:22:12.793137,2021-07-01 19:22:49.858819,0 days 00:00:37.065682000,10.574687518907984,256,10000,0.08504489163144652,0.2293617983179611,0.9,1000,0.00014351077472084576,medium,1,PRUNED
734,734,0.0,2021-07-01 19:22:32.841718,2021-07-01 19:23:01.781002,0 days 00:00:28.939284000,9.008059995669544,256,10000,0.08647010117157168,0.20237766313655525,0.9999,1000,0.000290312323356533,medium,1,PRUNED
735,735,0.03165436163544655,2021-07-01 19:22:41.113407,2021-07-01 19:23:15.535832,0 days 00:00:34.422425000,10.592706338958786,512,10000,0.08471868952006364,0.2344157584269781,0.9999,1000,0.0007565085813084335,medium,100,PRUNED
736,736,0.0,2021-07-01 19:22:49.859971,2021-07-01 19:23:26.998413,0 days 00:00:37.138442000,9.674627229048065,512,10000,0.12431036956881651,0.13876989763024405,0.9999,1000,7.204297246803565e-05,medium,100,PRUNED
737,737,0.0,2021-07-01 19:23:01.782126,2021-07-01 19:23:05.007798,0 days 00:00:03.225672000,7.426842141908308,512,500000,0.18092905071284412,0.19423846977459075,0.9999,5000,7.035077359033124e-05,medium,100,PRUNED
738,738,0.0,2021-07-01 19:23:05.008632,2021-07-01 19:23:11.413674,0 days 00:00:06.405042000,9.684563940214526,256,500000,0.1246538130899542,0.13798905953822493,0.9999,10000,0.0007152440596349747,medium,1,PRUNED
739,739,-6.178235054016113,2021-07-01 19:23:11.415769,2021-07-01 19:23:48.897892,0 days 00:00:37.482123000,7.632502668295297,256,10000,0.07945766064703862,0.17526277899644246,0.95,1000,0.012197325139212766,medium,50,PRUNED
740,740,0.0,2021-07-01 19:23:15.536552,2021-07-01 19:23:17.485925,0 days 00:00:01.949373000,9.201384518262845,256,500000,0.132878434721927,0.17556420947812895,0.95,20000,3.525755009045946e-05,medium,50,PRUNED
741,741,98.88815307617188,2021-07-01 19:23:17.487274,2021-07-01 19:24:20.938083,0 days 00:01:03.450809000,8.08617174216402,128,10000,0.073507593474834,0.21300010571747283,0.9999,1000,9.840305487760563e-05,small,1,PRUNED
742,742,-0.7347033023834229,2021-07-01 19:23:26.999603,2021-07-01 19:23:56.262718,0 days 00:00:29.263115000,7.625386637796121,128,500000,0.11803153068308589,0.21311149596143478,0.9999,1000,0.00010020271592965863,small,1,PRUNED
743,743,-2.9284496307373047,2021-07-01 19:23:48.899021,2021-07-01 19:24:22.505804,0 days 00:00:33.606783000,8.064683933735298,128,500000,0.07195079346926647,0.21680643640061162,0.9999,1000,0.00010030657176041265,small,1,PRUNED
744,744,0.0,2021-07-01 19:23:56.264566,2021-07-01 19:24:35.160221,0 days 00:00:38.895655000,8.096597279665135,256,500000,0.1897999979859635,0.25840819824174033,0.9999,1000,0.00011230362715480836,medium,1,PRUNED
745,745,0.0,2021-07-01 19:24:20.939187,2021-07-01 19:24:54.859260,0 days 00:00:33.920073000,8.812427374487289,256,500000,0.10849250276436542,0.39123858644116555,0.9,0,0.0005050241227582582,medium,1,PRUNED
746,746,1.5436111688613892,2021-07-01 19:24:22.506663,2021-07-01 19:24:54.508142,0 days 00:00:32.001479000,8.844731310599064,256,500000,0.05852988043525338,0.2625778643068592,0.9,0,0.0005310279177337175,medium,10,PRUNED
747,747,-1.8963016271591187,2021-07-01 19:24:35.161200,2021-07-01 19:25:23.463704,0 days 00:00:48.302504000,8.86650504540394,1024,10000,0.06062503575348664,0.19075176945738564,0.9,0,0.0010598535800935675,medium,10,PRUNED
748,748,0.0,2021-07-01 19:24:54.509356,2021-07-01 19:25:38.226962,0 days 00:00:43.717606000,8.299019680841164,1024,10000,0.08176526609755179,0.19141033291507423,0.9,1000,0.00018378036347109017,medium,1,PRUNED
749,749,0.0,2021-07-01 19:24:54.860810,2021-07-01 19:25:34.611853,0 days 00:00:39.751043000,8.406131994904758,1024,10000,0.0664261555571947,0.19992179874084895,0.9999,1000,0.0009607907916270173,medium,1000,PRUNED
750,750,-0.04916452243924141,2021-07-01 19:25:23.465331,2021-07-01 19:25:57.371627,0 days 00:00:33.906296000,11.844251781933142,256,10000,0.0779305463933879,0.24186880520743295,0.9999,1000,0.00012461741928214475,medium,1000,PRUNED
751,751,-4.775439262390137,2021-07-01 19:25:34.612895,2021-07-01 19:26:58.479468,0 days 00:01:23.866573000,7.898918654869382,64,50000,0.0981868409830873,0.24367818950631473,0.9999,1000,0.00012430156529466373,medium,1,PRUNED
752,752,0.0,2021-07-01 19:25:38.227781,2021-07-01 19:25:46.403888,0 days 00:00:08.176107000,7.802084125717069,256,50000,0.09762781209178195,0.23488998104741357,0.9999,5000,0.00013007792423658652,medium,1,PRUNED
753,753,0.0,2021-07-01 19:25:46.405609,2021-07-01 19:27:01.636175,0 days 00:01:15.230566000,10.095070067845834,64,500000,0.11276229124753759,0.224828559261167,0.99,1000,4.6738497751508114e-05,medium,1,PRUNED
754,754,0.0,2021-07-01 19:25:57.372750,2021-07-01 19:26:29.707789,0 days 00:00:32.335039000,9.95586060977188,64,500000,0.180937639251656,0.22387198274647896,0.99,1000,7.891787071736392e-05,medium,1,PRUNED
755,755,710.5143432617188,2021-07-01 19:26:29.708519,2021-07-01 19:27:58.485009,0 days 00:01:28.776490000,9.073128584082797,256,500000,0.13111883252425427,0.15081027285361942,0.95,1000,0.004557753401669491,medium,1,PRUNED
756,756,-0.053575363010168076,2021-07-01 19:26:58.480454,2021-07-01 19:27:30.742503,0 days 00:00:32.262049000,9.102685023547457,256,500000,0.11456939199357463,0.15061294348414467,0.95,1000,5.858717468564157e-05,medium,1,PRUNED
757,757,0.0,2021-07-01 19:27:01.637273,2021-07-01 19:27:35.549800,0 days 00:00:33.912527000,7.387105970006616,256,500000,0.12814814531731833,0.15021005585449043,0.95,1000,0.0006570332030186502,medium,1,PRUNED
758,758,0.7904012799263,2021-07-01 19:27:30.743851,2021-07-01 19:27:53.519919,0 days 00:00:22.776068000,11.989492542552492,128,10000,0.1285699405825024,0.2781662061604474,0.999,1000,0.00016293634294643067,medium,100,PRUNED
759,759,0.0,2021-07-01 19:27:35.550601,2021-07-01 19:27:57.964787,0 days 00:00:22.414186000,7.521590160683302,128,10000,0.18663626588076757,0.1845171637102268,0.999,1000,0.00024736241878210507,medium,100,PRUNED
760,760,-0.6060594320297241,2021-07-01 19:27:53.520574,2021-07-01 19:28:36.004104,0 days 00:00:42.483530000,8.685359946322102,256,10000,0.18768082774265502,0.18289872241317373,0.9999,1000,0.00023676372168967427,medium,1,PRUNED
761,761,3.7667858600616455,2021-07-01 19:27:57.965700,2021-07-01 19:28:32.130778,0 days 00:00:34.165078000,8.629458012469295,256,500000,0.06934574009474023,0.16802403307583885,0.9999,1000,0.0003185231469198297,small,1,PRUNED
762,762,0.0,2021-07-01 19:27:58.486155,2021-07-01 19:28:37.440096,0 days 00:00:38.953941000,8.671739280645609,256,10000,0.09014279371919375,0.32660912076217125,0.9999,0,9.17287065770036e-05,small,1,PRUNED
763,763,0.0,2021-07-01 19:28:32.133202,2021-07-01 19:29:28.491478,0 days 00:00:56.358276000,7.975648417545059,512,10000,0.054167575228265624,0.20260281435882072,0.9999,0,0.002100985885797722,medium,1,PRUNED
764,764,0.0,2021-07-01 19:28:36.004835,2021-07-01 19:29:25.695058,0 days 00:00:49.690223000,7.9771913425432475,512,50000,0.09101083134420843,0.20345610372552791,0.9,0,8.298227537046208e-05,medium,1,PRUNED
765,765,0.0,2021-07-01 19:28:37.440683,2021-07-01 19:28:43.303957,0 days 00:00:05.863274000,10.776082949152926,512,50000,0.033353632144782014,0.370689802179413,0.9,5000,0.0015802079392167104,medium,1,PRUNED
766,766,0.0,2021-07-01 19:28:43.304673,2021-07-01 19:29:10.580025,0 days 00:00:27.275352000,7.973149995955032,128,500000,0.14667734640910074,0.35293926224271477,0.9999,1000,0.0020483428867431935,medium,1,PRUNED
767,767,0.0,2021-07-01 19:29:10.581180,2021-07-01 19:29:12.440339,0 days 00:00:01.859159000,11.062620323138137,256,500000,0.07568152388550894,0.2041940195607433,0.9,10000,0.0008091331494170169,medium,1000,PRUNED
768,768,836.0402221679688,2021-07-01 19:29:12.441115,2021-07-01 19:30:27.079216,0 days 00:01:14.638101000,8.265945277559263,256,10000,0.013748040414645973,0.2961056486158312,0.9999,1000,8.465945989999106e-05,medium,1,PRUNED
769,769,774.6046752929688,2021-07-01 19:29:25.697281,2021-07-01 19:30:36.555983,0 days 00:01:10.858702000,8.159024882024955,256,10000,0.009072151264316028,0.21180576475487903,0.9999,1000,7.443582063459168e-05,medium,50,PRUNED
770,770,-3.39927339553833,2021-07-01 19:29:28.492196,2021-07-01 19:29:58.352042,0 days 00:00:29.859846000,9.264644743043883,256,500000,0.11961803325687909,0.30375380538135044,0.9999,1000,0.0005808315370938386,medium,1,PRUNED
771,771,0.0,2021-07-01 19:29:58.353182,2021-07-01 19:30:22.319196,0 days 00:00:23.966014000,8.211242192049644,128,10000,0.009792956610113215,0.21484910642501923,0.9999,1000,0.0010676942814715803,medium,50,PRUNED
772,772,0.0,2021-07-01 19:30:22.320844,2021-07-01 19:30:24.389084,0 days 00:00:02.068240000,9.435951542261318,64,500000,0.08173768503639132,0.23068033977925756,0.9999,20000,7.70911283035614e-05,medium,100,PRUNED
773,773,-0.33303627371788025,2021-07-01 19:30:24.389857,2021-07-01 19:30:56.307274,0 days 00:00:31.917417000,8.223602015736704,256,10000,0.06299672191314018,0.16252030120166636,0.9999,1000,0.010586409696800275,medium,1,PRUNED
774,774,-162.22499084472656,2021-07-01 19:30:27.080029,2021-07-01 19:30:59.677847,0 days 00:00:32.597818000,7.688776398413723,256,500000,0.0706824199916716,0.16406921245917447,0.9,1000,0.041356812678085955,medium,1,PRUNED
775,775,0.0,2021-07-01 19:30:36.556787,2021-07-01 19:31:02.751947,0 days 00:00:26.195160000,7.675043791899075,1024,500000,0.06345060333538531,0.16785695908210801,0.9,1000,0.00322777176521455,small,10,PRUNED
776,776,-39.10806655883789,2021-07-01 19:30:56.308375,2021-07-01 19:31:29.883761,0 days 00:00:33.575386000,7.6967468191436055,1024,500000,0.07232439647341907,0.38469172360646203,0.9,1000,0.01481740453562459,small,1,PRUNED
777,777,-0.15394103527069092,2021-07-01 19:30:59.678588,2021-07-01 19:31:33.167483,0 days 00:00:33.488895000,7.857550458637133,1024,500000,0.18258967733134934,0.17994612952299974,0.999,1000,0.0004023837977157802,small,10,PRUNED
778,778,4.53484582901001,2021-07-01 19:31:02.753136,2021-07-01 19:31:31.325001,0 days 00:00:28.571865000,9.862114817815785,128,500000,0.1782705533549519,0.19652773628227532,0.999,1000,0.0004026004641522684,medium,1,PRUNED
779,779,0.0,2021-07-01 19:31:29.885317,2021-07-01 19:31:54.068575,0 days 00:00:24.183258000,8.470996180603997,128,50000,0.19176929276022092,0.17937018000336935,0.999,1000,0.00038541359696921406,medium,1000,PRUNED
780,780,-1.1680524349212646,2021-07-01 19:31:31.326155,2021-07-01 19:31:52.478728,0 days 00:00:21.152573000,7.8381734397982195,64,50000,0.18307059466017636,0.3631041794955777,0.9999,1000,0.00011470636811918212,medium,1000,PRUNED
781,781,0.0,2021-07-01 19:31:33.168365,2021-07-01 19:31:35.310959,0 days 00:00:02.142594000,8.975538563308623,64,50000,0.0767718010694422,0.4150623130580331,0.9999,5000,0.00011398561866085444,medium,1000,PRUNED
782,782,725.819580078125,2021-07-01 19:31:35.311710,2021-07-01 19:33:30.142087,0 days 00:01:54.830377000,7.214427621608315,256,10000,0.08737082977488177,0.252547067518019,0.9999,0,0.0001517301563308576,medium,100,COMPLETE
783,783,-2.5294647216796875,2021-07-01 19:31:52.479646,2021-07-01 19:32:19.403799,0 days 00:00:26.924153000,7.181491505933073,256,10000,0.1910035493763817,0.2199485865038603,0.99,0,0.00016938511464111768,medium,100,PRUNED
784,784,0.0,2021-07-01 19:31:54.069383,2021-07-01 19:32:21.284571,0 days 00:00:27.215188000,7.564657673190868,256,10000,0.14043619595126744,0.22411580423175065,0.99,0,0.00014518160781727015,medium,100,PRUNED
785,785,0.0,2021-07-01 19:32:19.404873,2021-07-01 19:32:53.647108,0 days 00:00:34.242235000,7.510984218477325,256,10000,0.06779970001543204,0.2479192113839846,0.9999,1000,0.0001508753276211259,medium,1,PRUNED
786,786,-0.15167450904846191,2021-07-01 19:32:21.286285,2021-07-01 19:32:50.485079,0 days 00:00:29.198794000,9.21203794502764,256,500000,0.13399649450583645,0.25473955565527817,0.9999,1000,5.883950633582034e-05,medium,1,PRUNED
787,787,-0.8794795274734497,2021-07-01 19:32:50.486063,2021-07-01 19:33:23.113117,0 days 00:00:32.627054000,7.45636991768994,128,10000,0.06672752734566964,0.19018005904687768,0.95,1000,0.0007504455196189372,medium,1,PRUNED
788,788,-355.1328125,2021-07-01 19:32:53.647734,2021-07-01 19:33:27.512368,0 days 00:00:33.864634000,9.519698227328501,128,500000,0.0818011418652421,0.19152538279690484,0.95,1000,0.01804559541860983,medium,1,PRUNED
789,789,-239.62481689453125,2021-07-01 19:33:23.114163,2021-07-01 19:34:35.760054,0 days 00:01:12.645891000,10.33680445172619,256,500000,0.12345982908175673,0.23719818338078952,0.9,1000,0.00020782964390377853,medium,1,PRUNED
790,790,0.0,2021-07-01 19:33:27.513057,2021-07-01 19:34:46.334126,0 days 00:01:18.821069000,8.04811002750629,256,500000,0.12355356502638609,0.43219839470874943,0.9,1000,0.0008860195596689272,medium,1,PRUNED
791,791,834.52099609375,2021-07-01 19:33:30.143510,2021-07-01 19:34:50.073613,0 days 00:01:19.930103000,7.300355086308118,256,10000,0.08914181964806404,0.27149291326673197,0.9999,0,0.000195998804355848,medium,1,PRUNED
792,792,0.0,2021-07-01 19:34:35.761274,2021-07-01 19:35:10.505408,0 days 00:00:34.744134000,7.506176080337288,256,10000,0.08511808930998022,0.2698993679514156,0.9999,0,0.0001915969737003125,medium,1,PRUNED
793,793,263.3120422363281,2021-07-01 19:34:46.335103,2021-07-01 19:37:20.464666,0 days 00:02:34.129563000,6.961156482375286,512,10000,0.0843970136772729,0.20256866851405306,0.9999,0,0.0002005854483944341,medium,1,COMPLETE
794,794,0.0,2021-07-01 19:34:50.074835,2021-07-01 19:35:32.368888,0 days 00:00:42.294053000,7.134034875366286,512,10000,0.08700629832211362,0.3769640503784604,0.9999,0,0.00017050880664321675,medium,1,PRUNED
795,795,0.0,2021-07-01 19:35:10.506382,2021-07-01 19:35:55.487483,0 days 00:00:44.981101000,7.181862908504382,512,10000,0.09174926834720376,0.21028156596044972,0.9999,0,0.00015452616113997343,medium,1,PRUNED
796,796,-1.1686002016067505,2021-07-01 19:35:32.369947,2021-07-01 19:35:54.098454,0 days 00:00:21.728507000,7.027158504097789,64,10000,0.09262803933775121,0.20569406582626787,0.9999,0,0.00013152750670179653,small,1,PRUNED
