,number,value,datetime_start,datetime_complete,duration,params_Ve,params_batch_size,params_buffer_size,params_exploration_final_eps,params_exploration_fraction,params_gamma,params_learning_starts,params_lr,params_net_arch,params_target_update_interval,state
997,997,0.0,2021-07-01 20:16:50.095179,2021-07-01 20:17:39.725120,0 days 00:00:49.629941000,8.252324475950765,1024,50000,0.07497103809992149,0.1782902118883388,0.9999,0,0.009647021506336074,medium,100,PRUNED
998,998,-0.818657398223877,2021-07-01 20:17:37.499863,2021-07-01 20:18:06.285064,0 days 00:00:28.785201000,8.682026362752332,128,50000,0.07463967266739184,0.17413472888633372,0.9999,1000,0.01012750217287919,medium,100,PRUNED
999,999,0.0,2021-07-01 20:17:39.725914,2021-07-01 20:18:03.444009,0 days 00:00:23.718095000,9.055192141686687,128,10000,0.08100799816463884,0.16383844933175756,0.9,1000,6.041946490457188e-05,medium,1,PRUNED
