,number,value,datetime_start,datetime_complete,duration,params_Ve,params_batch_size,params_buffer_size,params_exploration_final_eps,params_exploration_fraction,params_gamma,params_learning_starts,params_lr,params_net_arch,params_target_update_interval,state
199,199,-338.41534423828125,2021-07-01 17:20:24.537687,2021-07-01 17:21:19.682328,0 days 00:00:55.144641000,11.984945310920564,128,50000,0.1103452326749762,0.34534886531756614,0.9999,1000,2.782858339859924e-05,medium,10,PRUNED
200,200,0.0,2021-07-01 17:20:27.228934,2021-07-01 17:20:52.036251,0 days 00:00:24.807317000,7.742787362628372,128,50000,0.06317296941485408,0.4438938445889533,0.9999,1000,8.423463333461605e-05,medium,10,PRUNED
201,201,-222.91915893554688,2021-07-01 17:20:39.887456,2021-07-01 17:21:00.462159,0 days 00:00:20.574703000,4.709071082970671,128,50000,0.1432067804754946,0.2562077057427207,0.98,1000,3.052739213500282e-05,medium,5000,PRUNED
202,202,-310.8328552246094,2021-07-01 17:20:52.037446,2021-07-01 17:21:32.976504,0 days 00:00:40.939058000,8.323283621357312,512,10000,0.11070120170762082,0.3459283617907397,0.98,1000,3.1225412312969086e-05,medium,5000,PRUNED
203,203,0.0,2021-07-01 17:21:00.463550,2021-07-01 17:21:02.308645,0 days 00:00:01.845095000,9.063572860976256,128,50000,0.16603899803232194,0.21626561703420774,0.9,5000,0.0002676184827094749,medium,100,PRUNED
204,204,0.0,2021-07-01 17:21:02.309310,2021-07-01 17:21:04.979223,0 days 00:00:02.669913000,11.986373042909047,128,50000,0.051406420666997736,0.21018524932124225,0.9,5000,0.0022995514513956344,medium,100,PRUNED
205,205,0.0,2021-07-01 17:21:04.979812,2021-07-01 17:21:06.804158,0 days 00:00:01.824346000,9.354847231418438,128,50000,0.05957552690184264,0.22540556240020765,0.999,5000,0.00326066927883432,medium,100,PRUNED
206,206,0.0,2021-07-01 17:21:06.804892,2021-07-01 17:21:08.624081,0 days 00:00:01.819189000,8.81828851887964,512,10000,0.07020903399752307,0.2497770980305003,0.9,5000,0.00010779189167429461,medium,100,PRUNED
207,207,0.049973078072071075,2021-07-01 17:21:08.624641,2021-07-01 17:21:39.266163,0 days 00:00:30.641522000,9.195263384653792,256,50000,0.07699978300038265,0.34068191892637173,0.9999,1000,4.730014410164405e-05,medium,100,PRUNED
208,208,0.0,2021-07-01 17:21:19.683371,2021-07-01 17:21:21.435079,0 days 00:00:01.751708000,9.23024877721191,256,10000,0.07731208074105966,0.20399007354337012,0.99,20000,4.489313896500319e-05,medium,100,PRUNED
209,209,0.0,2021-07-01 17:21:21.435638,2021-07-01 17:21:28.013886,0 days 00:00:06.578248000,8.325416284688263,64,10000,0.06249522241989442,0.21764537222584254,0.9999,10000,0.00042094910222136576,medium,1,PRUNED
210,210,-0.43956175446510315,2021-07-01 17:21:28.014510,2021-07-01 17:22:06.194585,0 days 00:00:38.180075000,8.989335224823646,256,500000,0.14929561717300238,0.4041314767741299,0.9999,1000,0.00014808517271145817,medium,1000,PRUNED
211,211,0.0,2021-07-01 17:21:32.977161,2021-07-01 17:21:48.867247,0 days 00:00:15.890086000,7.479636824348412,256,500000,0.07170334717280236,0.1966129883898243,0.9999,5000,0.0006507322684246192,medium,1,PRUNED
212,212,0.0,2021-07-01 17:21:39.267215,2021-07-01 17:21:45.174909,0 days 00:00:05.907694000,7.110711194539403,256,500000,0.034755328723758326,0.24023734567318952,0.9,5000,0.007921556092521794,medium,1000,PRUNED
213,213,740.0930786132812,2021-07-01 17:21:45.176890,2021-07-01 17:23:11.355394,0 days 00:01:26.178504000,10.018428460305511,64,10000,0.1039509391825878,0.3323102470603624,0.9999,1000,0.00014192829706152218,medium,1,PRUNED
214,214,0.04279264807701111,2021-07-01 17:21:48.868720,2021-07-01 17:22:19.268586,0 days 00:00:30.399866000,11.767210164858643,64,10000,0.10532656383777513,0.35286910567588575,0.9999,1000,0.00014860820223593102,medium,1,PRUNED
215,215,1.2430139780044556,2021-07-01 17:22:06.195906,2021-07-01 17:22:47.806490,0 days 00:00:41.610584000,11.693257095457254,64,10000,0.105672748231556,0.3593331996774815,0.9999,1000,7.349094835798405e-05,medium,1,PRUNED
216,216,0.0,2021-07-01 17:22:19.269434,2021-07-01 17:22:56.364735,0 days 00:00:37.095301000,8.92280440707329,64,10000,0.18030291251918748,0.30224445096146085,0.9999,1000,7.41947209249955e-05,medium,1,PRUNED
217,217,0.029451485723257065,2021-07-01 17:22:47.808193,2021-07-01 17:23:18.196925,0 days 00:00:30.388732000,10.000860238608198,64,10000,0.09718428088818445,0.37624927396912056,0.999,1000,0.00011420157577856986,medium,1,PRUNED
218,218,0.0,2021-07-01 17:22:56.365784,2021-07-01 17:23:28.922294,0 days 00:00:32.556510000,10.062280314517517,64,10000,0.09868359071273519,0.33197206708266014,0.999,1000,0.07133203402652795,medium,1,PRUNED
219,219,0.0,2021-07-01 17:23:11.356310,2021-07-01 17:23:38.597834,0 days 00:00:27.241524000,9.466334569020235,64,100000,0.1140429934291193,0.22442197968487215,0.999,0,9.677212381742112e-05,medium,50,PRUNED
220,220,759.5673217773438,2021-07-01 17:23:18.197572,2021-07-01 17:24:16.205364,0 days 00:00:58.007792000,9.528308690664426,128,100000,0.06306288520996334,0.22256888754575796,0.9999,0,8.98058913397448e-05,small,50,PRUNED
221,221,-0.36502310633659363,2021-07-01 17:23:28.923343,2021-07-01 17:23:56.293374,0 days 00:00:27.370031000,9.585120367291346,128,100000,0.11501205133890259,0.18196112314350493,0.9999,0,0.0002488806210387279,small,50,PRUNED
222,222,-0.7009310722351074,2021-07-01 17:23:38.598918,2021-07-01 17:24:09.157264,0 days 00:00:30.558346000,7.963569553906912,128,50000,0.18998227083748756,0.18783133807263724,0.9999,1000,0.0009370616635299702,small,1,PRUNED
223,223,818.7259521484375,2021-07-01 17:23:56.295066,2021-07-01 17:25:21.770061,0 days 00:01:25.474995000,11.230578853639587,256,100000,0.07016513687109228,0.26736014637632255,0.9999,1000,0.0008688190046941004,medium,1,PRUNED
224,224,1.9402835369110107,2021-07-01 17:24:09.158175,2021-07-01 17:24:39.490461,0 days 00:00:30.332286000,11.599895327248069,256,100000,0.06687254393429112,0.25285378441251927,0.9999,1000,0.0003476088005147538,medium,1,PRUNED
225,225,-0.7585668563842773,2021-07-01 17:24:16.205968,2021-07-01 17:24:50.405774,0 days 00:00:34.199806000,11.569383741579173,256,100000,0.06769589944357093,0.20613133812267714,0.9999,1000,0.0003293045971218568,medium,1,PRUNED
226,226,0.0,2021-07-01 17:24:39.491269,2021-07-01 17:25:13.524475,0 days 00:00:34.033206000,11.424874808787756,256,100000,0.07042324102397124,0.2796428903557308,0.9999,1000,0.00045540251497514135,medium,1,PRUNED
227,227,0.0,2021-07-01 17:24:50.406485,2021-07-01 17:26:13.646776,0 days 00:01:23.240291000,11.993591346411216,256,100000,0.07394870065632121,0.26074696557114546,0.9,1000,0.0004748509421352513,medium,1,PRUNED
228,228,-72.324951171875,2021-07-01 17:25:13.525286,2021-07-01 17:26:33.949094,0 days 00:01:20.423808000,11.821413457520569,256,500000,0.19990316222183752,0.26289212746991086,0.9,1000,0.0028166837440730527,medium,1,PRUNED
229,229,-0.2518751621246338,2021-07-01 17:25:21.770745,2021-07-01 17:25:55.077599,0 days 00:00:33.306854000,11.20121418070028,256,500000,0.07411065865807,0.30135609901993166,0.9,1000,0.0010579750860143385,medium,1,PRUNED
230,230,1200.1251220703125,2021-07-01 17:25:55.078570,2021-07-01 17:29:06.741272,0 days 00:03:11.662702000,11.230785950006458,1024,10000,0.12733670523935253,0.26052683391279585,0.9999,1000,0.0006329909835467614,medium,1,COMPLETE
231,231,-202.99110412597656,2021-07-01 17:26:13.647755,2021-07-01 17:26:57.700299,0 days 00:00:44.052544000,11.110677891006452,1024,10000,0.12608687856481157,0.2688190614773042,0.9999,1000,0.0006627863817757625,medium,1,PRUNED
232,232,0.0,2021-07-01 17:26:33.949960,2021-07-01 17:27:11.361728,0 days 00:00:37.411768000,11.1344421572556,1024,10000,0.19497363752264352,0.27763521048262857,0.9999,1000,0.0008415918131933097,medium,1,PRUNED
233,233,-4.629230976104736,2021-07-01 17:26:57.701098,2021-07-01 17:27:22.465825,0 days 00:00:24.764727000,11.260773646046012,256,100000,0.009766829542063838,0.23932576961378527,0.9999,1000,0.0007897147307119234,medium,1,PRUNED
234,234,787.78955078125,2021-07-01 17:27:11.362716,2021-07-01 17:28:30.664889,0 days 00:01:19.302173000,11.442759534073952,256,100000,0.060835029929837234,0.2443584574833579,0.9999,1000,0.0065543012145263735,medium,1,PRUNED
235,235,-0.30106857419013977,2021-07-01 17:27:22.466999,2021-07-01 17:27:53.829203,0 days 00:00:31.362204000,11.38458464649725,256,100000,0.06776198728786631,0.24587239277748452,0.9999,1000,0.0002733537749820294,medium,1,PRUNED
236,236,-181.47657775878906,2021-07-01 17:27:53.830228,2021-07-01 17:28:22.256152,0 days 00:00:28.425924000,11.462004450538053,256,100000,0.056415484986102216,0.29099451528668624,0.9999,1000,0.0012681028469365902,medium,1,PRUNED
237,237,0.0,2021-07-01 17:28:22.257197,2021-07-01 17:28:41.953501,0 days 00:00:19.696304000,10.97074739139341,256,100000,0.06077504442611834,0.23505916274660382,0.99,1000,0.0005904116819575502,medium,100,PRUNED
238,238,-5.483818054199219,2021-07-01 17:28:30.665902,2021-07-01 17:28:57.741650,0 days 00:00:27.075748000,10.879185673680984,256,100000,0.05988916833003391,0.23592955816897349,0.99,1000,0.00411764649697455,medium,100,PRUNED
239,239,2.860197067260742,2021-07-01 17:28:41.954714,2021-07-01 17:29:19.211457,0 days 00:00:37.256743000,9.032778083857734,256,50000,0.04557667009837654,0.2143262059632342,0.95,1000,0.012864821161297592,medium,1,PRUNED
240,240,753.6116333007812,2021-07-01 17:28:57.742643,2021-07-01 17:30:24.638956,0 days 00:01:26.896313000,9.077433023490821,512,50000,0.11945861547292376,0.2063833406819886,0.95,1000,0.011776916566125622,medium,1,PRUNED
241,241,0.0,2021-07-01 17:29:06.742575,2021-07-01 17:29:14.178738,0 days 00:00:07.436163000,9.043098205976442,1024,10000,0.1294825241541246,0.12362235464704449,0.95,5000,0.0006694536386163311,medium,1,PRUNED
242,242,0.46474525332450867,2021-07-01 17:29:14.180285,2021-07-01 17:30:01.859298,0 days 00:00:47.679013000,11.26497174218413,1024,10000,0.1410972654223533,0.21550112734445342,0.9999,1000,0.0005599300079723907,medium,1,PRUNED
243,243,-3.3362998962402344,2021-07-01 17:29:19.212218,2021-07-01 17:30:07.190270,0 days 00:00:47.978052000,11.275342551758637,1024,10000,0.12280361421358901,0.24770042671634393,0.9999,1000,0.0065667184802640655,medium,1,PRUNED
244,244,-6.197273254394531,2021-07-01 17:30:01.860769,2021-07-01 17:30:49.012764,0 days 00:00:47.151995000,11.30845828873654,1024,10000,0.08005305121045475,0.24994276702555906,0.9999,1000,0.010186644979962545,medium,1,PRUNED
245,245,-0.7679175138473511,2021-07-01 17:30:07.191237,2021-07-01 17:30:55.092246,0 days 00:00:47.901009000,8.827559685089138,1024,10000,0.1352255735497256,0.2672220803736265,0.9999,1000,0.007990152614959582,medium,1,PRUNED
246,246,-1.0269395112991333,2021-07-01 17:30:24.639909,2021-07-01 17:31:11.805643,0 days 00:00:47.165734000,11.381353258108023,1024,10000,0.13859866485519917,0.2691061110380085,0.9999,1000,0.00844456608539935,medium,1,PRUNED
247,247,0.0,2021-07-01 17:30:49.015964,2021-07-01 17:31:15.937900,0 days 00:00:26.921936000,5.851948238597489,64,500000,0.13791349810840914,0.2651396962740062,0.9999,1000,0.00011926135775481732,medium,1,PRUNED
248,248,0.0,2021-07-01 17:30:55.093230,2021-07-01 17:31:46.375549,0 days 00:00:51.282319000,11.533873474615657,64,500000,0.06258315691840574,0.28094359914998607,0.9999,0,6.000872067768564e-05,medium,1000,PRUNED
249,249,0.33354493975639343,2021-07-01 17:31:11.806362,2021-07-01 17:31:38.012787,0 days 00:00:26.206425000,11.506252827694501,64,500000,0.13170515807153146,0.36764701503321134,0.995,0,6.266277905523679e-05,medium,1000,PRUNED
250,250,-304.3470153808594,2021-07-01 17:31:15.939420,2021-07-01 17:31:48.446264,0 days 00:00:32.506844000,7.273717307142742,256,500000,0.052676727679148556,0.3661291444041542,0.995,0,0.0007915968555907687,medium,5000,PRUNED
251,251,-262.1839599609375,2021-07-01 17:31:38.013782,2021-07-01 17:32:03.124931,0 days 00:00:25.111149000,10.521617598437055,256,500000,0.06586536503297201,0.1945573193669742,0.9999,1000,0.0007208491185414758,medium,5000,PRUNED
252,252,-107.47027587890625,2021-07-01 17:31:46.376226,2021-07-01 17:32:15.541357,0 days 00:00:29.165131000,11.734995341911018,256,10000,0.10109964516789487,0.19723916904870784,0.9999,1000,0.0007697466161668677,medium,5000,PRUNED
253,253,0.0,2021-07-01 17:31:48.446964,2021-07-01 17:32:28.304652,0 days 00:00:39.857688000,11.004692380171063,128,10000,0.10865685139796068,0.22673276433498996,0.9999,1000,0.0009318183620246048,medium,1,PRUNED
254,254,0.0,2021-07-01 17:32:03.125941,2021-07-01 17:32:55.378253,0 days 00:00:52.252312000,10.992187607635191,128,10000,0.1091564125904218,0.19951277830532096,0.9999,1000,0.00011089808567684165,medium,1,PRUNED
255,255,0.0,2021-07-01 17:32:15.542093,2021-07-01 17:32:25.504266,0 days 00:00:09.962173000,10.998314584725001,128,50000,0.08385921099424119,0.3127854795874002,0.9999,5000,1.0411081475287912e-05,medium,1,PRUNED
256,256,-0.49601635336875916,2021-07-01 17:32:25.505319,2021-07-01 17:33:23.059399,0 days 00:00:57.554080000,8.665517553061434,512,10000,0.11097495109002976,0.22176329128091776,0.9,1000,0.006736126040422294,medium,1,PRUNED
257,257,0.0,2021-07-01 17:32:28.306421,2021-07-01 17:32:38.993496,0 days 00:00:10.687075000,8.717738311217396,512,10000,0.1873025370930343,0.23156698238164974,0.9,10000,0.006442693772947206,medium,1,PRUNED
258,258,0.0,2021-07-01 17:32:38.995436,2021-07-01 17:32:49.785232,0 days 00:00:10.789796000,8.491810271620215,256,100000,0.11765011403205533,0.4705086815018615,0.9999,20000,1.5138396700381405e-05,medium,1,PRUNED
259,259,0.0,2021-07-01 17:32:49.786325,2021-07-01 17:33:15.506370,0 days 00:00:25.720045000,11.90449560879392,256,500000,0.0707543922624522,0.2576016063378121,0.999,1000,0.00010805974240609696,medium,100,PRUNED
260,260,-0.4243525564670563,2021-07-01 17:32:55.379023,2021-07-01 17:33:19.487180,0 days 00:00:24.108157000,9.319891439557528,256,500000,0.07162062909163976,0.17307766158516458,0.999,1000,0.00021170927127543514,medium,100,PRUNED
261,261,-403.7855529785156,2021-07-01 17:33:15.507638,2021-07-01 17:33:17.140522,0 days 00:00:01.632884000,9.235424484735752,64,50000,0.07747887287510008,0.2406713748843377,0.9,5000,0.004600239575129725,small,10,PRUNED
262,262,-1.078192949295044,2021-07-01 17:33:17.141229,2021-07-01 17:34:02.540887,0 days 00:00:45.399658000,7.538403433431027,256,500000,0.06563421764220238,0.2963189593637485,0.9999,1000,0.0017780488256443734,medium,1,PRUNED
263,263,-0.25241219997406006,2021-07-01 17:33:19.487893,2021-07-01 17:33:52.664535,0 days 00:00:33.176642000,10.388401827102104,256,10000,0.1454573194877826,0.29724001110987497,0.9999,1000,0.0017954338986423625,medium,1,PRUNED
264,264,0.0,2021-07-01 17:33:23.060086,2021-07-01 17:33:57.605092,0 days 00:00:34.545006000,7.622130833409463,256,100000,0.17678394274171758,0.06610233024839962,0.9999,1000,0.00012913522574604298,medium,1,PRUNED
265,265,425.1309814453125,2021-07-01 17:33:52.665652,2021-07-01 17:34:57.725478,0 days 00:01:05.059826000,7.548701690488291,64,100000,0.038946853651211255,0.059645884158152696,0.9999,1000,9.584055371694823e-05,medium,1,PRUNED
266,266,522.061279296875,2021-07-01 17:33:57.605857,2021-07-01 17:36:03.922805,0 days 00:02:06.316948000,11.669739117593721,1024,500000,0.12634137254972974,0.18564189984826412,0.9999,0,0.0005152290826700321,medium,1,PRUNED
267,267,0.0,2021-07-01 17:34:02.543133,2021-07-01 17:34:32.292468,0 days 00:00:29.749335000,9.788269959146978,64,50000,0.05634980371864641,0.38530456028910925,0.9999,0,8.641142833368021e-05,medium,1000,PRUNED
268,268,0.0,2021-07-01 17:34:32.294801,2021-07-01 17:34:38.376761,0 days 00:00:06.081960000,11.685808187248567,128,500000,0.03875385991153161,0.18197879214166307,0.9999,5000,0.00041282451171150434,medium,1,PRUNED
269,269,0.0,2021-07-01 17:34:38.378930,2021-07-01 17:35:29.410462,0 days 00:00:51.031532000,7.859747487861412,1024,10000,0.12452478017348105,0.0033213804058063456,0.9999,1000,0.0005658145152943956,medium,1,PRUNED
270,270,0.0,2021-07-01 17:34:57.726643,2021-07-01 17:35:34.550530,0 days 00:00:36.823887000,8.14872290233637,256,10000,0.09334495739351799,0.2843001346575085,0.95,1000,0.0005518986759688769,small,100,PRUNED
271,271,-0.09092626720666885,2021-07-01 17:35:29.411454,2021-07-01 17:35:43.409757,0 days 00:00:13.998303000,8.883032557704729,256,50000,0.09331613818138881,0.21433594209647933,0.95,1000,0.0002928409654432546,small,50,PRUNED
272,272,-77.2725830078125,2021-07-01 17:35:34.551276,2021-07-01 17:36:53.984853,0 days 00:01:19.433577000,8.919372857970075,512,50000,0.07603384283685886,0.2090250478849848,0.9,0,0.01685883459131449,medium,50,PRUNED
273,273,0.0,2021-07-01 17:35:43.410657,2021-07-01 17:37:10.660219,0 days 00:01:27.249562000,11.825552084601917,512,500000,0.06488318008874308,0.20945249214205586,0.99,0,0.00016972011425274422,medium,1,PRUNED
274,274,0.0,2021-07-01 17:36:03.924365,2021-07-01 17:36:30.790913,0 days 00:00:26.866548000,11.858078808694025,512,100000,0.1955987361358184,0.20927899433917393,0.99,1000,3.7679800882262834e-05,medium,10,PRUNED
275,275,-1.4060138463974,2021-07-01 17:36:30.792104,2021-07-01 17:37:02.371699,0 days 00:00:31.579595000,11.190611395270919,128,10000,0.0631527463299374,0.22760113537681853,0.9,1000,0.00017089908289223593,medium,1,PRUNED
276,276,0.0,2021-07-01 17:36:53.986162,2021-07-01 17:37:01.354482,0 days 00:00:07.368320000,9.199256698188336,128,10000,0.15885182036263507,0.2548323026105908,0.995,5000,0.00016794492228931263,medium,1,PRUNED
277,277,0.0,2021-07-01 17:37:01.356515,2021-07-01 17:37:36.750706,0 days 00:00:35.394191000,11.163462615176773,64,500000,0.08870396078114272,0.22763849665076855,0.9999,1000,0.0010816080803942487,medium,1,PRUNED
278,278,0.0,2021-07-01 17:37:02.373809,2021-07-01 17:38:17.537979,0 days 00:01:15.164170000,7.345051495970023,64,500000,0.0853337799202202,0.3562055195906565,0.9999,1000,0.001052538245895974,medium,1000,PRUNED
279,279,1.8963338136672974,2021-07-01 17:37:10.660987,2021-07-01 17:37:31.043119,0 days 00:00:20.382132000,9.44862043738788,64,500000,0.08017088625219129,0.35517930275191,0.9999,1000,7.61718422551616e-05,medium,1000,PRUNED
280,280,-4.380462169647217,2021-07-01 17:37:31.044272,2021-07-01 17:37:55.320541,0 days 00:00:24.276269000,11.420877845981162,256,100000,0.08771757130055591,0.2458107439030622,0.999,1000,0.0010884628379281339,medium,100,PRUNED
281,281,-0.6937661170959473,2021-07-01 17:37:36.752037,2021-07-01 17:38:05.983581,0 days 00:00:29.231544000,11.352524312681032,256,100000,0.07105596685009317,0.24045823018973086,0.98,1000,0.00013184132364396,medium,100,PRUNED
282,282,0.0,2021-07-01 17:37:55.321693,2021-07-01 17:38:01.179420,0 days 00:00:05.857727000,10.192750269556837,256,10000,0.07181956130323654,0.30629288676065874,0.9999,5000,0.00024641579535491023,medium,1,PRUNED
283,283,0.0,2021-07-01 17:38:01.180805,2021-07-01 17:38:34.223255,0 days 00:00:33.042450000,5.194047343253455,256,50000,0.19952884541909346,0.32186462945702243,0.9999,1000,6.723048179501208e-05,medium,1,PRUNED
284,284,816.4666748046875,2021-07-01 17:38:05.985918,2021-07-01 17:40:05.364754,0 days 00:01:59.378836000,11.992812024081582,1024,50000,0.060276769607372264,0.4365040459406487,0.9999,1000,0.002415133068072132,medium,1,PRUNED
285,285,599.6382446289062,2021-07-01 17:38:17.541880,2021-07-01 17:40:00.908600,0 days 00:01:43.366720000,9.173502448738919,1024,50000,0.19999823534511854,0.32507875052147006,0.9,1000,5.345262397391597e-05,medium,1,PRUNED
286,286,4.202886581420898,2021-07-01 17:38:34.224355,2021-07-01 17:39:19.941599,0 days 00:00:45.717244000,8.50980723055514,1024,10000,0.13334660320584174,0.41118627748595876,0.9,1000,0.002495946352937744,medium,1,PRUNED
287,287,0.0,2021-07-01 17:39:19.944003,2021-07-01 17:39:45.044676,0 days 00:00:25.100673000,9.074951309667345,256,10000,0.19171195865679133,0.27695449270827605,0.9999,1000,5.131331978888184e-05,medium,1,PRUNED
288,288,-403.634521484375,2021-07-01 17:39:45.045743,2021-07-01 17:39:50.729670,0 days 00:00:05.683927000,9.900281119829716,128,500000,0.05978321599025595,0.25777238958948573,0.9999,10000,8.981853332491369e-05,small,1,PRUNED
289,289,-0.5081638097763062,2021-07-01 17:39:50.730779,2021-07-01 17:40:33.177981,0 days 00:00:42.447202000,8.0193781981266,256,50000,0.16777759797621886,0.15468510714451403,0.999,0,0.009008438094301822,medium,1,PRUNED
290,290,0.0,2021-07-01 17:40:00.909630,2021-07-01 17:40:02.940509,0 days 00:00:02.030879000,9.642366307989128,256,10000,0.030434627820183507,0.19806911699662366,0.9999,20000,0.0006819818849363076,medium,10,PRUNED
291,291,-1.0167427062988281,2021-07-01 17:40:02.941044,2021-07-01 17:40:29.322396,0 days 00:00:26.381352000,8.02372575629622,64,500000,0.18251301595610533,0.21914345385250336,0.995,0,0.0002072603158368271,medium,1,PRUNED
292,292,710.7221069335938,2021-07-01 17:40:05.365744,2021-07-01 17:42:08.316454,0 days 00:02:02.950710000,11.95841415038627,1024,50000,0.09933671538976116,0.4521177194341635,0.999,0,0.00039833901087432303,medium,1,PRUNED
293,293,0.0,2021-07-01 17:40:29.323297,2021-07-01 17:40:30.995882,0 days 00:00:01.672585000,11.99559446551662,1024,50000,0.10357109791675545,0.46068802051152585,0.999,5000,0.0032853841054165337,medium,100,PRUNED
294,294,0.0,2021-07-01 17:40:30.996516,2021-07-01 17:41:16.130180,0 days 00:00:45.133664000,11.923862134639883,1024,50000,0.06764246489571511,0.4375613563206438,0.95,1000,0.0015214565192775637,medium,1,PRUNED
295,295,-116.355224609375,2021-07-01 17:40:33.178741,2021-07-01 17:41:13.574569,0 days 00:00:40.395828000,11.9524523133252,1024,50000,0.06837257056354021,0.43867481303526396,0.95,1000,0.003386664792433276,medium,5000,PRUNED
296,296,-0.9831427335739136,2021-07-01 17:41:13.575776,2021-07-01 17:42:13.720186,0 days 00:01:00.144410000,7.741712191318214,1024,50000,0.09900108068832213,0.4827844168562566,0.9999,1000,0.0014754990532447989,medium,1,PRUNED
297,297,0.0,2021-07-01 17:41:16.130734,2021-07-01 17:41:36.777869,0 days 00:00:20.647135000,8.866124296405484,1024,50000,0.05441762936004774,0.48254277756309977,0.9999,1000,0.002251781998054406,small,1000,PRUNED
