,number,value,datetime_start,datetime_complete,duration,params_batch_size,params_buffer_size,params_exploration_final_eps,params_exploration_fraction,params_gamma,params_learning_starts,params_lr,params_net_arch,params_target_update_interval,state
423,423,0.18151874840259552,2021-07-05 18:58:26.152061,2021-07-05 19:00:23.335032,0 days 00:01:57.182971000,256,500000,0.01695580564764109,0.18979401429836854,0.98,5000,2.5313655206871848e-05,small,1000,PRUNED
424,424,-314.3417663574219,2021-07-05 18:58:40.398146,2021-07-05 19:01:05.864808,0 days 00:02:25.466662000,512,500000,0.03228423418349133,0.19050666619555284,0.98,5000,0.0001360006404356623,small,1000,PRUNED
425,425,-352.72418212890625,2021-07-05 19:00:23.336900,2021-07-05 19:10:30.469760,0 days 00:10:07.132860000,512,100000,0.1457260600167862,0.24925428393938004,0.9999,5000,0.011246333613970514,small,1,COMPLETE
426,426,-0.7231894135475159,2021-07-05 19:01:05.865584,2021-07-05 19:03:57.756045,0 days 00:02:51.890461000,256,100000,0.038367692355950604,0.40884861991529753,0.9999,10000,0.01087571822613463,small,1,PRUNED
427,427,-191.35108947753906,2021-07-05 19:01:29.185120,2021-07-05 19:04:23.845673,0 days 00:02:54.660553000,256,100000,0.004107146572177883,0.30029241210798996,0.9999,10000,0.011762664374182849,small,1,PRUNED
428,428,-255.6731414794922,2021-07-05 19:03:57.757225,2021-07-05 19:05:49.201899,0 days 00:01:51.444674000,256,100000,0.00522262568941733,0.2565469256711817,0.995,10000,0.00027131856500496967,small,200,PRUNED
429,429,366.8593444824219,2021-07-05 19:04:23.846713,2021-07-05 19:07:24.810112,0 days 00:03:00.963399000,256,50000,0.009763250825519397,0.2531953632521522,0.995,5000,0.00025340810628744466,medium,200,PRUNED
430,430,389.08209228515625,2021-07-05 19:05:49.203335,2021-07-05 19:09:30.347953,0 days 00:03:41.144618000,512,50000,0.026935815333786275,0.07514114543451117,0.99,5000,0.00036381561878199805,medium,200,PRUNED
431,431,-309.5811462402344,2021-07-05 19:07:24.811129,2021-07-05 19:11:40.253483,0 days 00:04:15.442354000,512,50000,0.05295497793375603,0.2020513208072419,0.99,0,0.0003451294624502538,medium,200,PRUNED
432,432,403.6963195800781,2021-07-05 19:09:30.350319,2021-07-05 19:12:57.998049,0 days 00:03:27.647730000,1024,10000,0.15396087460854918,0.2739641342500365,0.99,0,8.373288735786792e-05,small,1,PRUNED
433,433,0.20723024010658264,2021-07-05 19:10:30.471689,2021-07-05 19:14:01.139933,0 days 00:03:30.668244000,1024,10000,0.15168914551144258,0.3239401448098531,0.99,0,0.016575834394141734,small,200,PRUNED
434,434,152.23501586914062,2021-07-05 19:11:40.254599,2021-07-05 19:13:05.089165,0 days 00:01:24.834566000,1024,10000,0.040976359055940006,0.2742229567687624,0.995,20000,6.323226795016348e-05,small,200,PRUNED
435,435,265.9248046875,2021-07-05 19:12:57.999055,2021-07-05 19:13:46.059333,0 days 00:00:48.060278000,256,50000,0.041010685718349135,0.3243396784713596,0.995,20000,0.00020078654165563254,small,200,PRUNED
436,436,-278.4325256347656,2021-07-05 19:13:05.089883,2021-07-05 19:23:28.802559,0 days 00:10:23.712676000,256,50000,0.05816046635666027,0.32166989394881645,0.999,10000,0.0016234387009150385,medium,200,COMPLETE
437,437,-311.39117431640625,2021-07-05 19:13:46.060531,2021-07-05 19:15:40.946055,0 days 00:01:54.885524000,256,50000,0.033691675905235544,0.2857404246663128,0.999,10000,4.166256944914083e-05,medium,200,PRUNED
438,438,-287.9524230957031,2021-07-05 19:14:01.140893,2021-07-05 19:16:02.321420,0 days 00:02:01.180527000,256,50000,0.01312769496848767,0.2879880927038939,0.999,10000,0.0002875874158059815,medium,1000,PRUNED
439,439,417.74383544921875,2021-07-05 19:15:40.947857,2021-07-05 19:17:49.597545,0 days 00:02:08.649688000,256,50000,0.06193662847584935,0.3469552724023224,0.95,10000,0.0002864052018373318,medium,1000,PRUNED
440,440,-346.3710632324219,2021-07-05 19:16:02.322040,2021-07-05 19:27:18.556683,0 days 00:11:16.234643000,256,500000,0.0576907793942259,0.4436534229650718,0.95,5000,0.0014614237984311234,medium,1,COMPLETE
441,441,0.0,2021-07-05 19:17:49.599746,2021-07-05 19:20:09.164121,0 days 00:02:19.564375000,256,500000,0.036782597896620646,0.4238401406806467,0.9999,5000,0.0015080347436284764,small,1,PRUNED
442,442,-353.37774658203125,2021-07-05 19:20:09.165096,2021-07-05 19:21:57.351307,0 days 00:01:48.186211000,256,100000,0.025509379916675543,0.23267601186387446,0.995,5000,0.0006887876274962572,small,1500,PRUNED
443,443,380.12066650390625,2021-07-05 19:21:57.352353,2021-07-05 19:23:59.346936,0 days 00:02:01.994583000,256,10000,0.01000736624871369,0.4665043651091342,0.99,10000,0.00040553469715252406,medium,200,PRUNED
444,444,-1.018419861793518,2021-07-05 19:23:28.804083,2021-07-05 19:25:38.204201,0 days 00:02:09.400118000,256,10000,0.05672446320759791,0.441046507603842,0.999,10000,0.0017701686373768047,medium,200,PRUNED
445,445,396.3116760253906,2021-07-05 19:23:59.347629,2021-07-05 19:26:31.392333,0 days 00:02:32.044704000,256,50000,0.05137283525459683,0.44249686190504,0.999,5000,0.0012410176811096516,medium,200,PRUNED
446,446,418.5641174316406,2021-07-05 19:25:38.205085,2021-07-05 19:28:18.422485,0 days 00:02:40.217400000,256,50000,0.04954576941116039,0.3392559756554131,0.999,5000,0.0010198680766625749,medium,200,PRUNED
447,447,352.0745849609375,2021-07-05 19:26:31.393151,2021-07-05 19:29:06.698570,0 days 00:02:35.305419000,256,100000,0.057288001256311394,0.33762282225996026,0.999,5000,0.0004519473670529838,medium,200,PRUNED
448,448,0.0,2021-07-05 19:27:18.558304,2021-07-05 19:28:34.122825,0 days 00:01:15.564521000,256,100000,0.04912185571903039,0.34368589583819054,0.999,20000,0.002272066299889324,medium,200,PRUNED
449,449,0.0,2021-07-05 19:28:18.424410,2021-07-05 19:29:24.571709,0 days 00:01:06.147299000,256,100000,0.09631212745963269,0.17808204303353808,0.999,20000,0.001793445588385474,medium,200,PRUNED
450,450,343.6346130371094,2021-07-05 19:28:34.123551,2021-07-05 19:31:19.720750,0 days 00:02:45.597199000,256,50000,0.05376572936853894,0.40593165193165764,0.999,0,0.0018421802341259536,medium,200,PRUNED
451,451,-355.7305603027344,2021-07-05 19:29:06.700755,2021-07-05 19:31:52.953545,0 days 00:02:46.252790000,256,50000,0.053677021860627984,0.3787285614415071,0.999,0,0.0021166783631337283,medium,200,PRUNED
452,452,419.9984436035156,2021-07-05 19:29:24.572369,2021-07-05 19:32:17.428600,0 days 00:02:52.856231000,256,50000,0.053599942812193734,0.3835080553087714,0.999,0,0.0016992341900183465,medium,200,PRUNED
453,453,-330.7981262207031,2021-07-05 19:31:19.721642,2021-07-05 19:33:27.738003,0 days 00:02:08.016361000,256,10000,0.04643839007711322,0.2445996542423324,0.99,10000,0.0013500989819442853,medium,5000,PRUNED
454,454,0.0,2021-07-05 19:31:52.954625,2021-07-05 19:33:50.660332,0 days 00:01:57.705707000,256,10000,0.04634265478857681,0.24384702797300015,0.99,10000,1.003870754602638e-05,medium,5000,PRUNED
455,455,0.0,2021-07-05 19:32:17.429916,2021-07-05 19:34:19.441547,0 days 00:02:02.011631000,256,10000,0.06377303374964355,0.09103901577622311,0.99,10000,1.3424802985234344e-05,medium,5000,PRUNED
456,456,-2.7356855869293213,2021-07-05 19:33:27.739183,2021-07-05 19:35:27.820468,0 days 00:02:00.081285000,256,10000,0.043068820017174526,0.1565620674002335,0.9999,10000,0.0003392501669342048,medium,10000,PRUNED
457,457,-1.9502708911895752,2021-07-05 19:33:50.661083,2021-07-05 19:35:55.127921,0 days 00:02:04.466838000,256,50000,0.03742728353564144,0.25907607003055805,0.9999,10000,0.005939041978671128,medium,10000,PRUNED
458,458,119.17521667480469,2021-07-05 19:34:19.442492,2021-07-05 19:37:14.029964,0 days 00:02:54.587472000,512,50000,0.030910093187218254,0.22206238139329612,0.9999,5000,0.0003474773188464112,medium,10000,PRUNED
459,459,-402.1558532714844,2021-07-05 19:35:27.821835,2021-07-05 19:47:49.015221,0 days 00:12:21.193386000,512,50000,0.036758285609931586,0.35562024005880694,0.98,5000,0.005774299228683608,medium,200,COMPLETE
460,460,-326.6126403808594,2021-07-05 19:35:55.128863,2021-07-05 19:38:56.389095,0 days 00:03:01.260232000,512,50000,0.030602906998051807,0.21090530536042065,0.98,5000,0.0002555139291870336,medium,200,PRUNED
461,461,366.4568176269531,2021-07-05 19:37:14.031074,2021-07-05 19:38:41.754020,0 days 00:01:27.722946000,256,500000,0.1201978001837177,0.3221827247223367,0.98,5000,0.00026162291031269364,small,200,PRUNED
462,462,-237.83351135253906,2021-07-05 19:38:41.754910,2021-07-05 19:40:49.531937,0 days 00:02:07.777027000,128,50000,0.16105867456976586,0.3603659997453971,0.99,5000,0.00021215847826777922,medium,200,PRUNED
463,463,0.0,2021-07-05 19:38:56.389990,2021-07-05 19:39:39.472843,0 days 00:00:43.082853000,128,100000,0.10360536533972198,0.4562460214314652,0.99,20000,0.0005637997354898872,small,1500,PRUNED
464,464,-307.2207946777344,2021-07-05 19:39:39.473817,2021-07-05 19:41:39.776021,0 days 00:02:00.302204000,256,50000,0.13762468383023913,0.3589426431185159,0.99,10000,0.0003916603516742556,medium,200,PRUNED
465,465,-0.006691077724099159,2021-07-05 19:40:49.532966,2021-07-05 19:42:07.894123,0 days 00:01:18.361157000,256,50000,0.0002266627188138859,0.4172896062316117,0.99,10000,0.00030069589288460265,small,200,PRUNED
466,466,-300.2171936035156,2021-07-05 19:41:39.776962,2021-07-05 19:43:45.298175,0 days 00:02:05.521213000,256,100000,0.035394132582149185,0.13590632490938392,0.999,0,0.00029747771396719535,small,200,PRUNED
467,467,127.02474975585938,2021-07-05 19:42:07.894780,2021-07-05 19:44:11.001791,0 days 00:02:03.107011000,256,100000,0.07065657944802183,0.31325868752246544,0.999,0,2.3109045553105418e-05,small,200,PRUNED
468,468,-308.41351318359375,2021-07-05 19:43:45.299171,2021-07-05 19:45:23.847339,0 days 00:01:38.548168000,256,10000,0.04067070843722473,0.29898718622948534,0.9999,5000,0.0026097613901042848,small,1000,PRUNED
469,469,-1.5255426168441772,2021-07-05 19:44:11.002998,2021-07-05 19:46:45.071672,0 days 00:02:34.068674000,256,10000,0.08698720171663298,0.26924104682805516,0.9999,5000,0.007824603974602627,medium,1000,PRUNED
470,470,-0.25900328159332275,2021-07-05 19:45:23.848186,2021-07-05 19:46:21.057134,0 days 00:00:57.208948000,256,50000,0.02761820012635356,0.2707638352853872,0.95,20000,4.2181430410685454e-05,medium,1500,PRUNED
471,471,-362.2283935546875,2021-07-05 19:46:21.057914,2021-07-05 19:49:04.838388,0 days 00:02:43.780474000,512,500000,0.043331408264382566,0.2022459618561808,0.99,10000,0.014373490568255045,medium,200,PRUNED
472,472,-0.7488189339637756,2021-07-05 19:46:45.072437,2021-07-05 19:48:09.989653,0 days 00:01:24.917216000,512,500000,0.043100827418510505,0.42823665730216165,0.99,10000,0.021589544500171972,small,200,PRUNED
473,473,-32.312355041503906,2021-07-05 19:47:49.016589,2021-07-05 19:49:28.282519,0 days 00:01:39.265930000,256,500000,0.043195927592735946,0.4775927959130655,0.99,10000,0.019666940656043158,small,200,PRUNED
474,474,411.8958740234375,2021-07-05 19:48:09.990470,2021-07-05 19:49:45.998301,0 days 00:01:36.007831000,256,50000,0.03222061587510442,0.47733364472012396,0.99,10000,0.00017766543313264293,small,200,PRUNED
475,475,405.6888732910156,2021-07-05 19:49:04.839216,2021-07-05 19:50:46.888994,0 days 00:01:42.049778000,256,50000,0.03146502801434603,0.3968533305967452,0.99,10000,0.00018849262248768912,small,200,PRUNED
476,476,406.65655517578125,2021-07-05 19:49:28.283384,2021-07-05 19:51:21.343041,0 days 00:01:53.059657000,256,50000,0.1915818059700564,0.3983559211213037,0.995,5000,0.00017964703829421655,small,1500,PRUNED
477,477,337.087158203125,2021-07-05 19:49:45.999123,2021-07-05 19:52:41.962793,0 days 00:02:55.963670000,256,100000,0.005404030973589659,0.33114708519851127,0.995,5000,0.0010291565211609831,medium,1500,PRUNED
478,478,307.5396423339844,2021-07-05 19:50:46.890093,2021-07-05 19:53:12.554358,0 days 00:02:25.664265000,256,100000,0.004687799509532169,0.41016908417743514,0.995,5000,5.655885890862266e-05,medium,1500,PRUNED
479,479,-9.234140396118164,2021-07-05 19:51:21.344213,2021-07-05 19:52:26.678467,0 days 00:01:05.334254000,256,100000,0.19984715777798098,0.25784433330756124,0.999,20000,3.0476656245729224e-05,medium,5000,PRUNED
480,480,-296.5605773925781,2021-07-05 19:52:26.679797,2021-07-05 19:55:29.046584,0 days 00:03:02.366787000,256,10000,0.024136446712614706,0.3284843685979663,0.9999,0,0.00046231786426081803,medium,200,PRUNED
481,481,-303.0851135253906,2021-07-05 19:52:41.963587,2021-07-05 19:55:44.906613,0 days 00:03:02.943026000,256,10000,0.13282485655528461,0.1621754309075208,0.9999,0,0.0002271695323151659,medium,200,PRUNED
482,482,-275.81646728515625,2021-07-05 19:53:12.556259,2021-07-05 19:55:13.937802,0 days 00:02:01.381543000,256,10000,0.00010743228219594822,0.16202492151873932,0.9999,0,0.0002413375499347426,small,200,PRUNED
483,483,303.899658203125,2021-07-05 19:55:13.938716,2021-07-05 19:58:42.873438,0 days 00:03:28.934722000,256,10000,0.02293769062386998,0.460256516329356,0.95,0,0.0004762965780926261,medium,200,PRUNED
484,484,396.8786315917969,2021-07-05 19:55:29.047229,2021-07-05 19:56:25.899572,0 days 00:00:56.852343000,256,50000,0.12892629268913822,0.2972890102438554,0.95,20000,0.0003572731000482787,small,1000,PRUNED
485,485,47.07648849487305,2021-07-05 19:55:44.907708,2021-07-05 19:56:40.735795,0 days 00:00:55.828087000,256,50000,0.04704498729529824,0.29470301871259624,0.95,20000,0.0003861966762841831,small,1000,PRUNED
486,486,380.4547119140625,2021-07-05 19:56:25.900533,2021-07-05 19:58:11.041408,0 days 00:01:45.140875000,256,50000,0.020107139028878725,0.2180466831702144,0.98,10000,0.0012572394722717652,small,200,PRUNED
487,487,0.0,2021-07-05 19:56:40.736542,2021-07-05 19:58:07.028496,0 days 00:01:26.291954000,128,50000,0.0614058173529685,0.2807096425741146,0.9,10000,0.00026462128368426145,small,200,PRUNED
488,488,0.0,2021-07-05 19:58:07.029426,2021-07-05 20:00:22.387158,0 days 00:02:15.357732000,256,50000,0.01925523246359084,0.46117315112002877,0.98,5000,0.0006073843393114254,medium,5000,PRUNED
489,489,0.0,2021-07-05 19:58:11.042159,2021-07-05 20:01:19.845163,0 days 00:03:08.803004000,512,10000,0.03965303333194802,0.46180834722994635,0.999,5000,0.08043820668843166,medium,5000,PRUNED
490,490,132.50479125976562,2021-07-05 19:58:42.874433,2021-07-05 20:01:44.637200,0 days 00:03:01.762767000,512,50000,0.03949977138060166,0.1781622195590807,0.999,5000,0.0003203355297393201,medium,5000,PRUNED
491,491,429.5377197265625,2021-07-05 20:00:22.388126,2021-07-05 20:02:26.533510,0 days 00:02:04.145384000,512,100000,0.03494026837928085,0.3194014980255961,0.999,5000,0.0008347081074175738,small,200,PRUNED
492,492,0.0,2021-07-05 20:01:19.846306,2021-07-05 20:03:12.529636,0 days 00:01:52.683330000,256,100000,0.027593888605368187,0.17755753635018962,0.99,10000,0.00078490249350454,small,200,PRUNED
493,493,-292.28607177734375,2021-07-05 20:01:44.639210,2021-07-05 20:03:37.671313,0 days 00:01:53.032103000,256,100000,0.02733664390107852,0.26509803411479843,0.99,10000,0.00023069492184782684,small,200,PRUNED
494,494,-338.287841796875,2021-07-05 20:02:26.534912,2021-07-05 20:04:19.402880,0 days 00:01:52.867968000,256,50000,0.007567277114268129,0.23472111541293614,0.99,10000,0.009010262322615741,small,200,PRUNED
495,495,-251.0721435546875,2021-07-05 20:03:12.530610,2021-07-05 20:05:00.116993,0 days 00:01:47.586383000,256,50000,0.1138569290015702,0.23544869985907468,0.995,10000,0.0015849245819921027,small,200,PRUNED
496,496,-0.8500897288322449,2021-07-05 20:03:37.673053,2021-07-05 20:06:03.286967,0 days 00:02:25.613914000,256,50000,0.18229171047083503,0.23290879005108836,0.995,10000,0.002100773511509293,medium,200,PRUNED
497,497,0.0,2021-07-05 20:04:19.404046,2021-07-05 20:07:27.390330,0 days 00:03:07.986284000,256,50000,0.05099356327979211,0.42664394880278056,0.995,5000,0.002335752671491718,medium,1,PRUNED
498,498,262.8818664550781,2021-07-05 20:05:00.117926,2021-07-05 20:07:56.093964,0 days 00:02:55.976038000,256,10000,0.049989747918416,0.311470269326281,0.995,5000,0.000290533734505509,medium,10000,PRUNED
499,499,0.0,2021-07-05 20:06:03.288448,2021-07-05 20:09:48.720010,0 days 00:03:45.431562000,256,10000,0.05124028342245955,0.14294233110597965,0.9999,5000,0.0003012701767592325,medium,10000,PRUNED
500,500,286.1959228515625,2021-07-05 20:07:27.391264,2021-07-05 20:09:42.749247,0 days 00:02:15.357983000,256,10000,0.19394128302567523,0.3888773730917176,0.9999,20000,0.00029813852049914957,medium,1,PRUNED
501,501,-0.2786092460155487,2021-07-05 20:07:56.095493,2021-07-05 20:09:29.951395,0 days 00:01:33.855902000,128,500000,0.012323347578800596,0.19549684837566653,0.9999,20000,0.0339425926966865,small,1,PRUNED
502,502,-351.993896484375,2021-07-05 20:09:29.954039,2021-07-05 20:14:33.695706,0 days 00:05:03.741667000,1024,10000,0.19509069714946392,0.2749979061512274,0.99,0,0.00038859680510276354,medium,1000,PRUNED
503,503,-346.1587219238281,2021-07-05 20:09:42.749992,2021-07-05 20:18:35.226457,0 days 00:08:52.476465000,1024,50000,0.07558053045401257,0.2785008142736669,0.99,0,0.0004242151711162621,small,1000,COMPLETE
504,504,-174.78012084960938,2021-07-05 20:09:48.720902,2021-07-05 20:12:20.783926,0 days 00:02:32.063024000,1024,50000,0.10913659787933852,0.28104393946888606,0.99,0,2.0993322022904867e-05,small,200,PRUNED
505,505,376.69525146484375,2021-07-05 20:12:20.784920,2021-07-05 20:13:32.301069,0 days 00:01:11.516149000,256,100000,0.187824375666005,0.4168519956437298,0.99,10000,0.00039877518813653345,small,1000,PRUNED
506,506,0.0,2021-07-05 20:13:32.302303,2021-07-05 20:15:56.630951,0 days 00:02:24.328648000,256,50000,0.03395514284095888,0.4487941922019742,0.999,5000,0.00021034087132213084,medium,200,PRUNED
507,507,0.0,2021-07-05 20:14:33.696617,2021-07-05 20:16:15.963459,0 days 00:01:42.266842000,256,50000,0.08254126074532968,0.40642286632107305,0.999,5000,2.7215212411123812e-05,small,200,PRUNED
508,508,42.54233169555664,2021-07-05 20:15:56.632048,2021-07-05 20:17:33.272821,0 days 00:01:36.640773000,256,50000,0.016285132327357295,0.3755809128675966,0.98,10000,0.0002346739711326015,small,1500,PRUNED
509,509,0.0,2021-07-05 20:16:15.964687,2021-07-05 20:18:05.449136,0 days 00:01:49.484449000,512,500000,0.046392139861903714,0.306754993712086,0.98,10000,0.015883128250342982,small,200,PRUNED
510,510,-318.560302734375,2021-07-05 20:17:33.273877,2021-07-05 20:29:00.410592,0 days 00:11:27.136715000,512,500000,0.04723659387110472,0.2544854064723658,0.995,10000,0.0002571857879901156,medium,200,COMPLETE
511,511,368.2245788574219,2021-07-05 20:18:05.449776,2021-07-05 20:20:32.140613,0 days 00:02:26.690837000,256,100000,0.03752111053122023,0.25636046236125537,0.995,5000,0.0004876461292177109,medium,200,PRUNED
512,512,-324.6174621582031,2021-07-05 20:18:35.227727,2021-07-05 20:20:56.541971,0 days 00:02:21.314244000,256,100000,0.00018640746655286533,0.25505203743832605,0.995,5000,3.722103039231287e-05,medium,200,PRUNED
513,513,378.0334777832031,2021-07-05 20:20:32.141544,2021-07-05 20:22:07.041570,0 days 00:01:34.900026000,256,10000,0.030575046005563412,0.3497485612656065,0.9,20000,0.0001658134952284722,medium,200,PRUNED
514,514,0.0,2021-07-05 20:20:56.542791,2021-07-05 20:22:25.750047,0 days 00:01:29.207256000,256,10000,0.058512802506340715,0.3219099096698313,0.99,20000,0.0002621127123202901,small,1,PRUNED
515,515,-366.29150390625,2021-07-05 20:22:07.042625,2021-07-05 20:24:07.952034,0 days 00:02:00.909409000,128,50000,0.008170846222678916,0.4986100003293282,0.99,10000,0.0002663211018598629,small,1,PRUNED
516,516,-301.47613525390625,2021-07-05 20:22:25.751069,2021-07-05 20:24:23.172610,0 days 00:01:57.421541000,512,50000,0.011212210462614072,0.3327533792808978,0.99,10000,0.00033842731877062175,small,1500,PRUNED
517,517,417.44232177734375,2021-07-05 20:24:07.953077,2021-07-05 20:26:29.099296,0 days 00:02:21.146219000,512,50000,0.09980014901896064,0.3370184835792488,0.999,10000,0.00034680552840178126,medium,1500,PRUNED
518,518,244.14303588867188,2021-07-05 20:24:23.173238,2021-07-05 20:26:52.126406,0 days 00:02:28.953168000,256,500000,0.023293843198969974,0.24591588381104593,0.999,5000,0.013595897671049715,medium,200,PRUNED
519,519,-327.47412109375,2021-07-05 20:26:29.100310,2021-07-05 20:28:56.104800,0 days 00:02:27.004490000,256,500000,0.0657320391807206,0.2463245791052768,0.995,5000,8.009296341496336e-05,medium,200,PRUNED
520,520,-335.21697998046875,2021-07-05 20:26:52.128342,2021-07-05 20:28:44.234981,0 days 00:01:52.106639000,256,100000,0.06584272669591737,0.2905076464815959,0.995,0,4.5921771597150495e-05,small,200,PRUNED
521,521,40.98231506347656,2021-07-05 20:28:44.236141,2021-07-05 20:31:27.277146,0 days 00:02:43.041005000,256,50000,0.1741352787502347,0.20164588669439631,0.9999,5000,6.420678095714406e-05,medium,5000,PRUNED
522,522,269.9151306152344,2021-07-05 20:28:56.105666,2021-07-05 20:30:35.979665,0 days 00:01:39.873999000,256,50000,0.0038222969045711343,0.20898432525364555,0.9999,10000,0.0002161813572177192,small,200,PRUNED
523,523,-50.568599700927734,2021-07-05 20:29:00.412131,2021-07-05 20:31:07.769924,0 days 00:02:07.357793000,256,50000,0.1191195931124244,0.20636913051935454,0.9999,5000,0.009832201556314951,small,5000,PRUNED
524,524,105.6384048461914,2021-07-05 20:30:35.980804,2021-07-05 20:32:52.351627,0 days 00:02:16.370823000,1024,10000,0.0370390503526252,0.3137226105027215,0.99,5000,7.107622292601034e-05,small,10000,PRUNED
525,525,32.31985092163086,2021-07-05 20:31:07.770532,2021-07-05 20:36:42.273625,0 days 00:05:34.503093000,1024,10000,0.03790029502779964,0.43130654498974236,0.99,0,0.0012430741980491591,medium,10000,PRUNED
526,526,0.0,2021-07-05 20:31:27.278285,2021-07-05 20:34:07.139605,0 days 00:02:39.861320000,1024,10000,0.015067297565848311,0.3021234929087464,0.99,1000,0.0006279195948374463,small,10000,PRUNED
527,527,0.0,2021-07-05 20:32:52.352960,2021-07-05 20:36:03.234439,0 days 00:03:10.881479000,256,100000,0.028055030776321464,0.4346336903471485,0.98,1000,0.000533963843180501,medium,1,PRUNED
528,528,348.61871337890625,2021-07-05 20:34:07.140515,2021-07-05 20:37:22.456646,0 days 00:03:15.316131000,256,100000,0.033447638221912164,0.43066403812801857,0.98,0,0.0001594562856674959,medium,1,PRUNED
