,number,value,datetime_start,datetime_complete,duration,params_batch_size,params_buffer_size,params_exploration_final_eps,params_exploration_fraction,params_gamma,params_learning_starts,params_lr,params_net_arch,params_target_update_interval,state
952,952,-59.352203369140625,2021-07-06 03:29:47.126311,2021-07-06 03:38:45.384919,0 days 00:08:58.258608000,512,50000,0.023975114288578667,0.27939225277208923,0.99,5000,0.0022784660769530857,small,1500,COMPLETE
953,953,298.1651306152344,2021-07-06 03:30:58.085203,2021-07-06 03:33:24.627932,0 days 00:02:26.542729000,512,10000,0.026991427904665063,0.27553996081951165,0.99,5000,0.004680032100095016,small,1500,PRUNED
954,954,323.690673828125,2021-07-06 03:32:55.665386,2021-07-06 03:35:36.732629,0 days 00:02:41.067243000,512,10000,0.02353170909819552,0.2794496847256343,0.99,5000,0.002149446548367909,small,1500,PRUNED
955,955,370.0884704589844,2021-07-06 03:33:24.629439,2021-07-06 03:35:33.531362,0 days 00:02:08.901923000,512,10000,0.02484861694627683,0.2698010689616614,0.99,10000,0.001964585754367697,small,1500,PRUNED
956,956,0.0,2021-07-06 03:35:33.533280,2021-07-06 03:38:14.252859,0 days 00:02:40.719579000,512,50000,0.03206778845144367,0.25270234312883266,0.99,5000,0.0015455357090504646,small,1500,PRUNED
957,957,161.9381866455078,2021-07-06 03:35:36.733793,2021-07-06 03:37:46.289153,0 days 00:02:09.555360000,512,50000,0.03352368502891126,0.25175065658894896,0.99,10000,0.0029639850057162414,small,1500,PRUNED
958,958,0.0,2021-07-06 03:37:46.290268,2021-07-06 03:40:44.712103,0 days 00:02:58.421835000,512,100000,0.030495823630678376,0.26481734684808256,0.99,10000,0.001018196691245973,medium,1500,PRUNED
959,959,-375.27001953125,2021-07-06 03:38:14.253991,2021-07-06 03:41:13.056105,0 days 00:02:58.802114000,512,100000,0.02849040353885282,0.2804822860329497,0.99,10000,0.0035253366065230657,medium,1500,PRUNED
960,960,-238.052001953125,2021-07-06 03:38:45.386435,2021-07-06 03:41:44.312752,0 days 00:02:58.926317000,512,100000,0.027985297520972303,0.28197619104267435,0.99,10000,0.00190243305208194,medium,1500,PRUNED
961,961,91.78978729248047,2021-07-06 03:40:44.713541,2021-07-06 03:44:01.618541,0 days 00:03:16.905000000,512,50000,0.02610555525029306,0.2832717704818918,0.99,10000,0.0028180560528297412,medium,1500,PRUNED
962,962,0.0,2021-07-06 03:41:13.057573,2021-07-06 03:43:08.078548,0 days 00:01:55.020975000,512,50000,0.026926805193871483,0.2894492267823395,0.99,10000,0.002639124850484793,small,1500,PRUNED
963,963,336.1403503417969,2021-07-06 03:41:44.314029,2021-07-06 03:44:07.500338,0 days 00:02:23.186309000,512,50000,0.02477447243143005,0.282899878906016,0.99,5000,0.002471211271208835,small,1500,PRUNED
964,964,336.099853515625,2021-07-06 03:43:08.080213,2021-07-06 03:45:47.867825,0 days 00:02:39.787612000,512,10000,0.022904556484142916,0.27371169435201526,0.99,5000,0.002427077516021735,small,1500,PRUNED
965,965,-294.8416442871094,2021-07-06 03:44:01.619756,2021-07-06 03:46:36.605112,0 days 00:02:34.985356000,512,10000,0.03622428085530414,0.27376541694075024,0.99,5000,0.0017905874140282006,small,1500,PRUNED
966,966,-2.972787857055664,2021-07-06 03:44:07.501307,2021-07-06 03:45:21.068816,0 days 00:01:13.567509000,512,10000,0.03562025785502747,0.2723504723526649,0.995,20000,0.001798362006187395,small,1500,PRUNED
967,967,-354.2359619140625,2021-07-06 03:45:21.070319,2021-07-06 03:47:34.776539,0 days 00:02:13.706220000,512,10000,0.02228751697922525,0.29672025332767826,0.98,5000,0.0035981160095854515,small,1500,PRUNED
968,968,431.67108154296875,2021-07-06 03:45:47.869519,2021-07-06 03:50:08.924255,0 days 00:04:21.054736000,512,50000,0.033382394037646715,0.4595278911426925,0.98,0,0.00203289718942842,medium,1500,PRUNED
969,969,383.3111572265625,2021-07-06 03:46:36.606518,2021-07-06 03:50:51.561313,0 days 00:04:14.954795000,512,50000,0.02996099674247318,0.460551197673088,0.98,0,0.0029436688167708133,medium,1500,PRUNED
970,970,360.1721496582031,2021-07-06 03:47:34.778447,2021-07-06 03:51:51.265835,0 days 00:04:16.487388000,512,50000,0.03880410630354632,0.2917336246714719,0.95,0,0.002740815519507209,medium,1500,PRUNED
971,971,373.1495056152344,2021-07-06 03:50:08.925496,2021-07-06 03:53:28.827380,0 days 00:03:19.901884000,512,50000,0.03173089080007056,0.29144126700172085,0.95,10000,0.0029776250024467596,medium,1500,PRUNED
972,972,0.0,2021-07-06 03:50:51.562729,2021-07-06 03:52:41.673449,0 days 00:01:50.110720000,512,100000,0.03828811617411343,0.3824948308489813,0.95,10000,0.003973792677538289,small,1500,PRUNED
973,973,-305.41473388671875,2021-07-06 03:51:51.267460,2021-07-06 03:54:08.574232,0 days 00:02:17.306772000,512,100000,0.019014006230303908,0.15903492320749316,0.995,10000,0.002206915075555829,small,1500,PRUNED
974,974,-253.02365112304688,2021-07-06 03:52:41.674472,2021-07-06 03:53:53.597650,0 days 00:01:11.923178000,512,50000,0.01919937084379101,0.20348981340312447,0.995,20000,0.0014868302208193062,small,1500,PRUNED
975,975,-4.894137859344482,2021-07-06 03:53:28.829345,2021-07-06 03:54:45.900890,0 days 00:01:17.071545000,512,100000,0.020338915124796172,0.4086978008317948,0.995,20000,0.0014002294267380592,small,1500,PRUNED
976,976,353.9854431152344,2021-07-06 03:53:53.598951,2021-07-06 03:55:57.532799,0 days 00:02:03.933848000,512,100000,0.030122888263595382,0.15806781108387646,0.995,10000,0.0021153404783361435,small,1500,PRUNED
977,977,341.4288024902344,2021-07-06 03:54:08.575244,2021-07-06 03:56:27.917411,0 days 00:02:19.342167000,512,10000,0.029488316051568254,0.40975757876258284,0.9,5000,0.0012237258397712406,small,1500,PRUNED
978,978,83.1153793334961,2021-07-06 03:54:45.903385,2021-07-06 03:58:33.957880,0 days 00:03:48.054495000,512,10000,0.03368561416031672,0.1901414228779897,0.9,5000,0.0038017508103476206,medium,1500,PRUNED
979,979,0.0,2021-07-06 03:55:57.536131,2021-07-06 03:59:38.033510,0 days 00:03:40.497379000,512,10000,0.02443750429299746,0.1180300647513989,0.9,5000,0.002158610753605434,medium,1500,PRUNED
980,980,353.3789978027344,2021-07-06 03:56:27.918930,2021-07-06 04:00:37.349148,0 days 00:04:09.430218000,512,50000,0.03528403930831827,0.13806008140089288,0.99,1000,0.001790138876986781,medium,1500,PRUNED
981,981,71.59431457519531,2021-07-06 03:58:33.959117,2021-07-06 04:03:05.460890,0 days 00:04:31.501773000,512,50000,0.1062653708825344,0.45045868367243846,0.99,1000,0.0024507725461700353,medium,1500,PRUNED
982,982,36.68265914916992,2021-07-06 03:59:38.035965,2021-07-06 04:02:15.458187,0 days 00:02:37.422222000,512,50000,0.04044446657768365,0.1438092620063497,0.99,1000,0.0027083596500824003,small,10000,PRUNED
983,983,110.16815948486328,2021-07-06 04:00:37.350296,2021-07-06 04:02:29.119350,0 days 00:01:51.769054000,512,50000,0.040173497642141356,0.3915204660390278,0.99,10000,4.302156173268249e-05,small,10000,PRUNED
984,984,-2.361818552017212,2021-07-06 04:02:15.459159,2021-07-06 04:04:11.065574,0 days 00:01:55.606415000,512,50000,0.042321733874294755,0.28171339667999123,0.99,10000,0.004142846561496264,small,5000,PRUNED
985,985,43.19267654418945,2021-07-06 04:02:29.120464,2021-07-06 04:06:21.170404,0 days 00:03:52.049940000,512,50000,0.027280282045726394,0.4452113727577507,0.995,10000,0.003936366899357515,medium,5000,PRUNED
986,986,-96.95321655273438,2021-07-06 04:03:05.462786,2021-07-06 04:05:23.747708,0 days 00:02:18.284922000,512,50000,0.024490970564710175,0.17014918894674902,0.995,10000,0.028423725024933316,small,5000,PRUNED
987,987,-0.010748662054538727,2021-07-06 04:04:11.067120,2021-07-06 04:07:40.966390,0 days 00:03:29.899270000,512,10000,0.02527783894870399,0.2150906963688266,0.995,10000,0.0035020353897240023,small,1,PRUNED
988,988,5.698794364929199,2021-07-06 04:05:23.748840,2021-07-06 04:08:14.142655,0 days 00:02:50.393815000,512,10000,0.12532683555430923,0.41992015728444193,0.995,20000,2.1800427203746887e-05,medium,1,PRUNED
989,989,365.5512390136719,2021-07-06 04:06:21.172849,2021-07-06 04:08:10.222420,0 days 00:01:49.049571000,128,10000,0.09115332650187365,0.1833878306257403,0.995,20000,0.0011671009102966888,small,1,PRUNED
990,990,271.6061706542969,2021-07-06 04:07:40.968231,2021-07-06 04:08:55.919776,0 days 00:01:14.951545000,128,100000,0.03810208395151836,0.2963458999696113,0.99,20000,0.0057281278273075414,medium,1500,PRUNED
991,991,369.0389099121094,2021-07-06 04:08:10.224175,2021-07-06 04:12:04.819358,0 days 00:03:54.595183000,512,100000,0.06713898660442787,0.3974840995734129,0.99,5000,0.007488870761311677,medium,1500,PRUNED
992,992,296.4647521972656,2021-07-06 04:08:14.143573,2021-07-06 04:11:02.518296,0 days 00:02:48.374723000,1024,100000,0.06623531895356173,0.10323958660885801,0.99,5000,0.0016478222475893747,small,1500,PRUNED
993,993,-1.6379938125610352,2021-07-06 04:08:55.921135,2021-07-06 04:11:45.804078,0 days 00:02:49.882943000,1024,500000,0.01755553082014153,0.282609022959347,0.99,5000,0.021568861661336355,small,1500,PRUNED
994,994,18.51943016052246,2021-07-06 04:11:02.519544,2021-07-06 04:13:14.777904,0 days 00:02:12.258360000,512,50000,0.018526463760843027,0.19747339659215396,0.98,5000,2.9942468446296096e-05,small,1500,PRUNED
995,995,0.0,2021-07-06 04:11:45.805190,2021-07-06 04:16:29.451607,0 days 00:04:43.646417000,512,50000,0.03293831443410654,0.39852382372950723,0.98,0,2.8391184518497097e-05,medium,1500,PRUNED
996,996,0.0,2021-07-06 04:12:04.820479,2021-07-06 04:14:44.867349,0 days 00:02:40.046870000,512,50000,0.032324193322338615,0.270665793456321,0.98,0,3.06343573563456e-05,small,10000,PRUNED
997,997,117.80409240722656,2021-07-06 04:13:14.779907,2021-07-06 04:16:04.462085,0 days 00:02:49.682178000,512,50000,0.1581224515835637,0.12908095222791452,0.995,0,0.00010890167393184034,small,10000,PRUNED
998,998,389.7241516113281,2021-07-06 04:14:44.868616,2021-07-06 04:17:44.210286,0 days 00:02:59.341670000,512,10000,0.15827927792742413,0.1295630256748823,0.995,10000,4.932257341424509e-05,medium,1,PRUNED
999,999,-348.05792236328125,2021-07-06 04:16:04.463151,2021-07-06 04:19:23.891269,0 days 00:03:19.428118000,1024,10000,0.03628354727837813,0.28756020772156077,0.995,10000,0.0032082100233254062,medium,1,PRUNED
