,number,value,datetime_start,datetime_complete,duration,params_batch_size,params_buffer_size,params_exploration_final_eps,params_exploration_fraction,params_gamma,params_learning_starts,params_lr,params_net_arch,params_target_update_interval,state
211,211,-345.5224914550781,2021-07-05 15:23:41.595600,2021-07-05 15:29:48.364186,0 days 00:06:06.768586000,256,50000,0.05515877641970687,0.31161737044425186,0.999,5000,0.0002536175533773261,small,200,COMPLETE
212,212,17.081327438354492,2021-07-05 15:24:39.535440,2021-07-05 15:26:47.247189,0 days 00:02:07.711749000,256,50000,0.1148119448613718,0.48292724213654065,0.999,5000,0.00026309483475888713,small,5000,PRUNED
213,213,338.23101806640625,2021-07-05 15:24:41.811864,2021-07-05 15:27:50.061568,0 days 00:03:08.249704000,256,50000,0.19870506287413398,0.428308039027407,0.999,5000,0.012108539720957488,medium,200,PRUNED
214,214,-0.05713063105940819,2021-07-05 15:26:47.248402,2021-07-05 15:29:42.034908,0 days 00:02:54.786506000,256,100000,0.1692239629890046,0.4261040208388156,0.9,5000,0.011607702601015296,medium,200,PRUNED
215,215,420.5757141113281,2021-07-05 15:27:50.062897,2021-07-05 15:30:19.445049,0 days 00:02:29.382152000,256,100000,0.04810680186158889,0.2741737598927737,0.9,5000,0.00018161235862320676,medium,200,PRUNED
216,216,-321.86688232421875,2021-07-05 15:29:42.036163,2021-07-05 15:32:44.733253,0 days 00:03:02.697090000,256,50000,0.047475462691182704,0.2516408579791003,0.9999,5000,0.0021515373874257636,medium,200,PRUNED
217,217,-0.8850603699684143,2021-07-05 15:29:48.366764,2021-07-05 15:32:52.256848,0 days 00:03:03.890084000,256,100000,0.0463612441100335,0.18576513839160175,0.9999,5000,0.016078875921572568,medium,200,PRUNED
218,218,290.4778137207031,2021-07-05 15:30:19.446022,2021-07-05 15:32:39.800578,0 days 00:02:20.354556000,256,50000,0.033498610375727655,0.18596103464770675,0.9999,10000,0.00035844546294687884,medium,1,PRUNED
219,219,-347.80023193359375,2021-07-05 15:32:39.802553,2021-07-05 15:35:23.614174,0 days 00:02:43.811621000,128,100000,0.010253875233424603,0.1546367709994975,0.995,5000,0.002299601543015154,medium,200,PRUNED
220,220,3.8623948097229004,2021-07-05 15:32:44.734950,2021-07-05 15:35:06.947129,0 days 00:02:22.212179000,128,100000,0.010528722298670115,0.4690470618713638,0.995,5000,0.00021933451744926577,medium,10000,PRUNED
221,221,70.70936584472656,2021-07-05 15:32:52.257830,2021-07-05 15:34:57.999430,0 days 00:02:05.741600000,1024,100000,0.00021633116864624123,0.1615160030972732,0.995,10000,9.889083653979548e-05,small,10000,PRUNED
222,222,400.78411865234375,2021-07-05 15:34:58.000700,2021-07-05 15:37:34.706991,0 days 00:02:36.706291000,128,50000,0.009752913173618568,0.35528586225487013,0.995,5000,0.00022942412845818313,medium,1,PRUNED
223,223,-362.5282287597656,2021-07-05 15:35:06.948310,2021-07-05 15:38:14.660665,0 days 00:03:07.712355000,256,500000,0.018344853424912533,0.12893417760673498,0.995,5000,0.003368554415498113,medium,1500,PRUNED
224,224,0.0,2021-07-05 15:35:23.615140,2021-07-05 15:38:18.375003,0 days 00:02:54.759863000,256,500000,0.017110525350131356,0.44914899069865244,0.995,5000,0.004108935545380347,medium,1500,PRUNED
225,225,-319.0946044921875,2021-07-05 15:37:34.707808,2021-07-05 15:40:06.520626,0 days 00:02:31.812818000,256,500000,0.014982968648533712,0.1275506599945069,0.995,5000,0.003729512297108378,medium,1500,PRUNED
226,226,421.3104553222656,2021-07-05 15:38:14.661524,2021-07-05 15:40:46.581354,0 days 00:02:31.919830000,256,500000,0.033192250846732156,0.4430062271633638,0.995,5000,0.0026541047334470236,medium,1500,PRUNED
227,227,30.883365631103516,2021-07-05 15:38:18.376010,2021-07-05 15:40:53.185606,0 days 00:02:34.809596000,256,500000,0.03297680994586351,0.3700690016887298,0.995,5000,0.0026450702151071966,medium,5000,PRUNED
228,228,324.32672119140625,2021-07-05 15:40:06.521773,2021-07-05 15:43:53.251169,0 days 00:03:46.729396000,256,500000,0.03571733048369074,0.2945379448409739,0.99,5000,0.002764346711719359,medium,5000,PRUNED
229,229,128.24795532226562,2021-07-05 15:40:46.582598,2021-07-05 15:42:49.770672,0 days 00:02:03.188074000,256,50000,0.02854820355698179,0.49950531341984244,0.99,10000,0.006665811781291662,small,5000,PRUNED
230,230,-291.824462890625,2021-07-05 15:40:53.186394,2021-07-05 15:50:01.803842,0 days 00:09:08.617448000,256,50000,0.026984603172690223,0.4045300168530097,0.99,10000,0.00030689480650682036,small,1,COMPLETE
231,231,0.0,2021-07-05 15:42:49.771838,2021-07-05 15:46:25.851313,0 days 00:03:36.079475000,256,50000,0.13311058991543473,0.2922536331689069,0.95,1000,0.0010216196845863781,small,1,PRUNED
232,232,231.8794708251953,2021-07-05 15:43:53.253540,2021-07-05 15:48:39.065847,0 days 00:04:45.812307000,1024,50000,0.04029906055949059,0.4013331104856172,0.95,1000,2.6158004309561598e-05,small,1,PRUNED
233,233,298.9611511230469,2021-07-05 15:46:25.852872,2021-07-05 15:48:56.385656,0 days 00:02:30.532784000,256,50000,0.05045219786863508,0.41685089687535665,0.999,5000,0.0002648866264877009,small,200,PRUNED
234,234,347.8103942871094,2021-07-05 15:48:39.067381,2021-07-05 15:59:31.146140,0 days 00:10:52.078759000,256,50000,0.05097723215326133,0.3123363957292541,0.999,5000,0.0003002075039834654,small,200,COMPLETE
235,235,367.0581970214844,2021-07-05 15:48:56.388018,2021-07-05 15:51:47.262539,0 days 00:02:50.874521000,256,50000,0.054722315385915314,0.30957303800046176,0.999,5000,0.0002949321561980196,small,200,PRUNED
236,236,-340.34747314453125,2021-07-05 15:50:01.806846,2021-07-05 16:01:22.048058,0 days 00:11:20.241212000,256,50000,0.0659616294387464,0.4044120845798077,0.99,10000,0.0003069706969590225,small,1,COMPLETE
237,237,-163.41661071777344,2021-07-05 15:51:47.263717,2021-07-05 16:03:04.894242,0 days 00:11:17.630525000,256,50000,0.023259465778046648,0.3865576557585685,0.99,10000,0.00043172194896235735,small,1,COMPLETE
238,238,0.0,2021-07-05 15:59:31.148491,2021-07-05 16:02:47.149696,0 days 00:03:16.001205000,256,50000,0.06390249459450208,0.4353911725205241,0.99,10000,0.00037697968281396194,small,1,PRUNED
239,239,364.21441650390625,2021-07-05 16:01:22.049958,2021-07-05 16:04:14.883267,0 days 00:02:52.833309000,256,50000,0.11991813987142746,0.432853480129503,0.99,10000,0.00016656287733356933,small,1,PRUNED
240,240,0.0,2021-07-05 16:02:47.151424,2021-07-05 16:05:06.943316,0 days 00:02:19.791892000,256,50000,0.0848094887512229,0.29867462772480535,0.99,10000,0.00017734195705546065,small,200,PRUNED
241,241,411.7541198730469,2021-07-05 16:03:04.895899,2021-07-05 16:06:51.940427,0 days 00:03:47.044528000,1024,50000,0.023507781711462804,0.3936653564748861,0.99,10000,0.00038665169729079114,small,1,PRUNED
242,242,296.62457275390625,2021-07-05 16:04:14.884798,2021-07-05 16:08:21.707096,0 days 00:04:06.822298000,1024,50000,0.02125781674936757,0.30205705400481436,0.99,10000,0.000330575397720349,small,1,PRUNED
243,243,-364.1443176269531,2021-07-05 16:05:06.944758,2021-07-05 16:07:54.799215,0 days 00:02:47.854457000,256,50000,0.024373065775874527,0.3913946930658468,0.99,10000,0.0007681785576892241,small,1,PRUNED
244,244,379.12274169921875,2021-07-05 16:06:51.943777,2021-07-05 16:10:07.505651,0 days 00:03:15.561874000,256,50000,0.044015065302511404,0.4198757692675899,0.99,10000,0.0007185513870298775,small,1,PRUNED
245,245,342.2318420410156,2021-07-05 16:07:54.800417,2021-07-05 16:10:47.307195,0 days 00:02:52.506778000,256,50000,0.03059686466247262,0.4104183355013091,0.99,10000,0.0004896077035670009,small,1,PRUNED
246,246,394.0997009277344,2021-07-05 16:08:21.708001,2021-07-05 16:10:49.910962,0 days 00:02:28.202961000,256,50000,0.04324447494977121,0.4081210065638157,0.999,10000,0.0004547776496777916,small,200,PRUNED
247,247,419.2307434082031,2021-07-05 16:10:07.506779,2021-07-05 16:12:53.216520,0 days 00:02:45.709741000,256,50000,0.028223600247438467,0.3167835927503201,0.999,0,0.00042338306423293987,small,200,PRUNED
248,248,366.99615478515625,2021-07-05 16:10:47.308552,2021-07-05 16:13:53.413169,0 days 00:03:06.104617000,512,50000,0.014210411008944828,0.4563122279632897,0.999,0,0.0004508431289913463,small,200,PRUNED
249,249,0.0,2021-07-05 16:10:49.911739,2021-07-05 16:11:52.532934,0 days 00:01:02.621195000,512,100000,0.05685291425671896,0.23682512438835196,0.999,20000,0.00042127935245104924,small,200,PRUNED
250,250,0.0,2021-07-05 16:11:52.534021,2021-07-05 16:21:00.839477,0 days 00:09:08.305456000,256,10000,0.0142314647706254,0.19954815060010392,0.99,0,0.00027456112445182877,small,200,COMPLETE
251,251,708.8346557617188,2021-07-05 16:12:53.217553,2021-07-05 16:21:12.964372,0 days 00:08:19.746819000,256,10000,0.03709646281103806,0.2653075452197593,0.99,10000,0.000310457235402147,small,200,COMPLETE
252,252,-360.793212890625,2021-07-05 16:13:53.414308,2021-07-05 16:22:07.910658,0 days 00:08:14.496350000,256,10000,0.036478607145900455,0.2565433788647891,0.99,10000,0.0002667156690559093,small,200,COMPLETE
253,253,-305.7307434082031,2021-07-05 16:21:00.841189,2021-07-05 16:23:38.027175,0 days 00:02:37.185986000,256,10000,0.1253433842157258,0.2648832166021208,0.99,0,0.0002834886598230666,small,200,PRUNED
254,254,-304.4192810058594,2021-07-05 16:21:12.965374,2021-07-05 16:23:59.604424,0 days 00:02:46.639050000,256,10000,0.03736259048567336,0.3849978873437659,0.99,0,0.0002078578772227529,small,200,PRUNED
255,255,-120.17782592773438,2021-07-05 16:22:07.912133,2021-07-05 16:24:50.571567,0 days 00:02:42.659434000,256,10000,0.03936003966492932,0.20196754232220598,0.99,0,0.00021528369348134129,small,200,PRUNED
256,256,-183.5750732421875,2021-07-05 16:23:38.028348,2021-07-05 16:26:40.461718,0 days 00:03:02.433370000,512,10000,0.039851777794723084,0.20767673013293697,0.99,0,0.00022312515142186955,small,200,PRUNED
257,257,-265.0835876464844,2021-07-05 16:23:59.605560,2021-07-05 16:26:06.289969,0 days 00:02:06.684409000,512,10000,0.03988064889031913,0.1961935745688547,0.99,10000,0.0003447605499204277,small,200,PRUNED
258,258,379.9317932128906,2021-07-05 16:24:50.572678,2021-07-05 16:26:53.285215,0 days 00:02:02.712537000,512,10000,0.10907448011639446,0.2737608518202642,0.99,10000,2.0014448695765627e-05,small,200,PRUNED
259,259,-0.16346633434295654,2021-07-05 16:26:06.292458,2021-07-05 16:28:20.904435,0 days 00:02:14.611977000,1024,10000,0.1582962044780088,0.27375720904047535,0.99,10000,0.017242367751110637,small,200,PRUNED
260,260,-1.4239192008972168,2021-07-05 16:26:40.463054,2021-07-05 16:28:53.262214,0 days 00:02:12.799160000,1024,10000,0.04984035747409791,0.2715333367855003,0.99,10000,3.4119209794799476e-05,small,200,PRUNED
261,261,-226.44522094726562,2021-07-05 16:26:53.286113,2021-07-05 16:29:19.153411,0 days 00:02:25.867298000,1024,10000,0.0511797998769268,0.1721875853108757,0.99,10000,0.014430108796830765,small,200,PRUNED
262,262,0.0,2021-07-05 16:28:20.905415,2021-07-05 16:29:26.146076,0 days 00:01:05.240661000,128,10000,0.05059635891507051,0.17410605438814905,0.99,20000,0.02083994021585935,small,200,PRUNED
263,263,0.0,2021-07-05 16:28:53.264401,2021-07-05 16:30:03.890990,0 days 00:01:10.626589000,128,100000,0.01914677688811262,0.1763545510737569,0.9999,20000,0.00032296484606867814,small,10000,PRUNED
264,264,127.83637237548828,2021-07-05 16:29:19.154413,2021-07-05 16:30:28.043457,0 days 00:01:08.889044000,128,100000,0.03231399886862733,0.2801704797322763,0.9999,20000,0.0003268211912390877,small,10000,PRUNED
265,265,-38.339256286621094,2021-07-05 16:29:26.147198,2021-07-05 16:30:43.975338,0 days 00:01:17.828140000,256,100000,0.01984928799877116,0.25436127241270423,0.9999,20000,0.010941160396636826,small,10000,PRUNED
266,266,128.3916778564453,2021-07-05 16:30:03.892158,2021-07-05 16:32:04.572960,0 days 00:02:00.680802000,256,100000,0.03249766697415635,0.4810488589447569,0.95,10000,0.00025886563246179485,small,5000,PRUNED
267,267,-0.2614743113517761,2021-07-05 16:30:28.044558,2021-07-05 16:32:23.066297,0 days 00:01:55.021739000,256,100000,0.007051227610030163,0.22203535003455205,0.95,10000,0.00014191410091730393,small,5000,PRUNED
268,268,9.561844825744629,2021-07-05 16:30:43.976480,2021-07-05 16:32:37.705551,0 days 00:01:53.729071000,256,10000,0.14829467519529554,0.48752795625760953,0.95,10000,0.0002722072727674344,small,5000,PRUNED
269,269,-339.6042785644531,2021-07-05 16:32:04.574359,2021-07-05 16:34:01.599855,0 days 00:01:57.025496000,256,10000,0.14785533455853914,0.2188655147224013,0.99,10000,0.001366942764161766,small,200,PRUNED
270,270,402.51690673828125,2021-07-05 16:32:23.067761,2021-07-05 16:35:00.139113,0 days 00:02:37.071352000,256,10000,0.044933189007477455,0.28917730756442417,0.99,0,0.0001931014994437232,small,200,PRUNED
271,271,-356.5939636230469,2021-07-05 16:32:37.706150,2021-07-05 16:35:23.079493,0 days 00:02:45.373343000,256,10000,0.0252045170433537,0.46240536395538256,0.99,0,4.5680503252714833e-05,small,200,PRUNED
272,272,216.13461303710938,2021-07-05 16:34:01.601078,2021-07-05 16:37:25.505408,0 days 00:03:23.904330000,256,50000,0.09847788762621051,0.287488435687561,0.98,0,4.541577028050046e-05,small,200,PRUNED
273,273,409.4537353515625,2021-07-05 16:35:00.140032,2021-07-05 16:37:36.625875,0 days 00:02:36.485843000,256,50000,0.027183792041023874,0.4631225326037971,0.98,10000,0.0006256883330207085,small,1,PRUNED
274,274,421.4105529785156,2021-07-05 16:35:23.080606,2021-07-05 16:38:19.663643,0 days 00:02:56.583037000,256,50000,0.028145067551261792,0.1453240358801014,0.98,10000,0.00011007476745732686,medium,1,PRUNED
275,275,-313.373291015625,2021-07-05 16:37:25.506890,2021-07-05 16:41:11.047443,0 days 00:03:45.540553000,512,50000,0.11593916811986697,0.02990483431530483,0.999,1000,0.0005815958082075331,medium,1,PRUNED
276,276,326.2690734863281,2021-07-05 16:37:36.626830,2021-07-05 16:42:53.082030,0 days 00:05:16.455200000,1024,50000,0.07386378693197106,0.14026381173715108,0.999,1000,0.02690907595257627,medium,1,PRUNED
277,277,424.4266357421875,2021-07-05 16:38:19.664767,2021-07-05 16:43:03.355638,0 days 00:04:43.690871000,1024,100000,0.09298870957660271,0.33134458924857596,0.999,1000,7.924020929834066e-05,medium,200,PRUNED
278,278,355.91595458984375,2021-07-05 16:41:11.048696,2021-07-05 16:45:46.121879,0 days 00:04:35.073183000,1024,100000,0.014010302767967154,0.3287738965857874,0.99,5000,0.00038443893332555694,medium,200,PRUNED
279,279,-339.638671875,2021-07-05 16:42:53.083280,2021-07-05 16:44:38.058686,0 days 00:01:44.975406000,256,100000,0.01237303049945092,0.30488480873747986,0.99,5000,8.175402053527795e-05,small,200,PRUNED
280,280,307.9907531738281,2021-07-05 16:43:03.356639,2021-07-05 16:44:55.376799,0 days 00:01:52.020160000,256,100000,0.013191575045775032,0.30737117816847076,0.99,5000,0.00037221612744074836,small,200,PRUNED
281,281,58.854190826416016,2021-07-05 16:44:38.059828,2021-07-05 16:45:30.021210,0 days 00:00:51.961382000,512,50000,0.006488120473297197,0.2604167024377665,0.995,20000,0.000231794767352738,small,1500,PRUNED
282,282,119.61460876464844,2021-07-05 16:44:55.378085,2021-07-05 16:46:12.399693,0 days 00:01:17.021608000,512,50000,0.0039167091486258295,0.10616106653287562,0.995,20000,0.0002592709528959535,medium,200,PRUNED
283,283,310.8919982910156,2021-07-05 16:45:30.022365,2021-07-05 16:47:47.143488,0 days 00:02:17.121123000,256,10000,0.03400507008754249,0.3614986973577716,0.995,5000,0.0001616500669940035,medium,200,PRUNED
284,284,0.0,2021-07-05 16:45:46.122569,2021-07-05 16:47:54.534702,0 days 00:02:08.412133000,256,10000,0.03552683863389391,0.37381319714675415,0.995,10000,0.0016792320359083088,medium,200,PRUNED
285,285,382.4984436035156,2021-07-05 16:46:12.400789,2021-07-05 16:48:22.414733,0 days 00:02:10.013944000,256,10000,0.03549516441808005,0.37435376484743105,0.9,10000,0.0018911791446270165,medium,1500,PRUNED
286,286,236.99319458007812,2021-07-05 16:47:47.144429,2021-07-05 16:49:40.471559,0 days 00:01:53.327130000,256,50000,0.04101554831568624,0.38763942767682646,0.9,10000,0.00031897025178508396,small,1500,PRUNED
287,287,0.0,2021-07-05 16:47:54.535574,2021-07-05 16:50:07.987380,0 days 00:02:13.451806000,256,50000,0.04452863355426853,0.19796167350015892,0.9,10000,0.056084639931908216,small,1500,PRUNED
288,288,409.0918273925781,2021-07-05 16:48:22.415655,2021-07-05 16:51:51.199047,0 days 00:03:28.783392000,256,50000,0.04372857185185985,0.1879736105448839,0.9999,5000,0.014036405925797146,small,1,PRUNED
289,289,-164.9004364013672,2021-07-05 16:49:40.472552,2021-07-05 16:52:53.330748,0 days 00:03:12.858196000,128,50000,0.04553425251200363,0.19621554826322174,0.95,5000,2.7655220340339692e-05,small,1,PRUNED
290,290,-373.5235900878906,2021-07-05 16:50:07.990688,2021-07-05 16:53:15.051379,0 days 00:03:07.060691000,128,50000,0.047062570595005335,0.18361535224491848,0.95,5000,1.5971106455580225e-05,small,1,PRUNED
291,291,0.0,2021-07-05 16:51:51.201145,2021-07-05 16:54:21.772470,0 days 00:02:30.571325000,128,100000,0.13682854907662423,0.23186350583692356,0.95,5000,1.62265196579405e-05,medium,1000,PRUNED
292,292,0.0,2021-07-05 16:52:53.331811,2021-07-05 16:54:29.048315,0 days 00:01:35.716504000,512,100000,0.031143472217991727,0.4768525571075315,0.99,20000,0.00019687674885087884,medium,200,PRUNED
293,293,-3.2147164344787598,2021-07-05 16:53:15.052294,2021-07-05 16:54:45.505710,0 days 00:01:30.453416000,512,100000,0.023068858173093513,0.24530064803481522,0.99,20000,0.00019466606894909548,medium,200,PRUNED
294,294,270.6810607910156,2021-07-05 16:54:21.773287,2021-07-05 16:55:39.165857,0 days 00:01:17.392570000,512,10000,0.021252663060617828,0.4761208777967633,0.99,20000,0.00024090226966627011,medium,200,PRUNED
295,295,49.70096206665039,2021-07-05 16:54:29.049085,2021-07-05 16:56:26.990632,0 days 00:01:57.941547000,1024,10000,0.0545371489695411,0.39842669407287223,0.99,20000,2.320479171497486e-05,medium,5000,PRUNED
296,296,100.43800354003906,2021-07-05 16:54:45.506219,2021-07-05 16:57:05.757523,0 days 00:02:20.251304000,1024,10000,0.057411132563478004,0.28131741628487306,0.995,10000,0.005267892926152961,small,5000,PRUNED
297,297,-351.3662414550781,2021-07-05 16:55:39.166950,2021-07-05 16:59:05.323141,0 days 00:03:26.156191000,1024,50000,0.05461121691295436,0.2807022444627196,0.995,10000,0.0004904082466226536,small,1,PRUNED
298,298,0.0,2021-07-05 16:56:26.991485,2021-07-05 16:59:11.614775,0 days 00:02:44.623290000,256,50000,0.007512065525951805,0.45061806008525174,0.995,10000,5.6241588001950535e-05,small,1,PRUNED
299,299,0.0,2021-07-05 16:57:05.758520,2021-07-05 17:00:09.821354,0 days 00:03:04.062834000,256,50000,0.009071083166672347,0.31504662861928584,0.999,5000,1.2216293276870918e-05,small,1,PRUNED
300,300,-272.1061096191406,2021-07-05 16:59:05.324129,2021-07-05 17:01:15.721100,0 days 00:02:10.396971000,256,50000,0.015750384856052686,0.44817762855768783,0.999,5000,0.008261425314821283,small,200,PRUNED
301,301,330.5699462890625,2021-07-05 16:59:11.615493,2021-07-05 17:01:14.243781,0 days 00:02:02.628288000,256,50000,0.018753120997431004,0.2973756817104873,0.999,5000,0.00031279762213085824,small,200,PRUNED
302,302,413.3033752441406,2021-07-05 17:00:09.823162,2021-07-05 17:03:17.783021,0 days 00:03:07.959859000,256,100000,0.001267727668959293,0.2971460946623903,0.9999,0,0.008249093062195394,medium,200,PRUNED
303,303,-297.6097106933594,2021-07-05 17:01:14.244792,2021-07-05 17:09:51.733226,0 days 00:08:37.488434000,256,100000,0.001250684579517193,0.2663962030088382,0.9999,0,0.00012013281784613522,medium,200,COMPLETE
304,304,-321.4798889160156,2021-07-05 17:01:15.721731,2021-07-05 17:04:03.069878,0 days 00:02:47.348147000,256,100000,0.03773506449981576,0.2611621820244012,0.9999,0,0.0003841241793391239,medium,1000,PRUNED
305,305,342.83746337890625,2021-07-05 17:03:17.784155,2021-07-05 17:05:35.732966,0 days 00:02:17.948811000,256,10000,0.0378922966950139,0.42295074071864885,0.98,5000,0.00012061213021054579,medium,1000,PRUNED
306,306,114.23220825195312,2021-07-05 17:04:03.070844,2021-07-05 17:06:34.334074,0 days 00:02:31.263230000,256,10000,0.030545695143178026,0.4032916068418812,0.98,5000,0.00013321811472460324,medium,10000,PRUNED
307,307,35.149871826171875,2021-07-05 17:05:35.733776,2021-07-05 17:07:13.724091,0 days 00:01:37.990315000,256,50000,0.07832013129697799,0.15716628464505356,0.99,10000,0.011210609724570473,small,10000,PRUNED
308,308,0.0,2021-07-05 17:06:34.334881,2021-07-05 17:08:05.147748,0 days 00:01:30.812867000,256,50000,0.10390084023788766,0.4976319062981959,0.99,10000,0.017204457245376822,small,200,PRUNED
309,309,-344.9070129394531,2021-07-05 17:07:13.725411,2021-07-05 17:09:04.571004,0 days 00:01:50.845593000,1024,50000,0.027707286944616428,0.4694772674477902,0.995,10000,0.00028058538602379705,small,200,PRUNED
310,310,277.9344177246094,2021-07-05 17:08:05.148457,2021-07-05 17:12:06.127287,0 days 00:04:00.978830000,1024,100000,0.025470646311037872,0.47042876289832786,0.995,5000,0.00027901632774408755,medium,1500,PRUNED
311,311,0.0,2021-07-05 17:09:04.571970,2021-07-05 17:11:38.646401,0 days 00:02:34.074431000,512,100000,0.16666816952220467,0.4410661784757079,0.995,5000,3.6752405331133034e-05,medium,1500,PRUNED
312,312,389.15289306640625,2021-07-05 17:09:51.734842,2021-07-05 17:13:15.113472,0 days 00:03:23.378630000,512,100000,0.0011497058730065906,0.2687738419442154,0.9999,0,8.903537336826816e-05,medium,1500,PRUNED
313,313,406.6204528808594,2021-07-05 17:11:38.647415,2021-07-05 17:14:39.001845,0 days 00:03:00.354430000,256,10000,0.0017002759446634527,0.26147543721671823,0.9999,0,0.00016149102774356676,medium,200,PRUNED
314,314,339.49444580078125,2021-07-05 17:12:06.128296,2021-07-05 17:14:06.635452,0 days 00:02:00.507156000,256,10000,0.049162199542990274,0.26981077154823074,0.9999,0,0.00011611723581352837,small,200,PRUNED
315,315,392.3975830078125,2021-07-05 17:13:15.114533,2021-07-05 17:15:51.396585,0 days 00:02:36.282052000,256,10000,0.04222496357577492,0.2513241730201016,0.9999,0,0.00014864133398170726,small,200,PRUNED
316,316,-357.1827087402344,2021-07-05 17:14:06.636150,2021-07-05 17:17:45.724037,0 days 00:03:39.087887000,256,50000,0.0003618204735713129,0.2433051973140962,0.9999,0,0.0009681707172885845,small,1,PRUNED
