,number,value,datetime_start,datetime_complete,duration,params_batch_size,params_buffer_size,params_exploration_final_eps,params_exploration_fraction,params_gamma,params_learning_starts,params_lr,params_net_arch,params_target_update_interval,state
317,317,-326.1266174316406,2021-07-05 17:14:39.002960,2021-07-05 17:18:31.181096,0 days 00:03:52.178136000,256,50000,0.003785541333236015,0.24156298421538358,0.9999,0,6.597217660693579e-05,small,1,PRUNED
318,318,-406.8587341308594,2021-07-05 17:15:51.397406,2021-07-05 17:19:27.551414,0 days 00:03:36.154008000,256,50000,0.0038021175644579706,0.28492616376639684,0.9999,0,0.0031485865902677896,small,1,PRUNED
319,319,376.94171142578125,2021-07-05 17:17:45.725307,2021-07-05 17:18:56.282104,0 days 00:01:10.556797000,128,50000,0.060694267445295096,0.2858907930464935,0.995,20000,0.00041370258747222506,small,5000,PRUNED
320,320,46.42714309692383,2021-07-05 17:18:31.182342,2021-07-05 17:20:24.349571,0 days 00:01:53.167229000,1024,50000,0.12484471941598023,0.2867550118595255,0.995,20000,0.01324098873872414,medium,5000,PRUNED
321,321,349.1231384277344,2021-07-05 17:18:56.282923,2021-07-05 17:23:30.478550,0 days 00:04:34.195627000,1024,50000,0.040055337203857656,0.2152343448401895,0.995,1000,0.00010008563866120347,medium,200,PRUNED
322,322,374.3878173828125,2021-07-05 17:19:27.552401,2021-07-05 17:24:12.471167,0 days 00:04:44.918766000,1024,100000,0.03413561420026957,0.3058804984191596,0.995,1000,0.002187216585633998,medium,200,PRUNED
323,323,-269.9705505371094,2021-07-05 17:20:24.350627,2021-07-05 17:23:18.329371,0 days 00:02:53.978744000,512,100000,0.03556366907000934,0.3169782614534208,0.999,1000,9.785909521822556e-05,medium,200,PRUNED
324,324,267.82354736328125,2021-07-05 17:23:18.330340,2021-07-05 17:25:43.177350,0 days 00:02:24.847010000,256,10000,0.11082516967389086,0.4166531640159697,0.98,10000,0.0003339297207449616,medium,200,PRUNED
325,325,197.95872497558594,2021-07-05 17:23:30.479078,2021-07-05 17:24:47.607775,0 days 00:01:17.128697000,256,10000,0.009619709093645382,0.4547856176752461,0.98,10000,0.00022472694699593503,small,200,PRUNED
326,326,352.0961608886719,2021-07-05 17:24:12.471991,2021-07-05 17:26:16.390592,0 days 00:02:03.918601000,256,10000,0.009987075201327111,0.4561587379048923,0.98,10000,0.0014749370685030528,small,200,PRUNED
327,327,0.0,2021-07-05 17:24:47.608813,2021-07-05 17:27:34.384515,0 days 00:02:46.775702000,256,50000,0.11159313132015479,0.4175333107499649,0.95,10000,0.00034881274672461616,small,1,PRUNED
328,328,0.0,2021-07-05 17:25:43.178321,2021-07-05 17:28:57.326594,0 days 00:03:14.148273000,256,50000,0.03004174777592017,0.43775964004890183,0.95,10000,0.0014332656593331729,small,1,PRUNED
329,329,109.63404083251953,2021-07-05 17:26:16.391370,2021-07-05 17:29:32.798952,0 days 00:03:16.407582000,512,50000,0.04840987114504637,0.4306124724848447,0.95,10000,3.111173796961235e-05,small,1,PRUNED
330,330,0.0,2021-07-05 17:27:34.386772,2021-07-05 17:30:04.935099,0 days 00:02:30.548327000,512,100000,0.04844934208511842,0.4333230687370077,0.999,20000,0.0005022217074117835,medium,1,PRUNED
331,331,-3.637991189956665,2021-07-05 17:28:57.327642,2021-07-05 17:30:50.463331,0 days 00:01:53.135689000,512,100000,0.04962990431160719,0.20393460874887012,0.999,20000,0.009868174114092142,medium,1500,PRUNED
332,332,65.48397064208984,2021-07-05 17:29:32.799741,2021-07-05 17:30:32.453446,0 days 00:00:59.653705000,128,100000,0.041649359472627545,0.20288171399226654,0.999,20000,0.00017837979264278127,medium,1500,PRUNED
333,333,-16.21424674987793,2021-07-05 17:30:04.936078,2021-07-05 17:31:07.161666,0 days 00:01:02.225588000,128,500000,0.04239163864550415,0.2766431036432458,0.995,20000,0.019573695245046818,medium,1500,PRUNED
334,334,-343.7245178222656,2021-07-05 17:30:32.454489,2021-07-05 17:33:29.203379,0 days 00:02:56.748890000,256,500000,0.18747469270845593,0.3403945801067622,0.995,5000,0.004263204588400431,medium,200,PRUNED
335,335,337.8374328613281,2021-07-05 17:30:50.464103,2021-07-05 17:32:48.993323,0 days 00:01:58.529220000,256,500000,0.03716064112184062,0.16667777836938363,0.995,5000,0.004446979409974112,small,200,PRUNED
336,336,0.0,2021-07-05 17:31:07.162712,2021-07-05 17:33:07.363004,0 days 00:02:00.200292000,256,50000,0.038165242490762606,0.2536275138282278,0.99,5000,0.014861135554053337,small,200,PRUNED
337,337,-228.76882934570312,2021-07-05 17:32:48.994311,2021-07-05 17:38:44.135967,0 days 00:05:55.141656000,256,50000,0.1952690754646757,0.32246747289686084,0.99,0,0.00024344866073097986,small,200,COMPLETE
338,338,-0.24035929143428802,2021-07-05 17:33:07.363560,2021-07-05 17:36:17.175543,0 days 00:03:09.811983000,256,10000,0.017422432842344786,0.29545112925143246,0.99,0,0.000236555865817849,medium,5000,PRUNED
339,339,0.7658429145812988,2021-07-05 17:33:29.204037,2021-07-05 17:35:07.601356,0 days 00:01:38.397319000,256,10000,0.03180353611377944,0.2949375469060391,0.99,10000,0.0011786746833194449,small,10000,PRUNED
340,340,0.0,2021-07-05 17:35:07.602488,2021-07-05 17:40:16.782482,0 days 00:05:09.179994000,1024,50000,0.026715472628387256,0.31649859192043617,0.99,0,0.00023571720759583682,medium,1000,PRUNED
341,341,407.8836975097656,2021-07-05 17:36:17.176524,2021-07-05 17:38:17.971276,0 days 00:02:00.794752000,1024,50000,0.022599938635266048,0.3256436802304211,0.9999,10000,0.0032431741386452035,small,200,PRUNED
342,342,313.7513427734375,2021-07-05 17:38:17.972140,2021-07-05 17:40:28.035727,0 days 00:02:10.063587000,256,50000,0.19417809521012092,0.4873398042847494,0.995,5000,0.00012829310682186085,medium,200,PRUNED
343,343,-313.95703125,2021-07-05 17:38:44.137388,2021-07-05 17:46:49.245266,0 days 00:08:05.107878000,256,50000,0.19656283142408273,0.33554447056041803,0.99,10000,0.00029001739537526936,medium,200,COMPLETE
344,344,0.0,2021-07-05 17:40:16.783443,2021-07-05 17:42:25.494767,0 days 00:02:08.711324000,256,100000,0.1945969720325966,0.4892235100563599,0.99,0,0.0002978597008376591,small,200,PRUNED
345,345,-282.86956787109375,2021-07-05 17:40:28.036525,2021-07-05 17:42:38.867430,0 days 00:02:10.830905000,256,100000,0.15525091054202722,0.32742656249764573,0.99,0,0.00041999368592524696,small,200,PRUNED
346,346,409.0106506347656,2021-07-05 17:42:25.495922,2021-07-05 17:44:31.471228,0 days 00:02:05.975306000,512,50000,0.19824906836048295,0.3271000164017395,0.99,0,0.00039988577666345257,small,200,PRUNED
347,347,-92.05712890625,2021-07-05 17:42:38.868014,2021-07-05 17:46:09.461362,0 days 00:03:30.593348000,512,50000,0.01278314494115672,0.3417229355260424,0.99,0,0.00018108533899498805,medium,200,PRUNED
348,348,362.7828369140625,2021-07-05 17:44:31.472240,2021-07-05 17:47:13.362927,0 days 00:02:41.890687000,128,10000,0.007678946896672044,0.26866740647278037,0.99,0,0.001977754559700517,medium,200,PRUNED
349,349,407.7499694824219,2021-07-05 17:46:09.462401,2021-07-05 17:49:07.347912,0 days 00:02:57.885511000,128,10000,0.1299271557439931,0.22971491326803106,0.99,0,0.00026597069371172335,medium,200,PRUNED
350,350,-350.3559875488281,2021-07-05 17:46:49.248150,2021-07-05 17:53:59.229509,0 days 00:07:09.981359000,256,10000,0.08341255680955645,0.34478561373247524,0.99,10000,0.0002772698107328217,small,200,COMPLETE
351,351,0.0,2021-07-05 17:47:13.363565,2021-07-05 17:48:54.257329,0 days 00:01:40.893764000,256,10000,0.1908829681251624,0.3567568034747986,0.995,10000,0.0002757571012962866,small,200,PRUNED
352,352,0.0,2021-07-05 17:48:54.258315,2021-07-05 17:50:47.247268,0 days 00:01:52.988953000,256,100000,0.198043078247522,0.33536231035736086,0.99,10000,0.00020260282871258526,small,5000,PRUNED
353,353,329.1511535644531,2021-07-05 17:49:07.348716,2021-07-05 17:51:01.873686,0 days 00:01:54.524970000,256,100000,0.1989542031374148,0.3348616507177854,0.9999,10000,0.00034477461569461525,small,200,PRUNED
354,354,-265.4383544921875,2021-07-05 17:50:47.248335,2021-07-05 17:57:22.348096,0 days 00:06:35.099761000,256,50000,0.19560022703049765,0.3149994525421586,0.9999,10000,0.0002990598904923483,small,200,COMPLETE
355,355,384.15582275390625,2021-07-05 17:51:01.874232,2021-07-05 17:53:24.085599,0 days 00:02:22.211367000,256,50000,0.19512857357296004,0.3189146678518439,0.995,10000,0.00021286704195089327,medium,1000,PRUNED
356,356,0.0,2021-07-05 17:53:24.086494,2021-07-05 17:55:12.721577,0 days 00:01:48.635083000,256,50000,0.18589286114177386,0.18220416213995932,0.995,10000,0.00015353393070750664,small,10000,PRUNED
357,357,308.91259765625,2021-07-05 17:53:59.232622,2021-07-05 17:56:14.926026,0 days 00:02:15.693404000,256,50000,0.1911952480838253,0.31065024410723285,0.995,10000,4.0717827308785474e-05,medium,10000,PRUNED
358,358,360.8240661621094,2021-07-05 17:55:12.722492,2021-07-05 17:57:34.377163,0 days 00:02:21.654671000,256,50000,0.19033990350467264,0.3059662261952514,0.999,10000,0.0005006279707276174,medium,200,PRUNED
359,359,416.4290466308594,2021-07-05 17:56:14.927180,2021-07-05 17:58:26.923378,0 days 00:02:11.996198000,256,50000,0.14092908886626332,0.3185676080370101,0.999,10000,0.00034300330753225816,medium,200,PRUNED
360,360,392.9955749511719,2021-07-05 17:57:22.349695,2021-07-05 17:59:46.018700,0 days 00:02:23.669005000,256,50000,0.14076619868507262,0.3185270101144544,0.9999,10000,0.0005663455758697737,medium,200,PRUNED
361,361,429.0885925292969,2021-07-05 17:57:34.378350,2021-07-05 17:59:04.459549,0 days 00:01:30.081199000,256,50000,0.17137572709020993,0.31665962308235207,0.9999,10000,0.0003658651719550004,small,200,PRUNED
362,362,-39.57603073120117,2021-07-05 17:58:26.924409,2021-07-05 18:00:15.678238,0 days 00:01:48.753829000,256,50000,0.005593782632549114,0.33491024788079543,0.9999,10000,0.03800671274550754,small,200,PRUNED
363,363,341.92584228515625,2021-07-05 17:59:04.460544,2021-07-05 18:00:55.752049,0 days 00:01:51.291505000,256,50000,0.09269460986371705,0.14955484533173077,0.9999,10000,0.00024768556093321875,small,200,PRUNED
364,364,-326.03076171875,2021-07-05 17:59:46.019500,2021-07-05 18:05:06.897796,0 days 00:05:20.878296000,256,50000,0.06810943155527983,0.39643242834103226,0.9999,10000,0.00023881176639990433,small,200,COMPLETE
365,365,426.753173828125,2021-07-05 18:00:15.679407,2021-07-05 18:02:11.820029,0 days 00:01:56.140622000,256,50000,0.06751894024061134,0.3252403518221233,0.9999,10000,0.00023554865569533578,small,200,PRUNED
366,366,0.0,2021-07-05 18:00:55.753115,2021-07-05 18:02:39.353224,0 days 00:01:43.600109000,256,50000,0.17934932298947412,0.26237772604701187,0.9999,10000,0.000314419029829835,small,200,PRUNED
367,367,-341.3072509765625,2021-07-05 18:02:11.821385,2021-07-05 18:06:53.436852,0 days 00:04:41.615467000,1024,50000,0.13251942006092834,0.4026290666784381,0.9999,0,6.929455945237759e-05,medium,200,PRUNED
368,368,395.4493103027344,2021-07-05 18:02:39.354009,2021-07-05 18:07:19.406477,0 days 00:04:40.052468000,1024,10000,0.19936458351158698,0.40252480544285085,0.98,0,0.00020332080327717822,medium,200,PRUNED
369,369,1.8574944734573364,2021-07-05 18:05:06.899197,2021-07-05 18:10:11.743784,0 days 00:05:04.844587000,1024,500000,0.11791639031398772,0.30354247284108155,0.98,0,0.00018652539693512953,medium,5000,PRUNED
370,370,-3.808300018310547,2021-07-05 18:06:53.437725,2021-07-05 18:08:37.415235,0 days 00:01:43.977510000,256,500000,0.031329615345632084,0.35238149742323344,0.98,10000,0.000188885612526291,medium,5000,PRUNED
371,371,326.5634765625,2021-07-05 18:07:19.407227,2021-07-05 18:09:17.508418,0 days 00:01:58.101191000,256,500000,0.02952400941786333,0.3048546804264279,0.99,10000,0.0004114519439427398,medium,5000,PRUNED
372,372,0.0,2021-07-05 18:08:37.416077,2021-07-05 18:09:56.817512,0 days 00:01:19.401435000,256,10000,0.10047233718613385,0.3062272395489362,0.99,10000,0.0004259010038487541,small,200,PRUNED
373,373,-251.01368713378906,2021-07-05 18:09:17.509421,2021-07-05 18:11:23.869316,0 days 00:02:06.359895000,256,10000,0.018687847571115572,0.1900001540484117,0.99,5000,0.0002854980112075437,small,200,PRUNED
374,374,388.41943359375,2021-07-05 18:09:56.818487,2021-07-05 18:12:16.640264,0 days 00:02:19.821777000,256,50000,0.021279026075463066,0.2111550623748693,0.99,5000,0.000298333092817332,small,200,PRUNED
375,375,-249.60386657714844,2021-07-05 18:10:11.744492,2021-07-05 18:18:09.443025,0 days 00:07:57.698533000,256,50000,0.01463997758137485,0.2568827320456328,0.99,5000,0.0002936525383040791,small,1000,COMPLETE
376,376,-363.2738342285156,2021-07-05 18:11:23.870141,2021-07-05 18:13:53.617864,0 days 00:02:29.747723000,256,50000,0.023650177176221213,0.25129172280536194,0.99,5000,2.2397573678370225e-05,small,1000,PRUNED
377,377,-214.2639617919922,2021-07-05 18:12:16.641522,2021-07-05 18:15:25.018632,0 days 00:03:08.377110000,256,50000,0.013509165472023854,0.2778216039849538,0.999,10000,0.000112984434797218,medium,1,PRUNED
378,378,386.3656921386719,2021-07-05 18:13:53.618931,2021-07-05 18:17:03.902230,0 days 00:03:10.283299000,256,50000,0.011378308169183867,0.2795070680834115,0.999,10000,0.0006759057188753925,medium,1,PRUNED
379,379,392.85528564453125,2021-07-05 18:15:25.019616,2021-07-05 18:17:47.453316,0 days 00:02:22.433700000,256,50000,0.19531865021725814,0.16148040502671565,0.9999,10000,0.00014707426295209033,medium,200,PRUNED
380,380,377.5077819824219,2021-07-05 18:17:03.903669,2021-07-05 18:19:58.348609,0 days 00:02:54.444940000,1024,10000,0.18588106467223764,0.3278542048902056,0.9999,0,0.00014803501657791195,small,200,PRUNED
381,381,0.0,2021-07-05 18:17:47.454385,2021-07-05 18:20:40.937082,0 days 00:02:53.482697000,1024,10000,0.02711959108962315,0.38762889393306416,0.99,0,0.0003145069408186496,small,200,PRUNED
382,382,397.9854431152344,2021-07-05 18:18:09.444550,2021-07-05 18:20:37.980734,0 days 00:02:28.536184000,1024,10000,0.0003003023452791409,0.26316166626906007,0.9,5000,0.0003446158687009142,small,1000,PRUNED
383,383,-327.6363830566406,2021-07-05 18:19:58.349671,2021-07-05 18:22:12.560602,0 days 00:02:14.210931000,256,10000,0.006596921517456861,0.263120090673223,0.99,5000,0.00034120826199660563,small,1000,PRUNED
384,384,-306.7307434082031,2021-07-05 18:20:37.981618,2021-07-05 18:23:08.430610,0 days 00:02:30.448992000,256,50000,0.006680607337445732,0.2343752436031308,0.99,5000,0.000876161521470542,small,1000,PRUNED
385,385,319.9588928222656,2021-07-05 18:20:40.938165,2021-07-05 18:23:14.483614,0 days 00:02:33.545449000,256,50000,0.006663605382290235,0.24128658365166777,0.995,5000,0.0008085507018675912,small,1000,PRUNED
386,386,299.2769775390625,2021-07-05 18:22:12.561685,2021-07-05 18:24:39.991232,0 days 00:02:27.429547000,256,50000,0.015569759167653657,0.239155172735384,0.995,5000,0.00044080213993985724,small,1000,PRUNED
387,387,0.0,2021-07-05 18:23:08.432512,2021-07-05 18:25:29.391589,0 days 00:02:20.959077000,256,50000,0.01654600644704977,0.25017871479694753,0.995,5000,0.00023908984221145818,small,1000,PRUNED
388,388,384.479248046875,2021-07-05 18:23:14.484324,2021-07-05 18:25:37.607552,0 days 00:02:23.123228000,256,50000,0.014580727633393156,0.25519944022503105,0.995,5000,0.00048617838618885035,small,1000,PRUNED
389,389,-367.7845764160156,2021-07-05 18:24:39.992410,2021-07-05 18:27:08.834879,0 days 00:02:28.842469000,256,100000,0.01723524359321818,0.25027668713921936,0.999,5000,2.84261123206337e-05,small,1000,PRUNED
390,390,406.4432373046875,2021-07-05 18:25:29.392624,2021-07-05 18:28:24.404961,0 days 00:02:55.012337000,256,100000,0.16329812478794728,0.29021996459059374,0.999,5000,0.006749009946032404,small,1000,PRUNED
391,391,361.4560546875,2021-07-05 18:25:37.608226,2021-07-05 18:28:55.195526,0 days 00:03:17.587300000,256,100000,0.019237281516501635,0.2257106249465879,0.999,5000,4.9938503166174364e-05,small,1,PRUNED
392,392,-328.96234130859375,2021-07-05 18:27:08.836094,2021-07-05 18:37:09.763307,0 days 00:10:00.927213000,256,500000,0.011020136475877618,0.22379299906119496,0.98,5000,5.372420305474493e-05,small,1,COMPLETE
393,393,346.4913024902344,2021-07-05 18:28:24.406044,2021-07-05 18:31:37.311672,0 days 00:03:12.905628000,256,500000,0.03351972461736837,0.2709113265059649,0.98,5000,0.00021610874441982587,small,1,PRUNED
394,394,-1.2188347578048706,2021-07-05 18:28:55.196431,2021-07-05 18:33:08.340252,0 days 00:04:13.143821000,1024,500000,0.03435786442913738,0.27311265721973527,0.98,0,7.606085659593207e-05,small,10000,PRUNED
395,395,0.0,2021-07-05 18:31:37.312666,2021-07-05 18:35:29.660662,0 days 00:03:52.347996000,1024,10000,0.12194272678213397,0.13450407047378043,0.9999,0,0.00028262119425636847,small,5000,PRUNED
396,396,273.73095703125,2021-07-05 18:33:08.341287,2021-07-05 18:35:34.472658,0 days 00:02:26.131371000,256,10000,0.012003390207188512,0.4127248005757391,0.9999,5000,0.0002518170081715081,small,5000,PRUNED
397,397,-346.9184265136719,2021-07-05 18:35:29.661658,2021-07-05 18:44:40.301282,0 days 00:09:10.639624000,256,50000,0.009086925141227007,0.41266885215512306,0.99,5000,0.00017584741464350117,small,1,COMPLETE
398,398,-329.0447998046875,2021-07-05 18:35:34.474232,2021-07-05 18:39:13.764998,0 days 00:03:39.290766000,256,50000,0.024757526346002368,0.19525259718492866,0.99,5000,0.000175143719843283,small,1,PRUNED
399,399,0.0,2021-07-05 18:37:09.764626,2021-07-05 18:38:24.207870,0 days 00:01:14.443244000,256,50000,0.02486356138535952,0.2945926220050679,0.99,20000,0.00036290373279761765,small,200,PRUNED
400,400,362.6739807128906,2021-07-05 18:38:24.209807,2021-07-05 18:40:51.356195,0 days 00:02:27.146388000,256,50000,0.03937260953791784,0.1684103730569408,0.99,5000,0.00016700381304067093,small,200,PRUNED
401,401,-309.8688659667969,2021-07-05 18:39:13.766049,2021-07-05 18:42:56.110148,0 days 00:03:42.344099000,256,50000,0.03935082224358888,0.17000474593246653,0.995,0,0.0002219602972861072,medium,200,PRUNED
402,402,-238.05084228515625,2021-07-05 18:40:51.357255,2021-07-05 18:44:27.884053,0 days 00:03:36.526798000,256,50000,0.10732027350928453,0.17887750900507166,0.995,0,0.00012258829008437018,medium,200,PRUNED
403,403,222.1729736328125,2021-07-05 18:42:56.111171,2021-07-05 18:45:52.919048,0 days 00:02:56.807877000,512,10000,0.030994827452713994,0.26581680505912003,0.995,10000,0.00010131208314124937,medium,10000,PRUNED
404,404,0.0,2021-07-05 18:44:27.885335,2021-07-05 18:46:03.325220,0 days 00:01:35.439885000,512,10000,0.028924115102040154,0.26362206252488374,0.9999,10000,0.00010242829639136093,small,10000,PRUNED
405,405,0.0,2021-07-05 18:44:40.302515,2021-07-05 18:47:13.183073,0 days 00:02:32.880558000,512,10000,0.02858935555714059,0.2638586017242702,0.9999,10000,3.4712726113924124e-05,medium,10000,PRUNED
406,406,0.0,2021-07-05 18:45:52.920203,2021-07-05 18:46:56.832235,0 days 00:01:03.912032000,1024,100000,0.03506210907534789,0.1154428203410682,0.9999,20000,0.0005758479074092363,small,200,PRUNED
407,407,358.8304443359375,2021-07-05 18:46:03.326377,2021-07-05 18:47:47.475817,0 days 00:01:44.149440000,1024,100000,0.03525943838957935,0.27906105562627476,0.99,20000,0.00027126182253072785,medium,200,PRUNED
408,408,-316.7685241699219,2021-07-05 18:46:56.833097,2021-07-05 18:49:11.396720,0 days 00:02:14.563623000,256,100000,0.0029383461106040377,0.28379163368396043,0.99,10000,3.390385501941863e-05,medium,200,PRUNED
409,409,415.2880554199219,2021-07-05 18:47:13.184684,2021-07-05 18:50:25.794162,0 days 00:03:12.609478000,256,100000,0.020788211742261746,0.21110679052398512,0.99,5000,0.00038856462137571785,medium,200,PRUNED
410,410,431.31805419921875,2021-07-05 18:47:47.476594,2021-07-05 18:50:20.136264,0 days 00:02:32.659670000,256,50000,0.02171652714769421,0.29323859464902097,0.995,5000,0.00040479019015290214,small,1,PRUNED
411,411,262.599609375,2021-07-05 18:49:11.397582,2021-07-05 18:51:56.746342,0 days 00:02:45.348760000,256,50000,0.02193406667025985,0.4230102834002586,0.995,5000,0.0011348304046048265,small,1,PRUNED
412,412,330.1139831542969,2021-07-05 18:50:20.137264,2021-07-05 18:52:47.778437,0 days 00:02:27.641173000,256,50000,0.00024123512433013236,0.37025391174610206,0.999,5000,0.0003142887192081266,small,1500,PRUNED
413,413,0.0,2021-07-05 18:50:25.794893,2021-07-05 18:53:09.766216,0 days 00:02:43.971323000,256,50000,0.07892358335606048,0.31317529671168953,0.999,0,0.000327156630497094,small,1500,PRUNED
414,414,-346.80828857421875,2021-07-05 18:51:56.747430,2021-07-05 18:54:03.873941,0 days 00:02:07.126511000,256,50000,0.043612718171158825,0.3666273624379714,0.999,0,0.0003094680734527671,small,1500,PRUNED
415,415,-0.06075355038046837,2021-07-05 18:52:47.779482,2021-07-05 18:55:25.916391,0 days 00:02:38.136909000,1024,10000,0.04545891239445937,0.393444740587823,0.9,0,0.024879093476428808,small,5000,PRUNED
416,416,93.54610443115234,2021-07-05 18:53:09.766958,2021-07-05 18:56:25.286551,0 days 00:03:15.519593000,1024,10000,0.04517867489453014,0.38463132290322144,0.9,10000,0.00021769122062580723,medium,5000,PRUNED
417,417,68.83877563476562,2021-07-05 18:54:03.874795,2021-07-05 18:57:31.193010,0 days 00:03:27.318215000,1024,10000,0.08949401828739843,0.3951165030726207,0.99,10000,0.00021375035267531294,medium,5000,PRUNED
418,418,-311.4063720703125,2021-07-05 18:55:25.917629,2021-07-05 18:57:10.768900,0 days 00:01:44.851271000,256,10000,0.07325086341950528,0.14948263704995624,0.99,10000,0.0002410636914982836,medium,200,PRUNED
419,419,389.2015075683594,2021-07-05 18:56:25.287507,2021-07-05 18:58:40.397275,0 days 00:02:15.109768000,256,50000,0.12628094484336075,0.49938511846155975,0.99,10000,0.0005023844360557433,medium,200,PRUNED
420,420,290.3736267089844,2021-07-05 18:57:10.769708,2021-07-05 18:58:26.150201,0 days 00:01:15.380493000,256,50000,0.11483899739668986,0.31146221724954415,0.995,20000,1.8522855798877422e-05,medium,200,PRUNED
421,421,230.16876220703125,2021-07-05 18:57:31.193777,2021-07-05 18:58:20.200017,0 days 00:00:49.006240000,256,50000,0.011231343525418321,0.30804212242911155,0.995,20000,0.00047164573303233554,small,200,PRUNED
422,422,-318.8499450683594,2021-07-05 18:58:20.201046,2021-07-05 19:01:29.183960,0 days 00:03:08.982914000,256,50000,0.016236163554769076,0.18588264427339848,0.98,5000,0.00013788681640318612,medium,200,PRUNED
