,number,value,datetime_start,datetime_complete,duration,params_batch_size,params_buffer_size,params_exploration_final_eps,params_exploration_fraction,params_gamma,params_learning_starts,params_lr,params_net_arch,params_target_update_interval,state
529,529,250.52035522460938,2021-07-05 20:36:03.235431,2021-07-05 20:39:47.708852,0 days 00:03:44.473421000,256,50000,0.03320066254438129,0.26468181778957495,0.999,0,0.0014382849144449225,medium,200,PRUNED
530,530,-0.07132258266210556,2021-07-05 20:36:42.274538,2021-07-05 20:37:39.395250,0 days 00:00:57.120712000,256,50000,0.04458194690865216,0.12419127692557227,0.999,20000,0.00019836182343173586,small,200,PRUNED
531,531,70.2228775024414,2021-07-05 20:37:22.458871,2021-07-05 20:38:22.583673,0 days 00:01:00.124802000,256,50000,0.04311334302786359,0.12413963146497814,0.999,20000,0.00020006645877971205,small,200,PRUNED
532,532,345.53533935546875,2021-07-05 20:37:39.396171,2021-07-05 20:39:09.360795,0 days 00:01:29.964624000,128,50000,0.020086296206078887,0.40524797805290597,0.95,10000,0.0014725960851473198,small,200,PRUNED
533,533,385.0226745605469,2021-07-05 20:38:22.584607,2021-07-05 20:40:31.907689,0 days 00:02:09.323082000,256,50000,0.019122587385394317,0.15203048100336847,0.95,10000,0.0003153053940850234,medium,200,PRUNED
534,534,0.0,2021-07-05 20:39:09.361651,2021-07-05 20:41:21.851342,0 days 00:02:12.489691000,256,100000,0.007447626498648301,0.266685538732716,0.995,10000,0.0019563233355344473,medium,1000,PRUNED
535,535,202.32199096679688,2021-07-05 20:39:47.709691,2021-07-05 20:42:02.340801,0 days 00:02:14.631110000,256,100000,0.19936176069353628,0.48715539801540303,0.995,10000,0.001920326583022394,medium,1000,PRUNED
536,536,408.9693298339844,2021-07-05 20:40:31.908515,2021-07-05 20:42:18.828582,0 days 00:01:46.920067000,256,100000,0.008825822044328456,0.4855180309406729,0.995,5000,0.0003500758861510731,small,1000,PRUNED
537,537,0.0,2021-07-05 20:41:21.852388,2021-07-05 20:43:26.328030,0 days 00:02:04.475642000,256,10000,0.19915473669511663,0.1868952512585561,0.99,5000,0.00036906269091780265,small,1500,PRUNED
538,538,-403.3659362792969,2021-07-05 20:42:02.341836,2021-07-05 20:50:08.725204,0 days 00:08:06.383368000,512,10000,0.05535312876247831,0.1874868660699757,0.99,5000,0.000360029822353987,small,1500,COMPLETE
539,539,343.1282958984375,2021-07-05 20:42:18.829286,2021-07-05 20:44:36.008574,0 days 00:02:17.179288000,512,10000,0.09221143948955318,0.3207869276411187,0.99,5000,3.1256008939774214e-05,small,1500,PRUNED
540,540,-3.714357376098633,2021-07-05 20:43:26.329002,2021-07-05 20:45:57.649140,0 days 00:02:31.320138000,512,10000,0.04026903914536768,0.3850809433649833,0.99,5000,0.002587478945610741,small,5000,PRUNED
541,541,0.0,2021-07-05 20:44:36.009620,2021-07-05 20:46:23.153105,0 days 00:01:47.143485000,256,50000,0.05448569047723555,0.469208841855101,0.9999,10000,0.000248538756191453,small,5000,PRUNED
542,542,-338.5299377441406,2021-07-05 20:45:57.651140,2021-07-05 20:55:26.019335,0 days 00:09:28.368195000,256,50000,0.05347623647808325,0.2883409794587043,0.9999,10000,0.00011502467920711033,medium,200,COMPLETE
543,543,-371.21429443359375,2021-07-05 20:46:23.154151,2021-07-05 20:49:25.876778,0 days 00:03:02.722627000,256,50000,0.02568990828337371,0.4206861034783128,0.9999,0,0.00044136552433797813,medium,200,PRUNED
544,544,19.250429153442383,2021-07-05 20:49:25.877858,2021-07-05 20:51:37.376673,0 days 00:02:11.498815000,128,50000,0.12327174244632445,0.2859881973048759,0.99,20000,0.00029504157872508864,medium,1,PRUNED
545,545,240.77537536621094,2021-07-05 20:50:08.727170,2021-07-05 20:52:04.445293,0 days 00:01:55.718123000,256,50000,0.03015689459895653,0.292396196265715,0.995,20000,0.00028725091556104133,medium,1,PRUNED
546,546,-325.99993896484375,2021-07-05 20:51:37.377776,2021-07-05 20:53:55.266306,0 days 00:02:17.888530000,256,50000,0.013703738950227626,0.39288183298744817,0.995,10000,0.007652939334555524,medium,200,PRUNED
547,547,-187.1356964111328,2021-07-05 20:52:04.446392,2021-07-05 20:54:12.133896,0 days 00:02:07.687504000,1024,500000,0.01379352220071262,0.21796360585987382,0.98,10000,9.364685968595126e-05,small,200,PRUNED
548,548,-337.8446044921875,2021-07-05 20:53:55.267343,2021-07-05 20:56:08.852213,0 days 00:02:13.584870000,1024,500000,0.10649931767973497,0.16924364916920648,0.98,10000,0.012520499019790047,small,200,PRUNED
549,549,-339.9907531738281,2021-07-05 20:54:12.134854,2021-07-05 20:56:04.906755,0 days 00:01:52.771901000,256,100000,0.034220547965178504,0.16930657565796844,0.999,5000,0.0009733067697351445,small,200,PRUNED
550,550,325.7060852050781,2021-07-05 20:55:26.020644,2021-07-05 20:57:12.228681,0 days 00:01:46.208037000,256,100000,0.0030009756212556905,0.44841434951069775,0.9,5000,0.0002096565737570673,small,200,PRUNED
551,551,-365.2802734375,2021-07-05 20:56:04.907675,2021-07-05 20:58:17.894786,0 days 00:02:12.987111000,256,10000,0.004398060391778758,0.34562484332423754,0.99,0,0.011981042626492367,small,200,PRUNED
552,552,-325.2738037109375,2021-07-05 20:56:08.853071,2021-07-05 20:59:46.414599,0 days 00:03:37.561528000,256,10000,0.023321992164087802,0.3432794672879499,0.99,0,0.027795840683884805,medium,200,PRUNED
553,553,-360.8114929199219,2021-07-05 20:57:12.229799,2021-07-05 21:00:50.345841,0 days 00:03:38.116042000,256,10000,0.041821911324985334,0.3467869783397335,0.99,0,1.882391092258665e-05,medium,1,PRUNED
554,554,-220.6781005859375,2021-07-05 20:58:17.896185,2021-07-05 21:01:29.590531,0 days 00:03:11.694346000,256,50000,0.05900372630166703,0.36796241614840386,0.995,5000,5.616694834061252e-05,medium,1,PRUNED
555,555,-5.3062591552734375,2021-07-05 20:59:46.416611,2021-07-05 21:13:36.280460,0 days 00:13:49.863849000,256,50000,0.048038892611203685,0.32775715908898145,0.995,5000,0.017523196176681553,medium,1,COMPLETE
556,556,-226.6912078857422,2021-07-05 21:00:50.346876,2021-07-05 21:03:44.624781,0 days 00:02:54.277905000,256,50000,0.04672099436856379,0.30521076261673896,0.995,5000,0.0002602039526716924,medium,200,PRUNED
557,557,708.5017700195312,2021-07-05 21:01:29.592872,2021-07-05 21:08:01.626109,0 days 00:06:32.033237000,256,50000,0.04866701879470778,0.3094880608596995,0.999,10000,0.00043630278520410547,small,200,COMPLETE
558,558,350.4538269042969,2021-07-05 21:03:44.626055,2021-07-05 21:06:14.107443,0 days 00:02:29.481388000,1024,50000,0.026643736949863626,0.2711233566590551,0.999,10000,0.017836456629447404,small,200,PRUNED
559,559,-0.6752366423606873,2021-07-05 21:06:14.108359,2021-07-05 21:07:11.036547,0 days 00:00:56.928188000,128,100000,0.03864018740159396,0.31463272621997623,0.9999,20000,0.0030880183295047374,small,200,PRUNED
560,560,-0.16482634842395782,2021-07-05 21:07:11.037570,2021-07-05 21:09:29.863741,0 days 00:02:18.826171000,256,50000,0.18913357274357673,0.33100280358908674,0.999,10000,0.00017332279628517932,medium,5000,PRUNED
561,561,0.0,2021-07-05 21:08:01.627823,2021-07-05 21:09:47.042017,0 days 00:01:45.414194000,512,50000,0.04985298206832508,0.32962387724236175,0.999,10000,0.0004745930926459562,small,5000,PRUNED
562,562,0.0,2021-07-05 21:09:29.864711,2021-07-05 21:11:24.688348,0 days 00:01:54.823637000,512,50000,0.046749013915338526,0.3040585928621256,0.999,10000,0.0006723809228249102,small,200,PRUNED
563,563,0.0,2021-07-05 21:09:47.042793,2021-07-05 21:11:20.262267,0 days 00:01:33.219474000,256,50000,0.05124234079822134,0.3131098282770457,0.999,10000,0.0005655261769076179,small,200,PRUNED
564,564,386.8853759765625,2021-07-05 21:11:20.263335,2021-07-05 21:14:44.760796,0 days 00:03:24.497461000,256,50000,0.04629520426277095,0.3048858701573478,0.999,10000,0.0005604027964374219,small,1,PRUNED
565,565,346.55230712890625,2021-07-05 21:11:24.690532,2021-07-05 21:14:35.930801,0 days 00:03:11.240269000,256,50000,0.04398973403043678,0.3195248013013863,0.999,10000,0.00041854482036952196,small,1,PRUNED
566,566,0.0,2021-07-05 21:13:36.282254,2021-07-05 21:16:57.778053,0 days 00:03:21.495799000,256,50000,0.049320117079841144,0.3141246599786566,0.999,10000,0.0004318030563719045,small,1,PRUNED
567,567,0.0,2021-07-05 21:14:35.931940,2021-07-05 21:17:46.462790,0 days 00:03:10.530850000,256,50000,0.04848579170328139,0.3273420786018886,0.999,10000,0.023425251577408802,small,1,PRUNED
568,568,-269.19464111328125,2021-07-05 21:14:44.763469,2021-07-05 21:29:26.243920,0 days 00:14:41.480451000,1024,50000,0.053475533766360606,0.32592440156442004,0.999,10000,0.013123893422232755,small,1,COMPLETE
569,569,380.2767333984375,2021-07-05 21:16:57.779480,2021-07-05 21:20:11.233486,0 days 00:03:13.454006000,1024,50000,0.054636438651649515,0.32490966501931157,0.999,10000,0.00035717322572096006,small,1,PRUNED
570,570,270.7398681640625,2021-07-05 21:17:46.464099,2021-07-05 21:21:08.148036,0 days 00:03:21.683937000,1024,50000,0.05167015637213949,0.3150098081219357,0.999,10000,0.019676273198055445,small,1,PRUNED
571,571,0.0,2021-07-05 21:20:11.235908,2021-07-05 21:22:48.877404,0 days 00:02:37.641496000,256,50000,0.04241625455450378,0.3286078270489962,0.99,10000,0.014951614568441785,small,1,PRUNED
572,572,-227.1881103515625,2021-07-05 21:21:08.149248,2021-07-05 21:24:21.050620,0 days 00:03:12.901372000,256,50000,0.05745169786849436,0.3292229177717517,0.99,5000,0.016469431014004454,small,1,PRUNED
573,573,0.0,2021-07-05 21:22:48.878522,2021-07-05 21:25:50.864138,0 days 00:03:01.985616000,256,50000,0.05817180727662569,0.33617547237492273,0.95,5000,0.0005350340754288692,small,1,PRUNED
574,574,162.11912536621094,2021-07-05 21:24:21.051572,2021-07-05 21:27:37.931559,0 days 00:03:16.879987000,256,50000,0.04160216182853764,0.3366893360798144,0.95,5000,0.02069036568232793,small,1,PRUNED
575,575,159.73593139648438,2021-07-05 21:25:50.865200,2021-07-05 21:28:37.028909,0 days 00:02:46.163709000,512,50000,0.03994764825839891,0.30080662476600245,0.995,10000,0.017035558795548203,small,1,PRUNED
576,576,417.5164489746094,2021-07-05 21:27:37.932706,2021-07-05 21:29:51.476432,0 days 00:02:13.543726000,512,50000,0.045373856347117894,0.3032034576918057,0.995,10000,0.012586806015778303,small,1000,PRUNED
577,577,0.0,2021-07-05 21:28:37.030031,2021-07-05 21:29:35.039556,0 days 00:00:58.009525000,128,50000,0.04635852718713533,0.2961043373975302,0.999,20000,0.0007388983119799966,small,1000,PRUNED
578,578,-3.1999528408050537,2021-07-05 21:29:26.245666,2021-07-05 21:30:37.022475,0 days 00:01:10.776809000,1024,50000,0.05375662587523802,0.32010271140722335,0.999,20000,0.01824460470810815,small,1000,PRUNED
579,579,0.0,2021-07-05 21:29:35.040283,2021-07-05 21:31:34.413520,0 days 00:01:59.373237000,1024,50000,0.05522103872591997,0.320751307216189,0.999,10000,0.01494074830942383,small,1500,PRUNED
580,580,275.4411926269531,2021-07-05 21:29:51.477314,2021-07-05 21:32:20.849035,0 days 00:02:29.371721000,1024,50000,0.05287545852195205,0.3206732162414635,0.999,5000,0.009801976046526585,small,1500,PRUNED
581,581,0.0,2021-07-05 21:30:37.023602,2021-07-05 21:33:08.215694,0 days 00:02:31.192092000,1024,50000,0.06268716208753522,0.3227061955967589,0.999,5000,0.01042070868154083,small,1500,PRUNED
582,582,-373.60479736328125,2021-07-05 21:31:34.414669,2021-07-05 21:34:11.863158,0 days 00:02:37.448489000,1024,50000,0.05059222890365828,0.0006331137275598919,0.999,5000,0.009916806979191922,small,1500,PRUNED
583,583,-64.51238250732422,2021-07-05 21:32:20.850154,2021-07-05 21:35:05.530489,0 days 00:02:44.680335000,1024,50000,0.06289163745645741,0.33301151711918897,0.999,5000,0.008552795658145203,small,10000,PRUNED
584,584,-50.71524429321289,2021-07-05 21:33:08.217027,2021-07-05 21:35:36.954147,0 days 00:02:28.737120000,1024,10000,0.06019003152369465,0.3492351261188259,0.999,10000,0.043047415630585416,small,10000,PRUNED
585,585,411.7173767089844,2021-07-05 21:34:11.864151,2021-07-05 21:37:18.693225,0 days 00:03:06.829074000,1024,10000,0.0578123942381852,0.3496454802933786,0.999,10000,0.013212979247846906,small,1,PRUNED
586,586,-1.2287088632583618,2021-07-05 21:35:05.531530,2021-07-05 21:37:59.966393,0 days 00:02:54.434863000,1024,10000,0.059515060987272606,0.3108204776216523,0.999,10000,0.013044659078168453,small,1,PRUNED
587,587,-1.6898998022079468,2021-07-05 21:35:36.954907,2021-07-05 21:38:22.135976,0 days 00:02:45.181069000,1024,10000,0.049200567499343394,0.3407459428409479,0.999,10000,0.0204303725227364,small,1,PRUNED
588,588,-6.9273176193237305,2021-07-05 21:37:18.694817,2021-07-05 21:40:50.043881,0 days 00:03:31.349064000,1024,50000,0.05050508115443273,0.3116106436743401,0.98,10000,0.013734309046691751,medium,5000,PRUNED
589,589,0.0,2021-07-05 21:37:59.967547,2021-07-05 21:42:08.016367,0 days 00:04:08.048820000,1024,50000,0.04764172912001876,0.33420677536478,0.995,5000,0.022147756947201454,medium,5000,PRUNED
590,590,-78.6024398803711,2021-07-05 21:38:22.136806,2021-07-05 21:42:33.386508,0 days 00:04:11.249702000,1024,50000,0.04782344055299288,0.0522876939053466,0.98,5000,0.017150199253451057,medium,5000,PRUNED
591,591,0.0,2021-07-05 21:40:50.044852,2021-07-05 21:45:27.209546,0 days 00:04:37.164694000,1024,50000,0.04369926446699841,0.33711434327830425,0.995,5000,0.023077342728561514,medium,200,PRUNED
592,592,0.0,2021-07-05 21:42:08.017412,2021-07-05 21:43:00.269117,0 days 00:00:52.251705000,512,50000,0.04354093466093392,0.3101957922902269,0.995,20000,0.015345605725849058,small,200,PRUNED
593,593,-263.3554382324219,2021-07-05 21:42:33.388299,2021-07-05 21:43:24.281425,0 days 00:00:50.893126000,512,50000,0.16768586028883245,0.36212157218541047,0.995,20000,2.4063952380376432e-05,small,200,PRUNED
594,594,10.790445327758789,2021-07-05 21:43:00.270462,2021-07-05 21:44:31.717896,0 days 00:01:31.447434000,128,50000,0.05329659727207495,0.35733772814687387,0.999,1000,2.7419971039453452e-05,small,200,PRUNED
595,595,0.0,2021-07-05 21:43:24.282270,2021-07-05 21:46:25.867085,0 days 00:03:01.584815000,128,50000,0.03814717794168113,0.3261062101295486,0.9,1000,0.011062502234295387,medium,200,PRUNED
596,596,431.86956787109375,2021-07-05 21:44:31.718769,2021-07-05 21:48:30.383952,0 days 00:03:58.665183000,256,10000,0.038662303670078425,0.32677148596300176,0.999,5000,0.011905073355408538,medium,1,PRUNED
597,597,0.0,2021-07-05 21:45:27.210926,2021-07-05 21:48:52.817333,0 days 00:03:25.606407000,256,10000,0.06960503648159831,0.2996327636718899,0.9,10000,0.010837387586066106,medium,1,PRUNED
598,598,254.47117614746094,2021-07-05 21:46:25.868251,2021-07-05 21:48:38.469045,0 days 00:02:12.600794000,256,10000,0.06879107529897385,0.2964785850202676,0.999,10000,3.525077191850218e-05,small,1,PRUNED
599,599,-376.4563903808594,2021-07-05 21:48:30.385084,2021-07-05 21:50:26.547611,0 days 00:01:56.162527000,256,10000,0.055662966604225345,0.29663938969722425,0.999,10000,0.032796698379909624,small,1000,PRUNED
600,600,0.0,2021-07-05 21:48:38.470252,2021-07-05 21:50:29.699450,0 days 00:01:51.229198000,256,50000,0.18113160846936788,0.19492158892123748,0.98,10000,0.0003052809480051256,small,1000,PRUNED
601,601,422.70526123046875,2021-07-05 21:48:52.818091,2021-07-05 21:51:06.602870,0 days 00:02:13.784779000,256,50000,0.19272088455599823,0.19495382663828478,0.98,5000,0.00031796762377294844,small,1000,PRUNED
602,602,398.52667236328125,2021-07-05 21:50:26.548628,2021-07-05 21:52:37.284316,0 days 00:02:10.735688000,256,50000,0.080773938999837,0.31899542666253167,0.98,5000,0.0003233750334755265,small,200,PRUNED
603,603,397.6263122558594,2021-07-05 21:50:29.700662,2021-07-05 21:52:35.121950,0 days 00:02:05.421288000,256,50000,0.04260588337865035,0.49776373314867634,0.995,5000,0.00048501808833790756,small,200,PRUNED
604,604,413.1555480957031,2021-07-05 21:51:06.603968,2021-07-05 21:54:24.057342,0 days 00:03:17.453374000,256,50000,0.03525991964574593,0.31521220615579937,0.995,5000,0.007330642521161622,medium,200,PRUNED
605,605,220.63592529296875,2021-07-05 21:52:35.123496,2021-07-05 21:54:06.950436,0 days 00:01:31.826940000,512,50000,0.03603128348861441,0.313696425878787,0.995,20000,0.0002308352634431686,medium,200,PRUNED
606,606,229.8041534423828,2021-07-05 21:52:37.285901,2021-07-05 21:54:19.876190,0 days 00:01:42.590289000,512,50000,0.03464889571576982,0.3093280149040662,0.95,20000,0.0008982761161608692,medium,200,PRUNED
607,607,193.855224609375,2021-07-05 21:54:06.951488,2021-07-05 21:56:18.333368,0 days 00:02:11.381880000,256,50000,0.052100036155304376,0.22434254563399908,0.95,10000,0.0008669588253537768,medium,10000,PRUNED
608,608,98.73017120361328,2021-07-05 21:54:19.877356,2021-07-05 21:56:39.040219,0 days 00:02:19.162863000,256,50000,0.05231016116930567,0.28516247396612854,0.999,10000,0.00042532836329170915,medium,10000,PRUNED
609,609,-406.630859375,2021-07-05 21:54:24.058125,2021-07-05 21:56:23.619005,0 days 00:01:59.560880000,1024,10000,0.04663955822313689,0.11160425423979599,0.999,10000,0.0004073969473754803,small,10000,PRUNED
610,610,402.9470520019531,2021-07-05 21:56:18.334472,2021-07-05 21:59:06.997467,0 days 00:02:48.662995000,1024,10000,0.04697354327045376,0.3415338811101428,0.999,10000,0.00025603821081777414,small,1500,PRUNED
611,611,357.96514892578125,2021-07-05 21:56:23.619677,2021-07-05 21:58:35.037376,0 days 00:02:11.417699000,256,50000,0.041409325562254434,0.2825142631414239,0.999,10000,0.0006502164016217551,small,1,PRUNED
612,612,-0.5018979907035828,2021-07-05 21:56:39.041332,2021-07-05 21:58:56.364170,0 days 00:02:17.322838000,256,10000,0.01625464494518317,0.17837816803745904,0.99,5000,0.0002435712218886722,small,1500,PRUNED
613,613,334.7532958984375,2021-07-05 21:58:35.038542,2021-07-05 22:00:19.548574,0 days 00:01:44.510032000,256,10000,0.18459523748343534,0.14621876808077766,0.99,5000,0.0002538127629866669,small,1500,PRUNED
614,614,346.5052185058594,2021-07-05 21:58:56.365330,2021-07-05 22:01:25.179158,0 days 00:02:28.813828000,1024,50000,0.19748283695862084,0.33757724570362796,0.995,5000,0.00025918458244062934,small,200,PRUNED
615,615,-215.91799926757812,2021-07-05 21:59:06.998205,2021-07-05 22:01:55.845210,0 days 00:02:48.847005000,256,50000,0.010248191961702473,0.15190606194635398,0.995,5000,0.0049189841628827745,medium,200,PRUNED
616,616,-167.7696990966797,2021-07-05 22:00:19.549786,2021-07-05 22:02:57.308333,0 days 00:02:37.758547000,256,50000,0.039949691869228685,0.32975892798340395,0.995,5000,0.00019858878325123538,medium,200,PRUNED
617,617,90.3839111328125,2021-07-05 22:01:25.180247,2021-07-05 22:02:38.187819,0 days 00:01:13.007572000,256,50000,0.010490967212796808,0.30437880029752534,0.995,20000,0.0003478118704366667,medium,5000,PRUNED
618,618,14.148089408874512,2021-07-05 22:01:55.845943,2021-07-05 22:03:14.785942,0 days 00:01:18.939999000,256,50000,0.0320456675208747,0.3057335239914802,0.99,20000,4.3303647956036274e-05,medium,5000,PRUNED
619,619,0.0,2021-07-05 22:02:38.188992,2021-07-05 22:06:09.830106,0 days 00:03:31.641114000,512,50000,0.0323765648706622,0.3267515391941638,0.99,10000,4.142401830775911e-05,medium,200,PRUNED
620,620,-345.22357177734375,2021-07-05 22:02:57.309055,2021-07-05 22:05:38.107145,0 days 00:02:40.798090000,512,50000,0.07683166933740705,0.21329584516797062,0.99,10000,4.062867553124017e-05,small,1,PRUNED
621,621,-20.794551849365234,2021-07-05 22:03:14.786835,2021-07-05 22:05:33.949606,0 days 00:02:19.162771000,128,10000,0.03040239636811369,0.20895159119602447,0.99,10000,0.01659286283894567,small,1,PRUNED
622,622,338.1395263671875,2021-07-05 22:05:33.950754,2021-07-05 22:07:39.023801,0 days 00:02:05.073047000,512,50000,0.05666425048817965,0.32161499427121326,0.999,10000,0.0005042637161830274,small,200,PRUNED
623,623,319.6607971191406,2021-07-05 22:05:38.107975,2021-07-05 22:07:24.448102,0 days 00:01:46.340127000,256,50000,0.059243489452025386,0.3186582054292818,0.999,10000,0.0011135888170630294,small,200,PRUNED
624,624,375.8556823730469,2021-07-05 22:06:09.831072,2021-07-05 22:08:21.194351,0 days 00:02:11.363279000,256,100000,0.05515757132776383,0.13603608099728712,0.999,5000,0.00014948501811158635,small,200,PRUNED
625,625,348.9058837890625,2021-07-05 22:07:24.448971,2021-07-05 22:09:18.798105,0 days 00:01:54.349134000,256,100000,0.05680352215541968,0.3545579596472134,0.999,5000,0.00037728420660024307,small,200,PRUNED
626,626,-315.63751220703125,2021-07-05 22:07:39.024594,2021-07-05 22:10:27.552625,0 days 00:02:48.528031000,256,100000,0.0493664389678372,0.3513185881798196,0.98,5000,0.00031252274448324575,medium,200,PRUNED
627,627,-306.61083984375,2021-07-05 22:08:21.195549,2021-07-05 22:26:22.570450,0 days 00:18:01.374901000,1024,10000,0.04428333044505774,0.3493535924595981,0.98,5000,1.5058840831663494e-05,medium,1,COMPLETE
628,628,169.26210021972656,2021-07-05 22:09:18.799126,2021-07-05 22:13:21.524111,0 days 00:04:02.724985000,1024,10000,0.04454995834929478,0.2904896441334932,0.98,10000,1.5945067435046222e-05,medium,1,PRUNED
629,629,-347.8049011230469,2021-07-05 22:10:27.553790,2021-07-05 22:14:38.216794,0 days 00:04:10.663004000,1024,10000,0.04374677058336093,0.24008868612748624,0.995,10000,0.02584790848670948,medium,1,PRUNED
630,630,-0.8500897288322449,2021-07-05 22:13:21.525295,2021-07-05 22:14:06.139998,0 days 00:00:44.614703000,256,50000,0.03824629348938013,0.18541357453387644,0.995,20000,0.025198357594797702,small,1000,PRUNED
631,631,-273.3246765136719,2021-07-05 22:14:06.140859,2021-07-05 22:16:26.171509,0 days 00:02:20.030650000,256,10000,0.08605440048294646,0.25537682283173435,0.99,10000,0.014159382816751413,medium,200,PRUNED
632,632,-0.8500897288322449,2021-07-05 22:14:38.217885,2021-07-05 22:16:17.982517,0 days 00:01:39.764632000,256,50000,0.19974106265014985,0.27811890953454116,0.95,5000,0.014755961877997126,small,200,PRUNED
633,633,-3.8250515460968018,2021-07-05 22:16:17.983938,2021-07-05 22:18:45.250287,0 days 00:02:27.266349000,256,50000,0.019336879333968063,0.15984010703803816,0.99,10000,0.00856202288024349,medium,5000,PRUNED
634,634,222.12823486328125,2021-07-05 22:16:26.172896,2021-07-05 22:18:00.988519,0 days 00:01:34.815623000,256,50000,0.017635991090690598,0.37202811493573446,0.9999,5000,0.00020826036135213624,small,5000,PRUNED
